,Title,Lyrics
57,"Gdziekolwiek idę, z Tobą chce iść ","Everywhere I go, I wanna go with You
Everywhere I go, I wanna go with You
Just everywhere I go, I wanna go with You tonight
Only this night
Everywhere I go, I wanna go with You

Cause it's true I love You
Cause it's true I love You

Everywhere I go, I wanna go with You
Everywhere I go, I wanna go with You
Just everywhere I go, I wanna go with You tonight
Only this night
Everywhere I go, I wanna go with You

Cause it's true I love You
Cause it's true I love You

Cause it's true I love You
Cause it's true I love You
Cause it's true I love You"
58,Generał Ferreira ,"Taki czas zdarza się raz na sto lat 
 I musisz godnie go przywitać 
 W domu musisz zrobić porządek 
 Odpowiadać tym, co będą pytać 
 Czy wiesz ile jest teraz pracy? 
 To ponad ludzkie siły 
 Więc mów nam, gdzie Twój syn 
 Musimy porozmawiać z nim 

 Oddaj go nam... 
 Oddaj go nam... 
 Oddaj go nam... 
 Oddaj go nam... 

 Ci ludzie co biorą Ci mamę i mnie 
 Ci ludzie co biorą Ci dom 
 Ci ludzie co biorą całą Twoją pracę 
 Ci ludzie co dają Ci broń 
 Ci ludzie co biorą Ci mamę i mnie 
 Ci ludzie co biorą Twój dom 
 Ci ludzie co biorą całe Twoje życie 
 Chcą podać Ci swoją dłoń 

 To rząd oficjalny, system totalitarny 
 Rząd oficjalny, dobrze skonstruowany 
 Rząd oficjalny, system totalitarny 
 Rząd oficjalny zawsze totalitarny 

 Taki czas zdarza się raz na sto lat 
 Musimy wszystko przygotować 
 Wszystko dokoła przypilnować 
 I Ty przecież nam pomożesz 
 W naszym domu każdy brud trzeba odszukać 
 I Ty z nami brudu szukaj 
 I Ty może jeszcze o tym nie wiesz 
 Lecz Ty będziesz z nami brudu szukać 

 Oddaj go nam... 
 Oddaj go nam... 
 Oddaj go nam... 
 Oddaj go nam... 

 Ci ludzie co biorą Ci mamę i mnie 
 Ci ludzie co biorą Ci dom 
 Ci ludzie co biorą całą Twoją pracę 
 Ci ludzie co dają Ci broń 
 Ci ludzie co biorą Ci mamę i mnie 
 Ci ludzie co biorą Twój dom 
 Ci ludzie co biorą całe Twoje życie 
 Chcą podać Ci swoją dłoń 

 To rząd oficjalny, system totalitarny 
 Rząd oficjalny, dobrze skonstruowany 
 Rząd oficjalny, system totalitarny 
 Rząd oficjalny, on zawsze totalitarny, tak 

 Ci ludzie co biorą Ci mamę i mnie 
 Ci ludzie co biorą Ci dom 
 Ci ludzie co biorą całe Twoje życie 
 Ci ludzie co dają Ci broń 
 Ci ludzie co biorą Ci mamę i mnie 
 Ci ludzie co biorą Twój dom 
 Ci ludzie co biorą całe Twoje życie 
 Chcą podać Ci swoją dłoń 

 To rząd oficjalny, system totalitarny 
 Rząd oficjalny, dobrze skonstruowany 
 Rząd oficjalny, system totalitarny 
 Rząd oficjalny, on zawsze totalitarny jest.."
59,Gigantyczna koncentracja ,"Coraz silniej ja z wiekiem to czuję
Wiem, że Bozia nie obroni mnie
Gigantycznej koncentracji potrzebuję

Coraz mocniej ja z wiekiem to wiem
Gigantyczna koncentracja czeka mnie
Wiem, że Bozia nie obroni mnie

I krańce z boku
I jeden cel
I ja mam Cię na oku
Ty rządź i dziel
Naprawię, co zepsułem
Niejeden z nas
Na Boga czeka trujący gaz
Niewiara jest potworna
Niewiara jest torturą
Modlitwa nie ma końca
Tortura jest torturą, którą...

Wiem, że Bozia nie obroni mego domu
Jeśli ja nie zechcę bronić go tu sam
Gigantycznej koncentracji falochronu jak
Używam, używam tak jak mam
Używam, używam tak jak mam

Coraz mocniej ja z wiekiem to wiem
A czy z wiedzą tą mi dobrze czy też źle
Gigantyczna koncentracja czeka mnie

Co mam w sobie dobrego
Policzę i wam dam
Niewiara jest dlatego
Że chciałbym to, co mam

Coraz mocniej ja z wiekiem to czuję
Wiem, że Bozia nie obroni mnie
Gigantycznej koncentracji potrzebuję

I krańce z boku
I jeden cel
Chociażby jeden w roku dzień
Naprawię, co zepsułem
Niejeden z nas
Na Boga czeka trujący gaz
Niewiara jest udręką
Niewiara męką jest
Modlitwa bez początku
Niewiara jak kara jest

Coraz mocniej ja z wiekiem to wiem
Gigantyczna koncentracja czeka mnie
Wiem, że Bozia mnie nie uratuje

Wiem, że Bozia nie obroni mego domu
Jeśli ja nie zechcę bronić go tu sam
Gigantycznej koncentracji falochronu jak
Używam, używam tak jak mam
Używam, używam tak jak mam

I krańce z boku
I jeden cel
Samotny i w rynsztoku
Posunę się
Naprawię, co zepsułem
Niejeden z nas
Na Boga czeka trujący gaz

Coraz mocniej ja z wiekiem to wiem
A czy z wiedzą tą mi dobrze czy też źle
Gigantyczna koncentracja czeka mnie"
60,Goopya peezda ,"Głupia pizdo, za to co zrobiłaś, więcej ręki ci nie podam 
To co robisz, w świecie w którym żyjesz - pewnie wielu się podoba 

Nie kochaj rzeczy, które z tego świata są i w nim są 
Nie patrzaj w blask, który świeci, bo świeci odbiciem tylko 

On jest chory, on jest zarażony, on jest zakażony tobą 
Twoja dusza, twoje całe ciało - tak, na zatracenie wiodą 

Nie kochaj rzeczy, które z tego świata są i w nim są 
Nie patrzaj w blask, który świeci, bo świeci odbiciem tylko 

Stare czasy, stare dobre czasy - one nigdy już nie wrócą 
Rzeczy które, które mi zrobiłaś - z moim światem tak się kłócą 

Nie kochaj rzeczy, które z tego świata są i w nim są 
Nie patrzaj w blask, który świeci, bo świeci odbiciem tylko."
61,Grosstanz ,"Wielki taniec, ostatni taniec, ostatni taniec tego świata 
Wielki taniec, ostatni taniec, świat bawi się umierając 
Wielki taniec, ostatni taniec, ostatni taniec tego świata 
Wielki taniec, ostatni taniec, świat bawi się umierając 

Co się narodziło z ciała - to ciałem jest 
A co się narodziło z ducha - duchem jest 
Co się narodziło z ducha - duchem jest! 
Co się narodziło z ciała - ciałem jest! 

Teraz odbywa się sąd nad tym światem 
Teraz władca tego świata będzie wyrzucony 
Teraz odbywa się sąd nad tym światem 
Teraz odbywa się sąd nad tym światem 
Teraz odbywa się sąd nad tym światem 
Teraz władca tego świata będzie wyrzucony! 

Kto miłuje życie swoje - utraci je 
A kto nienawidzi życia swego, zachowa je ku żywotowi wiecznemu 
Kto miłuje życie swoje - utraci je! 
A kto nienawidzi życia swego, zachowa je ku żywotowi wiecznemu! 

Bo większa będzie radość w niebie 
Z jednego grzesznika co się opamiętał 
Niż z setki sprawiedliwych, którzy opamiętania nie potrzebują 
Większa będzie radość w niebie 
Z jednego grzesznika co się opamiętał 
Niż z setki sprawiedliwych, którzy opamiętania nie potrzebują 

Wielki taniec, ostatni taniec, świat bawi się umierając 
Grosstanz! 
Grosstanz! 
Grosstanz! 
Grosstanz! 

Die Matrosen von Kronstadt 
Alle tanzen Grosstanz 
Die Lehrerin auf Karl Marx Stadt 
Sie tanzt Grosstanz auch 
Die Matrosen von Kronstadt 
Alle tanzen Grosstanz 
Die Lehrerin auf Karl Marx Stadt 
Sie tanzt Grosstanz auch 

Alle tanzen Grosstanz! 
Alle tanzen Grosstanz! 
Alle tanzen Grosstanz! 
Alle tanzen Grosstanz! 
Alle tanzen Grosstanz! 
Alle tanzen Grosstanz! 
Alle tanzen Grosstanz! 
Alle tanzen Grosstanz! 

Das ist der Mord ueber ein Welt 
Grosstanz das ist eine schreckliche Edil 
Und seine schreckliche Edil haben die ganzen Planeten 
Und sie aber sie wuessten seinen Planeten nicht genau 

Alle tanzen Grosstanz! 
Alle tanzen Grosstanz! 
Alle tanzen Grosstanz! 
Alle tanzen Grosstanz! 
Alle tanzen Grosstanz! 
Alle tanzen Grosstanz! 
Alle tanzen Grosstanz! 
Alle tanzen Grosstanz! 

Grosstanz! 
Grosstanz! 
Grosstanz! 
Volkstanz! 
Grosstanz! 
Grosstanz! 
Grosstanz! 
Volkstanz! 

Każdy kto się wywyższa będzie poniżony 
A każdy kto się poniża będzie wywyższony 
Każdy kto się wywyższa będzie poniżony 
A każdy kto się poniża będzie wywyższony! 

Albowiem gdzie jest skarb wasz, tam będzie i serce wasze 
Albowiem gdzie jest skarb wasz, tam będzie i serce wasze! 
Tam będzie i serce wasze! 
Tam będzie i serce wasze! 
A bądźcie gotowi, bo Syn Człowieczy 
Wróci o takiej godzinie, której się nie spodziewacie 
A bądźcie gotowi, 
Bo Syn Człowieczy 
Bo Syn Człowieczy 
Bo Syn Człowieczy 
Wróci o takiej godzinie, której się nie spodziewacie! 

Tak było jest i będzie, kto ma oczy do słuchania niechaj słucha! 
Tak było jest i będzie, kto ma 
Tak było jest i będzie, kto ma 
Tak było jest i będzie, kto ma 
Tak było jest i będzie, kto ma 
Tak było jest i będzie, kto ma oczy, uszy do słuchania niechaj słucha! 

Grosstanz! 
Grosstanz! 
Grosstanz! 
Volkstanz! 
Grosstanz! 
Grosstanz! 
Grosstanz! 
Volkstanz! 
Grosstanz! 
Grosstanz! 
Grosstanz! 
Volkstanz! 
Grosstanz! 
Grosstanz! 
Grosstanz! 
Volkstanz! 

Wielki taniec, wielki taniec, wielki taniec 
Ostatni taniec 
Wielki taniec, wielki taniec, wielki taniec 
Ostatni taniec 
Wielki taniec, wielki taniec, wielki taniec 
Ostatni taniec 
Wielki taniec, wielki taniec, wielki taniec 
Ostatni taniec 
Taniec! 
"
62,Grzesznik ,"Ściągnąłem księdzu sygnet z palca 
Gdy obok mnie usiadł na wersalce 
A gdy potem upił się winem 
Wstrzyknąłem mu w nogę lidokainę 

Bo jestem grzesznikiem i o tym wiem 
O tym wiem, że jestem grzesznikiem 
Jestem grzesznikiem i o tym wiem 
O tym wiem, że jestem grzesznikiem 

Wierzę w rzeczy co się nie kończą 
To co dobrze widać szybko się skończy 
Wszystko na tym świecie minie 
A moje słowo nie przeminie 

By włożyć Ci obrączkę na palec 
Spowiednika okłamałem 
Potem skopałem Olafa z Berlina 
Ledwo się na nogach utrzymał 

Bo jestem grzesznikiem i o tym wiem 
Grzesznikiem jestem tak to wiem 
Jestem grzesznikiem i o tym wiem 
Grzesznikiem jestem tak to wiem 

Jestem świętym - czy ta różnica 
Taka różnica mnie nie zachwyca 
Jestem świętym - taka różnica 
Taka różnica mnie nie zachwyca 

Jaaaaa jestem grzesznikiem i o tym wiem 
O tym wiem, że jestem grzesznikiem 
Jestem grzesznikiem i o tym wiem 
O tym wiem, że jestem grzesznikiem 

Jestem świętym - taka różnica 
Taka różnica mnie nie zachwyca 
Jestem świętym - taka różnica 
Taka różnica mnie nie zachwyca 

Kto ma rozum, ten często błądzi 
Kto ciągle szuka winy ten zabłądzi 
Niech życie płynie zgodnie z własnym sumieniem 
Kierując się odruchu sercem 

Ja, ja, ja jestem grzesznikiem i o tym wiem 
O tym wiem, że jestem grzesznikiem 
Jestem grzesznikiem i o tym wiem 
Grzesznikiem jestem tak to wiem."
63,Gwiazda szeryfa ,"Zabłysła gwiazda, szeryfa znak 
W zaroślach szmer, to banda zbirów czai się tak 
Źrenicą patrzą w siebie lufy dwie 
Papierowe miasto pali się! 

U wrót czterema kopytami zarył się koń, 
Zarobił kulkę Bill gdy Bessie śmiała się doń 
Ten western przecież dobrze z życia każdy zna 
Gdy szczęście blisko to zza węgła pada strzał. 

O szeryf, szeryf - o le, le, le 
Do olster sięgnij i pokonaj moce złe 
Bo dobro trwalsze jest od skał 
W wszystko zło przepada, gdy twój zagrzmi strzał. 

Do świtu jeszcze wiele godzin, wiele snów 
A w domu tyle niepotrzebnych drętwych mów 
Przyzywa zimnym blaskiem neonowych łun 
Na rogu ofiar i obrońców bar saloon. 

To banda pije, wszak ich znasz 
Patrz jak fałszywie się uśmiecha każda twarz 
Ty razem z nimi brzęknij w szkło 
Czekając na szeryfa, co wypleni zło. 

Gdzie jesteś szeryf, Gdzie? Gdzie? Gdzie? 
Nie pozwól nam do końca rozczarować się 
To przecież dobro trwalsze miało być od zła 
A nocy mrok miał krócej trwać od świateł dnia. 
Szeryfów nie ma, nie nie nie nie nie 
Nie zagrzmią złote kolby, banda naprzód prze 
Cierpliwa kropla drąży skały złom 
Tornado wyje ciemną nocą chwieje się dom 
Bum! 

Kup bilet i na western spiesz 
Gdy się nie cieszysz życiem, to się śmiercią ciesz 
A kiedy błysną światła, zmilknie kamer szum 
Spójrz na ulicę - to szeryfów stąpa tłum. 
Obejmij dłonią kolbę, palcem zmacaj spust 
Bądź czujny i nic nie mów, ani pary z ust 
Choć nawet zegar dziejów bije smutny ton 
To twoje serce prawdę mówi a nie on. 

O szeryf, szeryf, ty trzymaj się 
Tak bardzo dobrze nie jest, ale nie jest źle 
Pamiętaj bez zbytecznych słów 
Dopóki żyjesz możesz walić z obu luf 
Bum! bum! 

O szeryf, szeryf, a ty trzymaj się 
Tak bardzo dobrze nie jest, ale nie jest źle 
Pamiętaj bez zbytecznych słów 
Dopóki żyjesz możesz walić z obu luf."
64,"Hej, czy nie wiecie ","Widziałem, wyrywali sobie ścierwo zębami 
Widziałem, grozili sobie karabinami 
Widziałem, podawali sobie z uśmiechem dłonie 
Widziełem, siadali na tronie w koronie 
Widziałem, chodzili po sobie butami 
Widziałem, jeździli po sobie czołgami 

Hej, czy nie wiecie, nie macie władzy na świecie 
Hej, czy nie wiecie, nie macie władzy na świecie 
Hej, czy nie wiecie, nie macie władzy na świecie 
Hej, czy nie wiecie, nie macie władzy na świecie 
Hej, czy nie wiecie, nie, nie, nie macie władzy 
Hej, czy nie wiecie, nie wasza władza na świecie 
Hej, czy nie wiecie, nie macie władzy na świecie 
Hej, czy nie wiecie, na świecie! 

Widziałem, podawali sobie z uśmiechem dłonie 
Widziałem, siadali na tronie w koronie 
Widziałem, chodzili po sobie butami 
Widziałem, jeździli po sobie czołgami 
Widziałem, wyrywali sobie ścierwo zębami 
Widziałem, grozili sobie karabinami 

Hej, czy nie wiecie, nie macie władzy na świecie 
Hej, czy nie wiecie, nie macie władzy na świecie 
Hej, czy nie wiecie, nie macie władzy na świecie 
Hej, czy nie wiecie, nie macie władzy na świecie 
Hej, czy nie wiecie, nie, nie, nie macie władzy 
Hej, czy nie wiecie, nie wasza władza na świecie 
Hej, czy nie wiecie, nie macie władzy na świecie 
Hej, czy nie wiecie, na świecie!"
65,Henryk Wujek ,"Po jednej stronie stali wałkonie, po drugiej przeciwległej stali chuje 
Pomiędzy nimi siedzieli imbecyle i to właśnie do nich mówił Henryk Wujek 
Mówił wyraźnie i bardzo powoli, imbecyle jednak nic nie rozumieli 
""Papież przyjedzie i pobłogosławi"" - na Wujka mowę swą odpowiedź mieli 

Czy to normalne? Czy tak się teraz dzieje? 
Że prosto w oczy moje mi się śmiejesz? 
Czy to normalne? Czy czasy tak stanowią? 
Że w moim domu na mój dywan plują? 

Wałkonie spali lub gazety czytali, po drugiej stronie zapanował chaos 
Rozeszły się wieści, że dawać będą jeszcze, tyle ile do kieszeni się zmieści 
Henryk Wujek próżno o spokój błagał, w tym bajzlu nikt go słuchać nie chciał 
Zrezygnowany w końcu opuścił swoje włości, cofnął się w imię solidarności i miłości 

Czy to normalne? Czy tak się teraz dzieje? 
Że prosto w oczy z moich praw się śmiejesz? 
Czy to normalne? Czy to są czasu znaki? 
Że uczą mnie jak kochać swe dzieciaki? 

Czy to normalne? Czy tak się teraz dzieje? 
Że prosto w oczy z moich praw się śmiejesz? 
Czy to normalne? Czy to są czasu znaki? 
Że uczą mnie jak kochać swe dzieciaki? 

Czy to normalne? Czy tak się teraz dzieje? 
Że prosto w oczy moje mi się śmiejesz? 
Czy to normalne? Czy czasy tak stanowią? 
Że w moim domu na mój dywan plują? 

Czy to normalne? Czy tak się teraz dzieje? 
Że prosto w oczy z moich praw się śmiejesz? 
Czy to normalne? Czy to są czasu znaki? 
Że uczą mnie jak kochać swe dzieciaki?"
66,Historia pewnej miłości ,"Opowiem wam jeszcze jedną z życia historię 
Na tym brudnym podwórku w bramie kiedyś stał człowiek 
Był starszy ode mnie o jakieś cztery lata 
Umarł, zanim pomoc nadjechała 
Miał córkę. Zostawił ją samą 
W mieszkaniu na parterze ale z kiblem na zewnątrz 
Płakała po nocach, a i proszki połykała 
Nie wiem ile lat miała, lecz nie taka znów mała 

Mieszkała długo sama. Ten dom tu jest typowy 
Kiedyś drzwi źle zamknęła, wracał jeden z zabawy 
Był jak świnia pijany, ujrzał światło jak w celi 
W sieni stała się kobietą. ale wbrew swej woli 
Modliła się potem by coś złego go spotkało 
Jakby ją wysłuchano. niedługo go dopadło 
Trzech żuli z naprzeciwka 
Kopali go w głowę, aż przestał oddychać 
Wtedy poszli w swoją stronę 

To jest historia nieznana 
A jakby gdzieś... 
A jakby gdzieś zasłyszana... 

Mieszkała ciągle sama, ale ciepła pragnęła 
Może nada się ten chłopak, którego widziała 
Kilka razy tu ostatnio 
Wydawał się lepszy niż ci wszyscy menele 
Tutaj starsi i młodsi 
Zagadał do niej. gdy po mleko stała 
Tak się jakoś ułożyło. że niedługo się pobrali 
Szybko córkę urodziła, wtedy bił on coraz więcej 
I tłukł ją jak worek im dłużej byli razem 

Lat parę znów minęło, to tutaj normalne 
Przyzwyczajono się, że tam na dole płacz i wrzaski 
I w ciągu paru lat postarzała się o wieki 
I trzęsła się gdy słyszała jego kroki 
Aż pewnej nocy gdy zaległ nieprzytomny 
Zarżnęła go nożem do krojenia chabaniny 
Radiowóz ją zabrał nazajutrz rano 
Tylko córka jej została w tym mieszkaniu sama... 

To jest... To jest historia nieznana 
A jakby gdzieś... a jakby gdzieś zasłyszana 
Jakby jakby gdzieś słyszana 
To jest historia... to jest historia nieznana 
Jak co już kiedyś było, pani zabiła pana 
Pani, pani, pani zabiła pana 
To jest, to jest, to jest historia nieznana 
A jakby gdzieś zasłyszana 
Pani zabiła pana 
To historia zasłyszana."
67,I ja ją ,"Paryż na wiosnę cudny jest
Ja z opowiadań o tym wiem
Dlaczego pytasz mnie się, bo
Byłem pijany w sztok. 
Krąg nieba znaczył miasta kres
Czego nie czynie o niej też
Jean Paul Belmondo, kto jak kto
Alain Delon, Sofie Marso
Jeśli dociągnę po dnia kres
Zimno raz raz gorąco jest
Jeśli uderzę znowuż gdzie
Czy wieża słyszy mnie?

I ja ją i ja ją
I ja ją.
I ja ją i ja ją
I ja ją

I ja ją i ja ją
I ja ją.
I ja ją i ja ją
I ja ją

Na tej pustyni nie ma cienia
Doczekać daj uspokojenia
Strach zżera duszę, to się wie.
Marianna kocha mnie.

I ja ją i ja ją
I ja ją.
I ja ją i ja ją
I ja ją

I ja ją i ja ją
I ja ją.
I ja ją i ja ją
I ja ją

Siostro poczekaj, jeszcze nie.
Nie powiedziałem czego chcę
Mijają czasy, a ja ją
Dopadnę w końcu z kąta w kąt.
Ostatnie pokolenie wie, 
Kto zaczął wielkie wojny dwie
Dwie wojny każda jedna zła
Niewola rodzi strach,

I ja ją i ja ją
I ja ją.
I ja ją i ja ją
I ja ją                         x6"
68,Idiota stąd ,"Ja muszę mieć kutasa na prąd
Ażebyście panie poczuły go
Ja muszę mieć i króla i pana
Bez bata chujnia mnie pogania

Ja, ja, ja! Ja muszę to mieć!
Ja! Ja muszę to chcieć!
Ja! Ja muszę to mieć!
Ja! Ja muszę tego chcieć!

A po angielsku ani w ząb
Metr osiemdziesiąt, włosy blond
A po rosyjsku - kurwa mać
Na straży Twojej będę stać

Ja muszę mieć reaktor HD
Równie walący jak DDT
Ja muszę mieć wodza swojego
I bohatera narodowego

Ja, ja, ja! Ja muszę to mieć
Ja! Ja muszę to chcieć!
Ja! Ja muszę to mieć!
Ja! Ja muszę tego chcieć!

A po angielsku ani w ząb
Metr osiemdziesiąt, włosy blond
A z rosyjskiego - tolka chuj
Ty zawsze wiernie przy mnie stój

Jestem idiotą - to jedno wiem
Nie mieszaj nigdy dobra ze złem
Jestem idiotą, idiotą stąd
Ja muszę mieć kutasa na prąd"
69,Idź przodem ,"Psy w norze leżąc bez siły 
Lizały swoje rany 
Po walce o przetrwanie 
Oblepiały ropą ściany 
Nie mając już sił zupełnie 
Ujrzawszy tedy ludzi 
Nie miały na walkę sił 
Jakże ona ich trudzi 

Idź przodem 
Idź przodem 
Idź przodem 
Idź przodem, stary, niech wiedzą 
Że mamy pokojowe zamiary... 

Wódz oczy wzniósł ku niebu 
Wzywając je na świadka 
Pokoju chcąc nad życie 
Przysięgał na krew matki 
Posyłając jednocześnie 
Pancernych dwieście dywizji 
Ale przodem oficera 
Bez żadnej amunicji 

Idź przodem 
Idź przodem 
Idź przodem 
Idź przodem, stary, niech wiedzą 
Że mamy pokojowe zamiary... 

Haa... 
Tak w mieście z nazwy nieznanym 
Idę razem z kolegami 
Zza rogu się wychyla 
Brudna wataha z bejsbolami 
Widząc, że szykuje się coś bardzo, bardzo, bardzo niedobrego 
Wypychamy raźno do przodu 
Kolegę najmniejszego 

Idź przodem 
Idź przodem 
Idź przodem 
Idź przodem, stary, niech wiedzą 
Że mamy pokojowe zamiary... 

"
70,Inżynierowie z Petrobudowy ,"Nie pękaj koleś, nie łam sie przecie A,d 
To o nas wczoraj stało w gazecie A,d 
Pisała sama ""Trybuna Ludu"" g,d 
Że nas ogarnia romantyzm budów A,d 
W takim pisaniu nie ma usterek C,F 
Postaw literek, niech brzękną szkła D,g 
Przed nami naród odkrywa głowy A,d 
Inżynierowie z Petrobudowy A,d 
Kładziemy lachę, niech brzękną szkła g,d 
Budowniczowie na 102 A,d 

Pić życia rozkosz, a cóż nam to szkodzi 
Nawet PKS do nas dochodzi 
A w zeszłe święto miałem kobite 
Co miała obie nogi umyte 
W Warszawie Ptaszyn niech zdziera płuca 
Niech tańczy Gruca, Holoubek gra 
My tutaj mamy program gotowy 
Inżynierowie z Petrobudowy 
Kładziemy lachę, niech brzękną szkła 
Budowniczowie na 102 

Ciężko się żyje o suchym chlebie 
Za to nikt grobów nam nie rozgrzebie 
Szatkuj dwie zmiany zimą i latem 
Wyśpisz się w piachu pod kombinatem 
Rąk trzeba wiele, pomników mało 
Kogoś złamało, lecz życie trwa 
Więc niechaj zabrzmi slogan bojowy 
Inżynierowie z Petrobudowy 
Kładziemy lachę, niech brzękną szkła 
Budowniczowie na 102 

Choć nie ma w kabzie srebra ni złota 
Przyda się przecież nasza robota 
Dopchamy wreszcie w ktorymś tam roku 
Do wojny co to ma być o pokój 
Co oszczędzimy to ktoś ukradnie 
Idzie składnie jakoś się pcha 
Więc wykonajmy plan narodowy 
Inżynierowie z Petrobudowy 
Kładziemy lachę, niech brzękną szkła 
Budowniczowie na 102."
71,Ja wiem to ,"W domu trąd, tylko nie wiem skąd on 
Świata nie rozumiem, życia w nim nie umiem 
W domu trąd nie jest znikąd 
Czasem czuję tego trądu swąd 
Polowania jeden na drugiego 
Kochaj bliźniego jak siebie samego 
Wiem to, że wiem, że nic nie wiem 
Wiem, że nic nie wiem, w ciągłej potrzebie 

Ja wiem to, ja wiem to 
Ja wiem, że nie wiedzą co czynią 
Wiem to, ja wiem to 
I co z tego? 

Ja wiem to, ja wiem to 
Ja wiem, że nie wiedzą co czynią 
Wiem to, ja wiem to 
I co z tego? 

Mam w ustach krew, zabrano mi je 
Mówiłem co chciałem, teraz nie 
W ustach krew, wypełnia mi je 
Czuję strach na dnie 
W moich rękach miecz, unoszę go w górę 
Potem do przodu z wojny chórem 
W rękach krew, na rękach krew 
W rękach miecz i ciągła krew 

Ja wiem to, ja wiem to 
Ja wiem, że nie wiedzą co czynią 
Wiem to, ja wiem to 
Ja wiem, że nie wiedzą co czynią 
Wiem to, ja wiem to 
Ja wiem, że nie wiedzą co czynią 
Wiem to, ja wiem to 
I co z tego? 

Ja wiem to, ja wiem to 
Ja wiem, że nie wiedzą co czynią 
Wiem to, ja wiem to 
I co z tego? 

Ja wiem to, ja wiem to 
Ja wiem, że nie wiedzą co czynią 
Wiem to, ja wiem to 
I co z tego? 

Hehe... 
A to nie jest manifest pacyfistyczny 
To nie jest manifest żaden 
Chyta chłopców dużych i małych 
Pleban jest pedałem 
Nasz burmistrz jest złodziejem 
Słyszę, że źle się tu dzieje 
Wiadomo, niedziela nad ranem 
Czapkujemy im z oddaniem 

Mój świat, powiadam, jest chory 
Władają nim potwory 
Jest coraz bardziej normalne 
Tylko to co jest bardziej nachalne 
Najlepsze jest to co się sprzeda 
Chujowe to co sprzedać się nie da 
Każdy to widzi, w środku miasta 
Statua z gówna wyrasta 

Ja wiem to, ja wiem to 
Handlujesz moją panienką 
Ja wiem to, ja wiem to 
Tia... 
Ja wiem to, ja wiem to 
Handlujesz moją panienką 
Ja wiem to, ja wiem to, karate 

W tym mieście zło zalewa dobro 
W tych czasach dobro nisko upadło 
Brak idei wszystkich jednoczy 
Kilku nie może zjednoczyć 
W gnieździe trąd, wiem skąd on 
Czuję tego trądu swąd 
Wiem to, że wiem, że nic nie wiem 
Wiem, że nic nie wiem w potrzebie 

Ja wiem to, ja wiem to 
Ja wiem, że nie wiedzą co czynią 
Wiem to, ja wiem to 
I co z tego? 

Ja wiem to, ja wiem to 
Ja wiem, że nie wiedzą co czynią 
Wiem to, ja wiem to 
I co z tego? 

Ja wiem to, ja wiem to 
Ja wiem, że nie wiedzą co czynią 
Wiem to, ja wiem to 
I co z tego? 

Ja wiem to, ja wiem to 
Ja wiem, że nie wiedzą co czynią 
Wiem to, ja wiem to 
I co z tego?"
72,Jaką cenę możesz zapłacić ,"This crowd ain't no clean 
This crowd is dirty 
This crowd ain't no clean 
Say and it's so dirty 
This crowd smells no good living in it no easy 
You can find one man higher, the other on the bottom lays, I say 

What price could you pay for the freedom from society? 
What price could you pay for the freedom from society? 
What price could you pay for the freedom from society? 
I say! 

In this crowd I can't be with you 
You can't be with me, I say 
You can find one man higher 
Then other on the bottom lays, I say 

What price could you pay for a changing your destiny? 
What price could you pay for a changing your destiny? 
What price could you pay for a changing your destiny? 
What price could you pay for a changing your destiny? 
What price could you pay for a changing your destiny? 
What price, price, price could you pay for a changing your destiny? 
What price could you pay for the freedom from society? 
What price could you pay for a changing your destiny? 
What price could you pay for a changing your destiny? 
I say... 

What price could you pay for a changing your destiny?"
73,Jatne ,"Mężczyźni w czerni są bardziej pazerni 
Mężczyzn w bieli nic nie dzieli 
Mężczyzn bez ubrań nie trudno jest ubrać 
Kobiety w ciąży są gorące 

Jatne, 
Jatne,
Jatne, 
Jatne, 

Żona proboszcza spadła ze schodów 
Potłukła się przy tym dotkliwie 
Teraz powoli kuśtyka o lasce 
Proboszcz zaś żyje szczęśliwie 

A ja leżę na wyrze, przerzucam kanały 
Lektury już dawno olałem 
Gapię się tępo zjadając but w sosie 
I patrząc na dramat w kosmosie 

A tu jeden piosenkarz znany i gruby 
Wystąpić chciał kiedyś z playbacku 
Głos mu odjęło i upadł zemdlony 
Bóg go oduczył tego, tego 

Jatne, 
Jatne, 
Jatne, 
Jatne, 

Ho... 
Przyszedł raz Breżniew w dzień do fryzjera 
A fryzjer ujebał mu rękę 
Tyle jest spraw na tym świecie poważnych 
By o nich napisać piosenkę, ho... 

Jatne, 
Jatne, 
Jatne, 
Jatne. 
"
