,Title,Lyrics
0,1932 ,"Gdziekolwiek ja ruszę się, widzę samo zło
Ilekroć gdy spojrzę tam, tam ogarnia mnie mrok
Proszę o pomoc tych, co pomocy pragną
Sam siedząc pod murem z gwiazd ja czekam, na jałmużnę czekam

I nie mam co jeść, nie mam co pić
A mam w tej historii być, mam długo, długo żyć
Bo Berlin trzydziestych lat taki jest jak cały świat
Berlin trzydziestych lat taki jest jak cały świat"
1,45,"Towarzysze, obywatele,
Ludu pracujący stolicy!
Towarzysze, (towarzysze), (towarzysze),
Obywatele, (obywatele), (obywatele).
Ludu, (ludu), ludu pracujący stolicy!

Pokażcie, co potraficie,
Pokażcie, co potraficie,
Pokażcie, co potraficie,
Pokażcie, co potraficie,
W wyszkoleniu wojskowym i sporcie.

Pierwszy sekretarz KC,
Odnosi się z szacunkiem i zaufaniem,
Do opinii społecznej.
Społeczeństwo odwzajemnia się,
Tym samym.

Wstyd mi,
Wstyd mi,
Wstyd mi,
Wstyd mi, 
Za tych z Radomia..

Zrozumiałem, że to koniec..

Nie zgodzimy się nigdy na to,
Ażeby to,
Ażeby te podstawy naszego,
Każdego z nas, z osobna,
Dobrobytu.

Razem z nami w nowy czas!

Ludu - do roboty!
Ludu - do roboty!
Ludu - do roboty!
Ludu pracujący stolicy,
Raz, dwa - do roboty!

Powstaje pytanie,
Powstaje pytanie,
Kto, kto, kto, kto, kto,
Kto, kto, kto, kto, kto,
Kto za tym wszystkim stoi?

O czym, o czym,
O czym, o czym,
O czym, o czym,
O czym, o czym,
O czym tu mówić?

Są granice, których przekroczyć nie wolno!
Są granice, których przekroczyć nie wolno!
Są granice, których przekroczyć nie wolno!
Są granice, których przekroczyć nie wolno!
Są granice, których przekroczyć nie wolno!

Dziękujemy wam,
Dziękujemy wam.
I życzę dobrego wypoczynku,
I życzę dobrego wypoczynku,
I życzę dobrego wypoczynku.

Dziękujemy wam serdecznie
I życzę dobrego wypoczynku.
Dziękujemy wam serdecznie,
Dziękujemy wam,
Dziękujemy wam.

(12x)
Dziękujemy wam.

(c) 1990"
2,6 lat później ,"Słońce już zaszło, jest wieczór na niebie e,G 
Odprowadzam teraz do domu Ciebie G,D 
Lecz zanim zaczniesz myśleć o tym, co się stało 
Proszę Cię, spotkajmy się rano 
Już od tylu lat patrzę w Twoje oczy 
Ty wiesz, że mnie niczym nie zaskoczysz 
Nie ma powodu do zazdrości 
Czasem chciałbym nie mieć litości 

Dla Ciebie 
O tym ja mówić chcę 
Długo i głośno 

Dla Ciebie 
O tym ja mówić chcę 
Długo i głośno 

Ważny czuję się, gdy obejmę Cię ramieniem 
Nie jesteśmy w niebie, chodzimy po ziemi 
To wszystko, co stało się przez ten czas 
Jest w Tobie i we mnie, zostało w nas 
I czasem gdy się budzę i mogę być zły 
Ale to nie zmienia niczego, a Ty 
Możesz poczuć czasem brak mojej solidności 
Lecz zrozum, nie ma wolności bez miłości 

Dla Ciebie 
O tym ja mówić chcę 
Długo i głośno 

Dla Ciebie 
O tym ja mówić chcę 
Długo i głośno 

Nowy dzień się zaczyna i słońce wschodzi 
Uważajmy, by się nie rozłączyć 
I nowe rzeczy w sobie teraz odkrywamy 
To nieprawda, że do końca się znamy 
Czasem bardzo niewiele czasu jest potrzeba 
By zburzyć wszystko i wszystko pogrzebać 
Zrozumieć trzeba, jak groźne są pozory 
Przecież nie ma miłości bez pokory 

Dla Ciebie 
O tym ja mówić chcę 
Długo i głośno 

Dla Ciebie 
O tym ja mówić chcę 
Długo i głośno 

Księżyc zachodzi, nowy dzień się przebudzi 
Zimnica może w każdym coś ostudzić 
Pomyślmy, jak wiele trzeba mądrości 
By stopić się w jedności 
Już od tylu lat patrzę w Twoje oczy 
Czy myślisz jednak, że mnie czymś zaskoczysz 
I złe dni bywają w bezmyślnej złości 
Czasem jesteśmy bez litości 

(x5) Dla siebie  
O tym ja mówić chcę  
Długo i głośno"
3,A gdy będę umierał ,"A gdy będę umierał 
To nie przyjdzie generał 
Ziewnie z cicha dyrektor 
Bo umiera byle kto 
Serce pluśnie w staw ciszy 
Doktór papier podpisze 
Szakal z hieną z kantorka 
Złożą rzeczy do worka 
Żona przyjdzie w welonie 
Masz przepustkę Charonie 
Złoty ząbek zostawić 
Piórko z głową poprawić 
A gdy będę chowany 
Syn zapłacze pijany 
Zdepcze szarfy dostojne 
Potem pójdzie na wojnę 
Na cmentarzu pod murem 
Słońce zajdzie za chmurę 
Drobny deszczyk pokropi 
Pamięć moją zatopi 
A na stypie z bigosem 
Strasznym krzyknie ktoś głosem 
Wyjdziesz patrzeć kto woła 
Znajdziesz ciszę dookoła."
4,A kiedy nic was nie ochroni ,"A kiedy godność im oddadzą 
To wtedy staną jako stal 
A kiedy rozum odzyskają 
Zobaczą kto kogo się bał 
A kiedy wolność nam oddadzą 
Nie zapomnijcie o tym, że 
Tak wielu ludzi skrzywdziliście 
Zapłaty w końcu przyjdzie dzień 

A kiedy ranne wstaną zorze 
To wtedym wstanę jakom stał 
Na żywo takoż i w kolorze 
Będę na oku Was tu miał 
A kiedy tego domyślicie się 
I bać przestaniecie się już 
To sami w końcu zobaczycie 
Że Waszych wrogów pokrył kurz 

A kiedy nic Was nie ochroni 
Ani ojczyzna, ani Bóg 
Tak wielu ludzi tu skrzywdzono 
Kto im uczynić to zło mógł? 
Daliście sobie zabrać tyle 
Ile nie zabrał jeszcze nikt 
Ze strachu albo i z wygody 
Pozwoliliście aby znikł, ha! Ha!"
5,Ambitni piloci ,"Ty chcesz wyżej, wyżej, wyżej, wyżej 
Masz wielkie ambicje 
Nie strach, nie błąd, nie krzyk 
Pracujesz bez usterek 
O, taki bezbłędny 
Czysty i elokwentny 
I, myślę, się nie obrazisz 
Że nie ma nic trudniejszego 
Niż znaleźć kogoś takiego 
Jak wyżej, wyżej, wyżej, wyżej 
Masz wielkie ambicje 
Nie strach, nie błąd, nie krzyk 
Pracujesz bez usterek 

Ty chcesz wyżej, wyżej, wyżej, wyżej 
Masz wielkie ambicje 
Ty chcesz wyżej, wyżej, wyżej, wyżej 
Masz wielkie ambicje 
Ty chcesz wyżej, wyżej, wyżej, wyżej 
Masz wielkie ambicje 
Ty chcesz wyżej, wyżej, wyżej, wyżej 
Masz wielkie ambicje 

Ty chcesz wyżej, wyżej, wyżej, wyżej 
Masz wielkie ambicje 
Nie strach, nie błąd, nie krzyk 
Pracujesz bez usterek 
O, taki bezbłędny 
Czysty i elokwentny 
I, myślę, się nie obrazisz 
Że nie ma nic trudniejszego 
Niż znależć kogoś takiego 
Jak wyżej, wyżej, wyżej, wyżej 
Masz wielkie ambicje 
Nie strach, nie błąd, nie krzyk 
Pracujesz bez usterek."
6,Amnezja ,"Amnezja to łatwo tak zapomnieć co i gdzie i jak
Amnezja to łatwo gdzieś tak swoją pałę na przód nieść

Amnezja to łatwo jest zapomnieć skąd się jest i gdzie
Amnezja to łatwo tak swojemu bratu wleźć na kark

My na monopol mamy prawdę
Ja nie zabijam ani ja nie kradnę
A były przecież kiedyś piękne dni
Gierek, Jaruzel oraz my

To były sobie piękne czasy takie
To nawet wtedy papież był polakiem
Rozmontowaliśmy razem komunę
Lecz po co ja do dzisiaj nie rozumiem

Amnezja to łatwo gdzieś tak swoją pałę na przód nieść
Amnezja to łatwo tak swojemu ojcu wleźć na kark

Amnezja wygodnie jest zapomnieć skąd się jest i gdzie
Amnezja powiadam wam a ja się dobrze na tym znam

Podziemia się obecnie nie docenia
Chyba, że z jednego punktu widzenia
To były panie takie piękne dni
Wałęsa, Kuroń ja i ty

To były słuchaj czasy właśnie takie
Że z dumą można było być polakiem
Z dziedzictwem bojowego chrztu Lenino
I z palmą zdobywców Berlina

Amnezja to łatwo tak zapomnieć co i gdzie i jak
Amnezja to łatwo gdzieś tak swoją pałę na przód nieść

Amnezja to łatwo jest zapomnieć skąd się jest i gdzie
Amnezja to łatwo tak swojemu bratu wleźć na kark

Podziemia się obecnie nie docenia
Kto pyta ten rolę swoją przecenia
To były takie super, super chwile
Nie złodzieje rządzili lecz debile

Na olimpiadzie cały wór medali
Po ulicach zomowcy nas ganiali
Wyścig pokoju – trzecie miejsce w świecie
Ale wy o tym dzisiaj nic nie wiecie"
7,Amulet ,"Mam tu amulet, który chroni mnie 
Świadczącym będąc w walce dobra ze złem 
I nie wiem jak, i nie wiem kto 
Jak piorunochron koncentruje to zło? 

Zebrane zwały świadomości są 
Niczem projektor, znowu ""dobro - zło"" 
Nie mogę z wiekiem patrzeć na to w spokoju 
Weźcie mnie proszę do drugiego pokoju 

Przeżyłem tyle na ile mnie stać 
Ile znów można dawać, a ile brać? 
Czasami padam, lecz potem idzie wstać, 
Ile z pustego w próżne można wody lać? 

Mam tu pistolet, który chroni mnie 
Po której stronie walki dobra ze złem 
I nie wiem kiedy, i nie wiem gdzie 
Cała przygoda może zakończyć się? 

Wyprute grona naiwności tej 
Na wadze ważę w głupiej nadziei swej 
Nie mogę słuchać takiej bredni bez skutku 
Dopiszcie moje koszty w poczet rachunku 

Przeżyłem tyle na ile mnie stać 
Ile znów można dawać, a ile brać? 
Czasami padam, lecz potem idzie wstać 
Ile z pustego w próżne można wody lać? 

Mam tu amulet, który chroni mnie 
Świadczącym będąc w walce dobra za złem 
I nie wiem jak, i nie wiem kto 
Jak piorunochron koncentruje to zło? 

Poprzegrywane bitwy życia co noc 
Ze zwycięstwami dzielą łóżko i koc 
Nie jestem zdolny tak opisać tego stanu 
Proszę wypisać mnie z waszego bałaganu 

Przeżyłem tyle na ile mnie stać 
Ile znów można dawać, a ile brać? 
Czasami padam, lecz potem idzie wstać 
Ile z pustego w próżne można wody lać? 
Lać, lać, lać..."
8,Anarchia ,"Na wschodzie anarchia,
Na zachodzie anarchia.
System się pali i wali,
System pali się,
System pali się,
System pali i wali się.

Trupy w Salwadorze
I trupy w kolorze
System się pali i wali,
System pali się,
System pali się,
System pali i wali się."
9,Angelo Jacopucci ,"It was in 1979
I was a feeling good and felt all right
I've got my fist and believe in me
And Alan Minter against me
Oh no! Oh yeah!

I was beaten in the face, fingers into eyes
Nobody heard when my mother cries
Walking for money, money for bread
Angelo Jacopucci is dead!
Oh no! Oh yeah!

We like it
To do it now
We like it

And I've got a gun and I've got a fun
And I'll be the ruler of this land
I've got a gun and I've got a fun
So I'll be the ruler of this land
Oh no! Oh yes!

So, so, I stood in the dark, stood in the sea
I'm looking at my Love, You're looking at me
Which I have the desire to be like a fire
Open and see your eyes, open and see your tears
Oh no! Oh yes!

Go!

We like it
To do it now
We like it

We like it
To do it nooooooow!"
10,Apokalipsa ,"Ciało znaleźli jej pod żerdzią,
nikt nie pamiętał przyszła skąd.
Jedynie co poniektórzy chcą twierdzić, 
tutaj przybycie jej to był jej błąd

Gdzieś tam jej bliscy myślą, że ma się dobrze,
cztery lata z kawałkiem jak poszła sobie.
Gdzieś tam jej bliscy myślą, że ma się całkiem,
zupełnie dobrze, a przecież stało się źle.

Wisząc, wisząc, wisząc, wisząc,
wisząc żebrem na żerdzi, czuła życie uchodzi
wisząc sztywno wysoko, ból czuła głęboko.
Wisząc niczym manekin, nisko tak przywiązana,
czekać długo musiała, czekać miała do rana.
Prawie, wisząc, płacząc i wisząc.

Gdzieś tam jej bliscy myślą, że ma się dobrze,
cztery lata z kawałkiem jak poszła sobie.
Gdzieś tam jej bliscy myślą, że ma się całkiem, 
zupełnie dobrze, a przecież stało się źle.

Patrząc jak ludzie się tu zebrali,
w tłumie gapiących się razem stałem.
Patrząc jak ludzie ją wykopywali 
nad swoim i jej losem zapłakałem.

Gdzieś tam jej bliscy myślą, że ma się dobrze, 
cztery lata z kawałkiem jak poszła sobie.
Gdzieś tam jej bliscy myślą, że ma się całkiem, 
zupełnie dobrze, a przecież stało się źle."
11,Arahja ,"Mój dom murem podzielony 
Podzielone murem schody 
Po lewej stronie łazienka 
Po prawej stronie kuchenka 

Mój dom murem podzielony 
Podzielone murem schody 
Po lewej stronie łazienka 
Po prawej ... 

Moje ciało murem podzielone 
Dziesięć palców na lewą stronę 
Drugie dziesięć na prawą stronę 
Głowy równa część na każdą stronę 

Moje ciało murem podzielone 
Dziesięć palców na lewą stronę 
Drugie dziesięć na prawą stronę 
Głowy równa część na każdą stronę 

Moja ulica murem podzielona 
Świeci neonami prawa strona 
Lewa strona cała wygaszona 
Zza zasłony obserwuję obie strony 

Moja ulica murem podzielona 
Świeci neonami prawa strona 
Lewa strona cała wygaszona 
Zza zasłony obserwuję obie strony 

Moja ulica murem podzielona 
Świeci neonami prawa strona 
Lewa strona cała wygaszona 
Zza zasłony obserwuję obie strony 

Lewa! strona nigdy się nie budzi 
Prawa! strona nigdy nie zasypia 
Lewa! strona nigdy się nie budzi 
Prawa! strona nigdy nie zasypia 
Lewa! strona nigdy się nie budzi 
Prawa! strona nigdy nie zasypia 
Lewa! strona nigdy się nie budzi 
Prawa! strona nigdy nie zasypia 
Lewa! strona nigdy się nie budzi 
Prawa! strona nigdy nie zasypia 
Lewa! strona nigdy się nie budzi 
Prawa! strona nigdy nie zasypia 
Lewa! strona nigdy się nie budzi 
Prawa! strona nigdy nie zasypia"
12,Artysci niezależni ,"My artyści tak zwani niezależni 
Mamy powód poważny na zmartwienia 
Dosyć mamy sterczenia pod oknami 
Czemu nie jesteśmy w końcu doceniani? 

My artyści tak z kręgu podziemnego 
Mamy powód na rozterki gorące 
Skoro robimy tak fantastyczne rzeczy 
Czemu się nie przekłada to na pieniądze? 

Znał ich Jarek, znał ich Kazimierz 
Teraz ich dużo mniej chcą znać 
Czasem zupełnie prosty egzamin 
A nie da rady jego zdać 

My artyści alternatywnej sfery 
Mamy powód poważny do myślenia 
Skoro jesteśmy tą kontrą radykalną 
Czemu się u nas zupełnie nic nie zmienia? 

Znał ich Jarek, znał ich Kazimierz 
Teraz ich dużo mniej chcą znać 
Czasem zupełnie prosty egzamin 
A nie da rady jego zdać 

My artyści indyfyryntnej formy 
Mamy całe noce do szukania 
Przecież jeśli czynimy w opozycji 
Gdzie są nasi wrogowie do zwalczania? 

My artyści pokłóconego klanu 
Córy i syny pokłóconej rodziny 
Dosyć mamy sterczenia pod oknami 
Wszyscy artyści są tacy sami."
13,Axe ,"Za oknem, za oknem ucieka wieś 
Dach domu czyjegoś 
Za oknem, za oknem ucieka wieś 
Dach domu czyjegoś 
Dnia potężna moc wypiera noc 
Dnia potężna moc wypiera noc 
A śpiący czytają gazety obok mnie 
A to nie powtórzy się 
Śpiący czytają gazety obok mnie 
A to nie powtórzy się 

Ty wiesz, czasem czuję jakbym myślał przez ciebie 
Wiesz, czasem czuję jakbym myślał przez ciebie 
Wiesz, czasem czuję jakbym myślał przez ciebie 
A muzyka, muzyka, muzyka gra, a dzień ucieka 
A muzyka, muzyka, muzyka gra, a dzień ucieka 
Zrośnięty z fotelem ktoś marnuje się sam 
Zrośnięty z fotelem ktoś marnuje się sam 
Zrośnięty z fotelem ktoś marnuje się sam 
A ty wiesz, ty wiesz, ty wiesz, ty wiesz 
Ty wiesz, ty wiesz, ty wiesz, ty wiesz 
Ty wiesz, czasem czuję jakbym myślał przez ciebie 
Wiesz, czasem czuję jakbym myślał przez ciebie 
Wiesz, czasem czuję jakbym myślał przez ciebie 

Piasek, piasek, piasek na plaży jest na mojej twarzy 
To piasek, piasek, piasek na plaży jest na mojej twarzy 
A to szum wody słonej, ja siedzę tu pochylony 
Szum wody słonej, siedzę tu pochylony 
I czuję ciebie gdzieś tu obok mnie 
Czuję ciebie gdzieś tu obok mnie 
Czuję ciebie gdzieś tu obok mnie 
Czuję ciebie, a ty wiesz że 
Ty wiesz, czasem czuję jakbym myślał przez ciebie 
Wiesz, czasem czuję jakbym myślał przez ciebie 
Wiesz, czasem czuję jakbym myślał przez ciebie."
14,Babilon ,"Hej, dzisiaj przeczytałem, ze złotego tronu 
Przyjechał tutaj król wielkiego Babilonu 
Z dala od niego, w pewnej odległości 
Stoi tłum niewolników własnej wolności 
Z dala policja czeka w pogotowiu 
Czeka na rozkaz, na rozkaz bojowy 
Ale patrz dalej, tam proboszcz błogosławi 
Armię jadacą na wojnę błogosławi 
Jego natura, to być nienaturalnym 
Klamać i pluć wokoło to jego natura 

Hej, zbiera pieniadze i odpuszcza grzechy 
Oni mu więc płacą i już są bez winy 
Chlapie wodą z kranu kościelne obrazy 
Morderca ich dotyka i już jest bez skazy 
Bo kultura Kościoła, to być niekulturalnym 
Spalić wszystko prawdziwe to jego kultura 

Hej, cesarz teraz wita się z dowódcą Kościoła 
A potem wydaje wyroki śmierci w imię Boga 
A oni dalej modlą się do barwnych napisów 
Nic nie rozumiejąc w swoim krótkim życiu 
A ja bardzo dobrze rozumiem ten stan 
Ja przecież kiedyś byłem taki sam 

Hej, wszystko dla Kościoła, pieniądze i złoto 
Benzyna, alkohol, pieniądze i czołgi 
Teraz z dala podbiega biskup, pokazuje 
Gdzie długa modlitwa każdego obowiązuje 
Kiedyś tu był stos, na którym palono 
A potem Kościół krzyczał, że ich odkupiono 
Prałat - Ajatollah chcą naszej ofiary 
Chcą wojny w imię Boga, chcą niewiernym kary 

A ja teraz wiem, naprawdę wiele wiem 
Wiem, że kościół babiloński czyni ziemię złem 
A ja teraz wiem, naprawdę wiele wiem 
Babilon wielki uczynił ziemię złem 
A ja teraz wiem, naprawdę wiele wiem 
Wiem, że kościół babiloński czyni ziemię złem 
A ja teraz wiem, naprawdę wiele wiem 
Babilon wielki uczynił ziemię złem."
15,Bal kreślarzy ,"Patrz płynie kolorowych świateł nad Sekwaną sznur 
W dolinie grzmi Paryża nocny śpiew jak świerszczy chór 
Jak noże czarne ostrza dachów kroją nieba tło 
W nich okno lśni, tam jak i Ty, ktoś spać nie może 

Dziś w chambre de bonnie bal kreślarzy 
Każdy wytworny jest jak lord 
Nikt dnia tu wspomnieć się nie waży 
Ni pracy, praca - chamski sport 
Odbijaj flaszkę, żądz nie kiełznaj 
Na orbitę wszyscy wraz 
Bo gdy tak człek od rana pełza 
To wieczór spędzić chce wśród gwiazd 
I Ty tu jesteś, Ty o rękach 
Co tak gotycki mają rys 
I piękna jesteś jak jutrzenka 
W swoich sukienkach z  Marché aux Puces
Chciałbym się zbliżyć ukochana 
Do uszka nucić Ci mój śpiew 
Cóż kiedy leżysz na dwóch panach 
A między nami kran i zlew 

Któż umie tak jak Polak mówiąc milczeć, milcząc pić 
Tak szumieć, tak o słowo jedno zaraz w mordę bić 
Ech biada, te gotyckie ręce znów nie tam gdzie trza 
Darujcie mi wybite drzwi łbem żabojada 

Dziś w chambre de bonnie draka w sali 
Znowu z lokalem będzie źle 
Cóż gdy żabojad się napali 
To zawsze może nadziać się 
Co mi ich franki, ich ostrygi 
Wywiozłem z Polski com tam miał 
I zawsze mogę bez fatygi 
Przygrzmocić temu co bym chciał 
Cóż z tego, że wybiegła za nim 
Że mu w banioli skleją łeb 
Cóż, że dla niego zdejmie stanik 
Ja mam swój cios on tylko sklep 
Więc wolę zrzec się mych karesów 
I z wami moją whisky pić 
Na całe życie bez adresu 
Ale z imieniem własnym być 
Cóż z tego, że wybiegła za nim 
Każdy urządzić się jest rad 
I bierze on ten towar tani 
A mój jest przecież cały świat 
Więc jeszcze seta, znakomicie 
Padniemy, ale zgódźcie się 
Że z tylu różnych dróg przez życie 
Każdy ma prawo wybrać źle."
16,Ballada o dwóch siostrach ,"Były dwie siostry: noc i śmierć 
Śmierć większa a noc mniejsza 
Noc była piękna jak sen a śmierć | 
Śmierć była jeszcze piękniejsza |2x 

Hej noony noony! Haj noony na! 
Śmierć była jeszcze piękniejsza 

Usługiwały siostry dwie 
W gospodzie koło rzeczki 
Przyszedł podróżny i woła: Hej! | 
Usłużcie mi szynkareczki |2x 

Hej noony noony! Haj noony na! 
Usłużcie mi szynkareczki 

Więc zaraz lekko podbiegła noc 
Ta mniejsza, wiecie ta modra 
Nalała, gość się popatrzył w szkło: | 
Zacny - powiada - kordiał |2x 

Hej noony noony! Haj noony na! 
Zacny - powiada - kordiał 

Lecz zaraz potem podbiegła śmierć 
Podbiegiem jeszcze lżejszym 
Podróżny cmok! A kielich brzęk! | 
Bo kordiał był zacniejszy |2x 

Hej noony noony! Haj noony na! 
Bo kordiał był zacniejszy 

Spełnił podróżny kielich do dna 
I już nie mówił z nikim 
Widząc, że druga siostra ma | 
Dużo piękniejsze kolczyki |2x 

Hej noony noony! Haj noony na! 
Dużo piękniejsze kolczyki 

Taką ballade w słotny czas 
W oberży ""Trzy Korony"" 
Śpiewał mi hej! w Dublinie raz | 
John Burton - John nad Johny |2x 

Hej noony noony! Haj noony na! 
John Burton - John nad Johny 

Dublin to z balladami kram 
Niejedną tam się złowi 
Więc to, com kiedyś słyszał tam | 
Powtarzam Krakowowi |2x 

Hej noony noony! Haj noony na! 
Powtarzam Krakowowi."
17,Baranek ,"Ech ci ludzie, to brudne świnie 
Co napletli o mojej dziewczynie 
Jakieś bzdury o jej nałogach 
No to po prostu litość i trwoga
Tak to bywa gdy ktoś zazdrości 
Kiedy brak mu własnej miłości
Plotki płodzi, mnie nie zaszkodzi żadne obce zło 
Na mój sposób widzieć ją  

Na głowie kwietny ma wianek 
W ręku zielony badylek
A przed nią bieży baranek
A nad nią lata motylek 
A przed nią bieży baranek
A nad nią lata motylek 

Krzywdę robią mojej panience 
Opluć chcą ją podli zboczeńcy 
Utopić chcą ją w morzu zawiści 
Paranoicy, podli sadyści 
Utaplani w brudnej rozpuście 
A na gębach fałszywy uśmiech 
Byle zagnać do swego bagna, ale wara wam 
Ja ją przecież lepiej znam 

Na głowie kwietny ma wianek 
W ręku zielony badylek 
A przed nią bieży baranek 
A nad nią lata motylek 
A przed nią bieży baranek
A nad nią lata motylek 

Znów widzieli ją z jakimś chłopem 
Znów pojechała do St. Tropez 
Znów męczyła się, Boże drogi 
Znów na jachtach myła podłogi 
Tylko czemu ręce ma białe 
Chciałem zapytać, zapomniałem 
Ciało kłoniąc skinęła dłonią wsparła skroń o skroń 
I znów zapadłem w nią jak w toń 

Ach, dziewczyna pięknie się stara 
Kosi pieniądz, ma jaguara 
Trudno pracę z miłością zgodzić 
Rzadziej może do mnie przychodzić 
Tylko pyta kryjąc rumieniec 
Czemu patrzę jak potępieniec 
Czemu zgrzytam, kiedy się pyta czy ma ładny biust 
Czemu toczę pianę z ust 

Na głowie kwietny ma wianek 
W ręku zielony badylek 
A przed nią bieży baranek 
A nad nią lata motylek
A przed nią bieży baranek
A nad nią lata motylek"
18,Barrum ,"Nowe teorie wyruszają na podboje 
Popatrz tylko, co się może stać 
Gdy pięćdziesiąt lat porządku, ogólnej szczęśliwości 
Rozpada się w godzinę i minut czterdzieści pięć 

Gdzie są te idee, które obiecały wiele? 
Popatrz tylko, co się tutaj dzieje 
Po jednej stronie jest bałagan, przemoc i wojny 
Po drugiej stronie życie płynie spokojnie 

Prawdy się zmieniają, tak mówią po tej stronie 
Prawdy się zmieniają, rób co chcesz 
Nie, nie, to czasy się zmieniają - jestem pewien, co ja mówię 
Ale prawda tylko jedna jest 

Gdzie są te idee, które obiecały wiele? 
Popatrz tylko, co się tutaj dzieje 
Na tonącym statku jeszcze, jeszcze gra orkiestra 
Rodzina tu jest także bliska i daleka 

Prawdy się zmieniają, tak mówią po tej stronie 
Prawdy się zmieniają, rób co chcesz 
Nie, nie, to czasy się zmieniają - jestem pewien, co ja mówię 
Ale prawda tylko jedna jest 

To prawdy się zmieniają, tak mówią po tej stronie 
Prawdy się zmieniają, rób co chcesz 
A tylko czasy się zmieniają - jestem pewien, co ja mówię 
Prawda, prawda tylko jedna jest."
19,Bezbronni w furii ,"Bezbronni w domu, bezbronni poza domem
Kiedy się świat nasz wali, gdy serce nasze płonie
Bezbronni w ogniu, bezbronni na papierze
Przez to co mówią, ja w tego Boga już nie wierzę

Bezbronni w furii, bezbronni w swym spokoju
Nie podołamy temu, czego się każdy boi
Na los swój przeznaczeni bezbronni się zebrali
I tylko krzyk przedziwny dobiega gdzieś z oddali

Jak bądź, tylko ze mną siebie sądź, jak bądź
Jak bądź, tylko tutaj ze mną siądź, jak bądź

Bezbronni w furii, bezbronni w swoim lęku,
Którym się opasali, bezbronni w swoim kręgu
Bezbronni teraz, nie wiedząc co się stanie
Kto teraz stanie na nasze zawołanie

Jak bądź, tylko ze mną siebie sądź, jak bądź
Jak bądź, tylko tutaj ze mną siądź, jak bądź

Bezbronni w błocie niczym posłowie w sejmie
Zapamiętacie, gdy ja Cię z tego krzyża zdejmę
Bezbronni w furii, którą się otoczyli
Kochać i nienawidzić się już nauczyli

Jak bądź, tylko ze mną siebie sądź, jak bądź
Jak bądź, tylko tutaj ze mną siądź, jak bądź

Jak bądź, tylko ze mną siebie sądź, jak bądź
Jak bądź, tylko tutaj ze mną siądź, jak bądź"
