,Title,Lyrics
167,Posłuchaj to do ciebie ,"Posłuchaj, to do ciebie, opowiem ci o tobie i o mnie 
Prowadziłeś mnie za rękę długimi korytarzami 
Kiedy jeszcze nie wiedziałem 
Przed jakimi zatrzymam się drzwiami 

Słuchałem cię uważnie 
Mówiłeś rzeczy ważne 
Mówiłeś rzeczy ważne 
Mówiłeś rzeczy ważne 

Więc dlaczego teraz godzinami 
Katujesz mnie swoimi filozofiami? 
Więc dlaczego teraz godzinami 
Katujesz mnie swoimi filozofiami? 

I pastwisz się nad obrusem 
Twój oddech przesiąknięty spirytusem 
I pastwisz się, pastwisz się nad obrusem 
Twój oddech przesiąknięty spirytusem 

I mówisz mi, mówisz mi o podziemiu
Że raz ufasz, raz nie ufasz jemu 
I mówisz mi, mówisz mi o podziemiu 
Że raz ufasz, raz nie ufasz jemu 

I dlaczego, dlaczego mówisz o kobiecie 
Jak o suce, jak o worku na śmieci?
Dlaczego, dlaczego mówisz o kobiecie 
Jak o suce, jak o worku na śmieci?

Dlaczego, dlaczego się tak zmieniłeś?
Czemu, czemu, czemu się oddaliłeś? 
Dlaczego, dlaczego się tak zmieniłeś? 
Czemu, czemu, czemu się oddaliłeś?

Czy słyszałeś, to było do ciebie 
Powiedziałem ci o tobie i o mnie 
Czy słyszałeś, to było do ciebie 
Powiedziałem ci o tobie i o mnie"
168,Post ,"Z wysokiej góry , na której to czterdzieści dni 
Widać było całe królewstwo tej ziemi 
Najpiękniejszy zły pokazywał je rękoma 
Mówiąc: to moja własność, moja i tylko moja 

Wszystko ci dam, tylko padnij i złóż mi pokłon 
Wszystko ci dam, tylko padnij i złóż mi pokłon 
Wszystko ci dam, tylko padnij i złóż mi pokłon 
Wszystko ci dam, tylko padnij 

I dam ci ogromne królestwo babilońskie 
Wszystkie prowincje Rzymu, łącznie z Jerozolimą 
Dam ci Europę Napoleona 
Wszystkie posiadłości dyktatorów w koronach 

A to wszystko ci dam, tylko padnij i złóż mi pokłon 
A to wszystko ci dam, tylko padnij i złóż mi pokłon 
A to wszystko ci dam, tylko padnij i złóż mi pokłon 
Wszystko ci dam, tylko padnij 

Bo wszystkie terytoria należą do pięknego złego 
Należą do szatana, pana świata tego 
Tak, wszystkie państwa należą tylko do niego 
Należą do trzech szóstek, pana świata tego 

Wszystko ci dam, tylko padnij i złóż mi pokłon 
Wszystko ci dam, tylko padnij i złóż mi pokłon 
Wszystko ci dam, tylko padnij i złóż mi pokłon 
Wszystko ci dam, tylko padnij."
169,Pot i kreff ,"Jadę na motorze, motorze w czerwonym kolorze
Jadę na motorze może jeszcze zdążę

Pot i krew, pot i krew
Wszystkie liście spadły z drzew
Pot i krew, pot i krew
Jadę i unoszę dumnie brew

Jadę czy widzicie?
Czy Wy się w ogóle niczego nie wstydzicie?
Jadę czy widzicie?
Czy Wy się już nawet Boga nie boicie?

Pot i krew, pot i krew
Wszystkie liście spadły z drzew
Pot i krew, pot i krew
Jadę i unoszę dumnie brew

Czy Wy się nie wstydzicie?
Takie piosenki tutaj do mnie przynosicie
Czy Wy się nie boicie?
Co Wy w tej piwnicy całymi dniami robicie?

Pot i krew, pot i krew
Wszystkie liście spadły z drzew
Pot i krew, pot i krew
Jadę i unoszę dumnie brew

Pot i krew, pot i krew
Belsen was a gas, Belsen was a gas 
Pot i krew, pot i krew
Wszystkie liście spadły z drzew

Czy Wam się jeszcze nie znudziło, kurwa w dupę mać?
Jeszcze w Waszym wieku solówki grać
Czy Was nie irytuje całkiem okropieństwo te?
Na oczach, w uszach ludzi - dzieje się źle

Czy żaden z Was nie myśli o swojej przyszłości?
Solówkami nie nakarmi dzieci i gości
A może oślepiła Was mania młodzieńczości
Gdy stare są ręce, tak jak stare są kości
I jak tu w czasach, dzisiaj uatrakcyjnić chcesz rocka?
Rock to skamielina nie opoka!

Pot i krew, pot i krew
Wszystkie liście spadły z drzew
Pot i krew, pot i krew
Jadę i unoszę dumnie brew

Pot i krew, pot i krew
Belsen was a gas, Belsen was a gas 
Pot i krew, pot i krew
Wszystkie liście spadły z drzew"
170,Poznaj swój raj ,"Wierzę, że Pan jednak mnie nie opuści 
Jak by miał z rąk taką zdobycz wypuścić 
Pan - ale który? Pytasz się zdziwiony 
Otóż ten jeden z odpowiedniej strony 

Hej, hej, poznaj swój raj 
Hej, hej, oddaj go nam 
Mieliśmy wygrać, ale przegraliśmy 
Ryj taki jak twój może w nocy się przyśnić 

Hej, hej, poznaj swój raj 
Hej, hej, sprzedaj go nam 
Marność nad marnościami, proszę towarzyszy 
Jeden dużo gada, drugi milczy w ciszy 

Hej, hej, poznaj swój raj 
Hej, hej, sprzedaj go nam 
Marność nad marnościami, proszę towarzyszy 
Jeden dużo gada, drugi milczy w ciszy 

Kto ufa bogactwu swemu może upadnie 
Burza szaleje, bezbożny jest na dnie 
Katecheta w przerwach obmacuje chłopców skrycie 
Pierwszą komunię trzeba opić należycie 

Hej, hej, poznaj swój raj 
Hej, hej, posprzątaj tam 
Rozpierdoliliście ulice w moim mieście 
Chcecie mnie wieszać, to mnie powieście 

Hej, hej poznaj swój raj 
Hej, hej sprzedaj go nam 
Marność nad marnościami, proszę towarzyszy 
Jeden dużo gada, drugi milczy w ciszy, aaa... 

Zlew ma to do siebie, że wiele się nie wie 
Sprawiedliwy ponoć się nigdy nie zachwieje 
Siedem kul dla zdrajcy, donosił na Polaków 
Kto rozróżni skinów od dzieci kwiatów 

Hej, hej poznaj swój raj 
Hej, hej posprzątaj tam 
Rozpierdoliliście ulice w moim mieście 
Macie się wynosić, więc się wynieście 

Hej, hej, poznaj swój raj 
Hej, hej, sprzedaj go nam 
Marność nad marnościami, proszę towarzyszy 
Jeden dużo gada, drugi milczy w ciszy."
171,Prawo się wali ,"Prawo się wali z naszej plantacji
Uciekło czterech czarnych zaraz po kolacji
Ja jestem sędzia srogi do tego się przyznaję 
Za każdym razem wyrok sprawiedliwy wydaję

Dla pierwszych dwóch czterysta batów
Jak u trifo bez żadnych innych znaków
Proszę nie beczeć chłopaki nie płaczą
Pozostała dwójka niech powie kto zaczął

Prawo wali wali wali się 
Prawo wali wali się 
Prawo wali wali wali się 
Prawo wali wali się

Prawo się wali z naszej korporacji 
Uciekło pięciu białych a w takiej sytuacji 
Ja jestem sędzia chuj poniosą konsekwencje
Za całą ruchawkę bo wezwano prewencję 

Dla pierwszych trzech po pięć lat więzienia
Wynieśli dyski twarde choć nic to nie zmienia
Pozostała dwójka to nawet dożywocie
Korporacja nasza przecież potraciła krocie

Prawo wali wali wali się 
Prawo wali wali się 
Prawo wali wali wali się 
Prawo wali wali się

Prawo się wali rok temu z ambasady
Uciekło siedmiu żółtych poprosili o azyl
To służby nasze sprawne o tak po kryjomu
Wyłapały ich wszystkich sprowadziły do domu

Ja jestem sędzia srogi ale sprawiedliwy
Najlepiej jak nikt z nich nie wyjdzie stąd żywy
A ich organy sprzeda się na rynku tak trzymać
Za kule z egzekucji zaś zapłaci rodzina

Prawo wali wali wali się 
Prawo wali wali się 
Prawo wali wali wali się 
Prawo wali wali się"
172,Prezydent ,"Dziś rano przed komisją prezydent stanał 
No teraz dobiorą mu się do skóry 
Już jak go oni w swoje łapy dostaną 
Nie będzie brania jeńców, ani żadnej kultury 

Gdzie są pieniądze, które dostał Pan wtedy? 
Gdy szły pełną parą interesy takowe 
Razem z premierem kręciliście pierdolnikiem 
Niech Pan nam tutaj o tem opowie! 

Dlaczego małżonka pańska nie wie kogo zaprasza na salony? 
Doprawdy, trudno w takie bzdury uwierzyć 
""To co, nie mają państwo innych znajomych?"" 

No, ile w końcu na tem trafiliście? 
Proszę, zeznaje Pan pod przysięgą 
Ile Pan, ile premier, ile minister? 
No, ile Wam wyszło na czysto? 

Gdybym takim był ja Panem 
Prezdydentem, głosem ludu wybranem 
Tobym nie szedł na tę komisję 
Nawet gdyby po mnie przyszli 

Ale ja nie jestem Panem 
Nasz Pan, on to ma odwagę 
Mężnie stanął przed komisją 
Wiedząc, że mocno go przycisną 

Gdybym takim był ja Panem 
Prezdydentem, głosem ludu wybranem 
Tobym nie szedł na tę komisję 
Nawet gdyby po mnie przyszli."
173,Prosto ,"Wylewam swój gniew na wasze porachunki
Z jednej babki jesteście wnuki
Nienawidzę was z obu stron, psie syny 
Za wasze występki, za wasze winy

Jestem Kazik co po ulicach łazi
I nie wiem czy jestem w stanie was obrazić
Bardziej niż sami się obrażacie
To koniec jest układów, czas na zacier!

Idę prosto, nie biorę jeńców żadnych /x3
Idę prosto, dopóki nie padnę
Idę prosto, nie biorę jeńców żadnych /x3
Idę prosto, dopóki nie padnę

Rankiem gdy wypadło mi oko z głowy
A nie stać mnie na oko nowe
Okradacie ten kraj bez żadnego pojęcia
Stoję przed klawiszem do zdjęcia.

Nie należę do mafii, nie należę do sekty
Nagrywam w studio u Adasia Elektry
Czy muzyka ma moc, tego nie wiem wcale
Spierdalać tępi mądrale!

Idę prosto, nie biorę jeńców żadnych
Idę prosto, dopóki sam nie padnę
Idę prosto, to jest powód do troski
Idę prosto, mam w dupie obie wasze Polski

Idę prosto, nie zbaczam ni w lewo ni w prawo
Idę prosto, to dawno już nie jest zabawą
Idę prosto, nie biorę jeńców żadnych
Idę prosto, dopóki nie padnę"
174,Prosto wersja Jarka feat Sobota ,"1.  (Jarosław Ważny)

Moje drogie dzieci prostujcie swe ścieżki,

bo nadchodzi amator bardzo cienkiej kreski.

Choć ma krosty na twarzy to kobiety go kochają, 

poeci go cytują, księża wychwalają.

I stosuje najnowszy schemat nowoczesnej diety, 

przepisy pani Magdy wycina z gazety.

Toż to proszę państwa jest kalorii zero.

Przetrawiasz Pan to w trzebiach i stamtąd dopiero,

urobek gotowy do głowy żyłami,

taka nowa odmiana medialnych witamin. 

Wprost z drzewa poznania złego i gorszego,

 nie idźcie z nim tą drogą gdzie wam tam do niego.

Może nie jest ładny, może nie jest mądry,

nie nazbyt odważny ani Bogobojny. 

Może nie ma stu milionów choć mówił że ma,

może nie da wam zarobić choć mówił że da.

Bo to produkt zwykły, z tyłu widać metkę,

sklecony po godzinach w zakładzie na prędce,

przód magika od zachowań ludzkiej populacji,

testowany przez kolegów w męskiej ubikacji.

Bardzo ładnie mu w tej sukni, ale to za proste,

 że się sprzedał w niej alfonsem pod stołecznym mostem,

a nad mostem jest ulica na ulicy to my, 

jeśli zechcesz w niej zamieszkać lepiej trzymaj pion

Ref: (Kazik Staszewski)

Idę prosto nie biorę jeńców żadnych x3

idę prosto dopóki nie padnę

2. (Sobota)

Nie biorę jeńców, nie widzę sensu wiesz
prosto przed siebie idę, ściśle wypełniam dzień. 

Aczkolwiek kto to wie, jak wszystko skończy się

na pohybel skurwysynom co chcą zgnoić mnie.

Nie dam się, weź zabroń mi

chodź ty, ty i ty.

Mogą naskoczyć mi,może naskoczą

zależy czy i do czego mają pociąg.

Namierzyć ich ziom to żaden problem,

włączasz tv, są i plują ci w mordę.

Wszystkie podobne te ryje do siebie,

ostatnie drobne wyciągną od ciebie.

Nie biorą jeńców wiesz, też ich nie biorę wiedz. 

Niestety przez to (a jak) często  muszę biec.

Cóż rzec za wet się nie oglądam,

dopóki nie padnę co moje nie oddam.

Ref: (wykonanie Kazik Staszewski)

Idę prosto nie biorę jeńców żadnych x3

idę prosto dopóki nie padnę"
175,Prowokator ,"Вoт здесь на остановке держуся за карман, 
И вдруг ко мне подходит незнакомый мне граждан. 

И он говорит мне тихонько: «Куда бы мог пойти, 
И где бы мог не лихо всё время провести. 

Чтоб были бы там девчоночки, чтоб было бы там вино, 
А сколько это стоит – так мне равно, всё равно!» 

Я ему отвечаю: «На Лиговке вчера, 
Последнюю малину прикрыли фраера.» 

А он говорит: «В Марселе какие кабаки, 
Какие там девчоночки, какие бардаки. 

Там девушки танцуют голые, а дамы в соболях, 
Лакеи носят бороды, а воры носят фрак!» 

Он даёт мне деньги франки и жемчуга стакан, 
Чтобы я ему выявил военного завода план. 

А мы сплавили субчика, забрали чемодан, 
Забрали деньги франки и жемчуга стакан. 

Мы его передали войскам НКВД, 
С тех пор его по тюрьмам я не видел нигде. 

Меня благодарили, жал руку прокурор, 
Потом меня усадили под усиленный надзор. 

С тех пор одну, братишечки, имею в жизни цель, 
Чтоб бы я мог увидеть городишечко тот Марсель, 

Там девушки танцуют голые, а дамы в соболях, 
Лакеи носят бороды, а воры носят фрак. 




Wot zdies' na astanowkie, dierżusja za karman
I wdrug ka mnie padchodit nieznakomyj mnie grażdan

I on gawarit mnie tichińko, kuda by mog pajti
I gdie by mog nie licho wsjo wremja prowiesti,

Sztob byli by tam diewczionoczki, sztob byłoby tam wino,
A skol'ka eta stoit - tak mnie rawno wsjo rawno.

Ja jemu atwieczaju: Na Ligowkie wcziera
Pasljedniuju mielinu prikrili frajera

A on gawarit w Marsilie, kakije kabaki,
Kakije tam diewczonoczki, kakije bardaki.

Tam diewuszki tancujut gołyje, a damy w sabaliach,
Lakija nosiat borody, a wory nosjat frak

On dajet mnie dieńgi - franki i żemczjuga stakan
Sztob ja jemu wyjawił wojennowo zawoda płan.

A my sprawili subczika, zabrali cziemadan,
Zabrali dieńgi - franki i żemczjuga stakan

My jewo pieriedali w wajska enkawede
S tiech por jewo pa tiurmu ja nie widał nigdie

Mienia błagadarili, żał ruku prokuror
Patom mienia usadili w usiliennyj nadzor,

S tiech por adnu bratiszeczki imieju w żyzni cel',
Sztob by ja mog uwidiet' garadiszeczka tot Marsiel'

Tam diewuszki tancujut gołyje, a damy w sabaliach,
Lakija nosiat borody, a wory nosjat frak

Tam diewuszki tancujut gołyje, a damy w sabaliach,
Lakija nosiat borody, a wory nosjat frak."
176,Przeklęte Rakiety ,"""Barbara Ubryk"".
dziura nad dziury;
""Barbara Ubryk"" -
hotel ponury.

Pokojów nigdy
się nie przewietrza,
wszyscy wołają:
- Powietrza nie trza!

Nie przewietrzane
izby i bety;
na oknach czarne
wiszą rolety

i dniem, i nocą.
Może to harem?
Portier śpi pod sto-
jącym zegarem.

W tzw. hallu
trzy sztuczne palmy
i plakat: WIEDZĘ,
BOMBĄ ROZWALMY,

tuż oleodruk
z jakąś Wenecją
i w fotelach duchy
siedzą i szepcą,

ślęczą nad radiem,
mówią na migi
duże kanalie
i kanalijki,

kombinujące
dzionki i nocki.
A deszczyk pada,
deszcz ciemnogrodzki.

Lecz nawet pośród
takich żyjątek
czasem się zdarzy
jakiś wyjątek.

Na wprost Bulwiecia,
całkiem oddzielnie,
w pięciu izdebkach
mieszkał pustelnik.

z dala od świata
i jego psotek
w cichym hotelu
pędził żywotek.

Każdą myśl zdrożną
odpędzał od się.
jadał owsiankę
i nic na occie,

sam prał koszule,
sam kurz omiatał,
z dala od życia,
z dala od świata.

Oczy miał smutne,
płuca miał słabe,
zdziebko zegarków
złotych i sztabek.

Zegarki w ścianę.
Sztabki do beczki.
Na beczce portret
zmarłej córeczki,

podpis: ""Tatusiu,
twa Weronika...""
Tylko Lis bywał
u pustelnika.

Bezsenność. Bulwieć
w łóżku się kręci,
wtem: puk-puk: wchodzą
piękni młodzieńcy.

Ręce ich długie,
kręcone loki.
Może studenci
angelologii?

- My przepraszamy,
że przeszkadzamy.
W kwestii rodzinnej,
np. mamy.

Pan nam wypłaci
małe à conto.
mamę czy tatę
możemy sprzątnąć.

A może chciałby
pan zabić zięcia?
Jesteśmy zbóje
do wynajęcia.

A może kogoś
na stanowisku?
Rzetelnie panu
załatwim wszystko,

Nie? Zadnych życzeń?
Więc uciekamy
i przepraszamy,
że przeszkadzamy!"
177,Psalm 151 ,"Zupełnie nie wiem co się tutaj dzieje 
Gdy widzę to wszystko niemalże truchleję 
Ten świat już pędzi tak szybko 
A ja szaleństwa jestem blisko 
Ale czuję Twoją opiekę 
Pozwala mi bym jakoś szedł przez życie swoje 
Bo gdy Ciebie by ze mną nie było 
W gruzy by wszystko runęło 

Hej, popatrz siostro, co z twoim bratem robią 
Hej, czy na śmierć, czy na zatracenie wiodą 
I popatrz siostro, co czynią z twoim bratem 
Za to co mówił wsadzono go za kraty 
I popatrz Mamo, co dzieje się z twym synem 
Schwytano go i dano mu linę 
I popatrz Ojcze, co dzieje się z twą córką 
W ciągu sekundy znalazła się za burtą 

Więc powiedz Ojcze, czy ze mną chcesz rozmawiać 
Czy cieszysz się, gdy widzisz moją postać 
Dopóki taka twoja wola, taka moja dola 
Jaki bym nie był, to z Tobą chcę pozostać 
Więc powiedz Panie, czy jeszcze chcesz mnie widzieć 
Hej, po tym wszystkim, co w życiu uczyniłem 

Dopóki taka Twoja wola, taka moja dola 
Lecz błagam Cię, daj z sobą mi pozostać 
Lecz błagam Cię, daj z sobą mi pozostać 

Tak wiele się zdarzyło co nie powinno 
Zgubiło się i nie odnalazło 
Ale czasem czynione świadomie 
Bo głupieję w tym bydlęcym wagonie 
Ale czuję Twoją opiekę 
Pozwala mi bym jakoś szedł przez życie swoje 
Bo gdy Ciebie by ze mną nie było 
W gruzy by wszystko runęło 

Hej, popatrz siostro, co z twoim bratem robią 
Hej, czy na śmierć, czy na zatracenie wiodą 
I zobacz siostro, co czynią z twoim bratem 
Za to co mówił wsadzili go za kraty 
I zobacz Mamo, co robią z twoim synem 
Schwytali go i dali mu linę 
Tak zobacz Ojcze, co dzieje się z twą córką 
W tych parę chwil znalazła sie za burtą 

Więc powiedz Boże czy ze mną chcesz rozmawiać 
Czy cieszysz się gdy widzisz moją postać 
Dopóki taka twoja wola, taka moja dola 
Jaki bym nie był, to z Tobą chcę pozostać 

I powiedz Boże czy jeszcze chcesz mnie widzieć 
Hej, po tym wszystkim, co w życiu uczyniłem 
Dopóki taka twoja wola, taka moja dola 
Lecz błagam Cię, daj z sobą mi pozostać 
Lecz błagam Cię, daj z sobą mi pozostać."
178,Radio Tirana ,"(Wierni żołnierze czekają na nadejście słoty) 
(Wierni żołnierze czekają na nadejście słoty) 
(Wierni żołnierze czekają na nadejście słoty) 

Tu Radio Tirana od wieczora do rana 
Tu Radio Tirana prawda płynie jak rzeka 

Radio Tirana
(Ich bin) 
Radio Tirana 

My Radio Tirana znamy was jak zły szeląg 
Wy nic nie znacie i na koniec świata czekacie 

Radio Tirana 
(Ich bin) 
Radio Tirana 

Das ist der Tisch und das ist der Fenster 
Meinen freunden Fried wer hat einen neue 

Ich gehe nach Tirana 
(Ich bin)

Tu Radio Tirana od wieczora do rana 
Tu Radio Tirana prawda plynie jak rzeka 

Radio Tirana 
Radio Tirana 

My Radio Tirana znamy was jak zly szelag 
Wy nic nie znacie i na koniec swiata czekacie 

Radio Tirana 
Radio Tirana 

Das ist der Tisch und das ist der Fenster 
Meinen freunden Fried wer hat einen neue 

Ich gehe nach Tirana 
(Ich bin)
Radio Tirana
(Ich bin) 
Radio Tirana
(Ich bin) 
Radio Tirana
(Ich bin) 
Radio Tirana
(Ich bin) 
Radio Tirana
(Ich bin) 
Radio Tirana
(Ich bin) 
Radio Warszawa.
(Ich bin)
(Ich bin)
(Ich bin)"
179,Rafi ,"Poszedłem na brzeg oceanu,
gdy tylko zaczął się dzień
Myślałem ze tam cię zastanę
Nic już nie będzie takie same

Wyjrzałem przez balkon do góry
tam skąd przychodziłeś co dzień
Dwie kawy i sześć papierosów
intensywnie paliło się

To jest kolejny dzień,
kolejny dzień,
gdy nie ma cię
To jest kolejny dzień

Ruszałeś królową do przodu,
zauważyłem ten krok, 
 a przecież mi się podstawiałeś
i tak to bywało co rok

Poszedłem na cmentarz kamieni,
gdzie z nią też chodziłeś wieczorem
I nic tu niczego nie zmieni już
Samotnie ocieram z łez kurz

To jest kolejny dzień,
kolejny dzień,
gdy nie ma cię
To jest kolejny dzień

To jest kolejny dzień,
kolejny dzień,
gdy nie ma cię
To jest kolejny dzień

To jest kolejny dzień,
kolejny dzień,
gdy nie ma cię
To jest kolejny dzień"
180,Religia wielkiego Babilonu ,"Idzie ludzi tysiąc tysięcy 
Na Jasną Górę idzie 
Stoją ludzi tłumy wielkie 
I modlą się do rzeźb 

Tysiące, tysiące, tysiące ludzi 
Świecą święta stworzone przez ludzi 
Tysiące ludzi płaci 
Aby się od grzechu wypłacić 

A ja wiem, a ja wiem, on kłamie 
I chociaż dawno nie wierzę 
To widzę w każdym domu 
Religia wielkiego Babilonu 

Tak, ja widzę w prawie każdym domu 
Religia wielkiego Babilonu 
A przecież wszyscy wiemy 
Przeklęty ten, kto coś w Piśmie zmienia 

Czy pamiętasz, armia zmierza 
Na wojnę za papieża 
Wtedy niosą ze sobą kościelne sztandary 
To jest właśnie armia rzymskiej wiary 

A ja wiem, a ja wiem, on kłamie 
I chociaż dawno nie wierzę 
To widzę w każdym domu 
Religia wielkiego Babilonu 

Tak, ja widzę w prawie każdym domu 
Religia wielkiego Babilonu 
A przecież wszyscy wiemy 
Przeklęty ten, kto coś w Piśmie zmieni"
181,Ręce do góry ,"Gościńcem jechał powóz, w powozie siedział Jaśnie Pan 
Na włościach okolicznych sąsiadujących z zamkiem 
Gdy uciął sobie drzemkę obudził go wrzask dziki 
Woźnica leżał martwy, zbóje wznosili okrzyki 

Stał powóz na gościńcu przez zbójów plądrowany 
Pan złota oddać nie chciał, zakuli go w kajdany 
Zabrali złoto, powóz i konie w dal powiedli 
Tak stało się, bo Jaśnie Pan nie oddał po dobroci 

Ręce do góry, daj całe złoto które wieziesz ze sobą 
Ręce do góry, bez siły lub przemocą 

Ręce do góry, daj całe złoto które wieziesz ze sobą 
Ręce do góry, bez siły lub przemocą 

I minął jakiś czas, gościniec opustoszał 
I tylko jeden wieśniak idąc zbójów znowu ujrzał 
Przestraszył się i schował, lecz jego też dopadli 
Zabrali grosze dwa i kijem kark okładli 

Szedł panicz po naukę do grodu pobliskiego 
Wyprawili go rodzice by w życiu doszedł do czegoś 
Gdy szedł tak po gościńcu dumając o przyszłości 
Dopadli go znienacka, złupili bez litości 

Ręce do góry, daj całe złoto które wieziesz ze sobą 
Ręce do góry, bez siły lub przemocą 

Ręce do góry, daj całe złoto które wieziesz ze sobą 
Ręce do góry, bez siły lub przemocą 

Minęły długie lata i nie ma już gościńca 
W tym samym teraz miejscu przebiega wzdłuż ulica 
I tylko zbóje dalej, ubrani doskonalej 
Czyhają na ofiarę by złupić ją bezczelniej 
Heja ho... 

Jak praca to i płaca, gdy idziesz po należne 
A zbóje eleganccy pokazują cię palcem 
Słyszysz - to nie przesada, tu z nami nie ma żartów 
Nasz wódz po ciebie przysłał wyczyscić cię z zarobków 

Ręce do góry, daj całe złoto które wieziesz ze sobą 
Ręce do góry, bez siły lub przemocą 

Ręce do góry, daj całe złoto które wieziesz ze sobą 
Ręce do góry, bez siły lub przemocą 

Ręce do góry, daj całe złoto które wieziesz ze sobą 
Ręce do góry, bez siły lub przemocą 

Ręce do góry, daj całe złoto które wieziesz ze sobą 
Ręce do góry, oddawaj ... "
182,Rockowa rodzinka ,"1.
Ruszył samochód, dzisiaj jest koncert, więc wesoło nam jest.
Pan Malke patrzy, we wsteczne lusterko, czy ktoś nie zagubił się.
Za oknem miasteczka, pola i lasy, stacje zajazdy.
Oł jesss...
Najlepsza micha, na trasie stajemy, kuchnia polska the best.

Ref.
Trąby z Bydgoszczy,
i ciocia z Poznania.
Banan i wujek, dziadek, ja też
Kajtek co lubi gałami ruszać,
Piotrek, dzieciak, babcia i wieszcz.

Od Świnoujścia, aż po Ustrzyki,
Z Jeleniej góry, do Suwałk gdzieś,
Kroimy Polskę swoją drogą,
Naszą muzykę dajemy jej.

2.
Tutaj tatary, bretonka, browary,
i pełen relaks jest.
Wtem głos jakiś woła ""na próbę panowie"", tam ktoś czegoś od nas chce,
Więc jedziemy do pracy.. cokolwiek, to nie znaczy.
Robimy w rozrywce a nie w powadze,
więc uśmiechnijmy się.
A wy, którzy nas słuchacie bawcie się dobrze też.

Ref.
Trąby z Bydgoszczy,
i ciocia z Poznania.
Banan i wujek, dziadek, ja też
Kajtek co lubi gałami ruszać,
Piotrek i dzieciak, babcia i wieszcz.

Od Świnoujścia, aż po Ustrzyki,
Z Jeleniej góry, do Suwałk gdzieś,
Kraimy Polskę swoją drogą,
Naszą muzykę dajemy jej.

Trąby z Bydgoszczy,
i ciocia z Poznania.
Banan i wujek, dziadek, ja też
Kajtek co lubi gałami ruszać,
Piotrek i dzieciak, babcia i wieszcz.

Od Świnoujścia, aż po Ustrzyki,
Z Jeleniej góry, do Suwałk gdzieś,
Kraimy Polskę swoją drogą,
Naszą muzykę dajemy jej."
183,Rozmyślania wychowanka ,"Czy pamiętasz kiedy od ciebie odjeżdżałem 
Bracia i siostry przekazali mi twoją wolę 
Idź spokojnie, powoli, nie ustępuj nikomu 
Tylko głupcy tracą nad sobą kontrolę 
Tylko nasi wrogowie tracą nad sobą kontrolę 
Nad sobą kontrolę 
Ty mówisz dzielę i rządzę, dzielę i rządzę 
Rozdzielam wrzucone pieniądze 
Dzielę i rządzę, dzielę i rządzę 
Jestem, tu jestem, o tronie myślę 
Ty dzielisz i rządzisz, dzielisz i rządzisz 
Dookoła się biją a ty ciągle trwasz 
Dzielisz i rządzisz, dzielisz i rządzisz 
Do domu każdy swój zwyczaj wprowadzasz 

A ja teraz zobaczyłem wyraźnie tych ludzi 
Siedzą, jedzą i piją, kolędy śpiewają 
Kłócą się stale, wymachują rękami 
A mówią, że winy winowajcom odpuszczają 
Na gościa czekają i winy odpuszczają 
Na gościa czekają 
Ty mówisz: dzielę i rządzę, dzielę i rządzę 
Rozdzielam wrzucone pieniądze 
Dzielę i rządzę, dzielę i rządzę 
Jestem, tu jestem, o tronie w Rzymie myślę 
Ty dzielisz i rządzisz, dzielisz i rządzisz 
Dookoła się biją a ty ciągle trwasz 
Dzielisz i rządzisz, dzielisz i rządzisz 
Do domu każdy swój zwyczaj wprowadzasz."
