,Title,Lyrics
40,The Law ,"Darkness, imprisoning me. 
Feeling, that darkness in me. 

Me and it's you, and I run over you. 
So let me be. 
Swing low, 
Into the blood off of me. 

Me and lie on the streets of law, 
Breaking down the road. 
So bringing me down, 
Well in to the ground. 
No one sees me, and no one talks, 
Cuz we all know it to be mine. 

Me and lie on the streets of law, 
Breaking down the road. 
So bringing me down, 
Well in to the ground. 
No one sees me, and no one talks, 
Cuz we all know it to be mine. 

yeah. 
yeah. 
yeah. 

[whispered] 
yeah, spend 
spend yeah. 
yeah, spend 
yeah, spend 
yeah. 
yeah. 
yeah. 
yeah. 
[whispered] 

Yeah. 

Darkness imprisoning me, 
Feeling, that darkness in me. 

Me and it's you, and I run over you. 
So let me be. 
Swing low, 
Into the blood off of me."
41,The Low ,"Darkness, imprisoning me. 
Feeling, that darkness in me. 

Me and it's you, and I run over you. 
So let me be. 
Swing low, 
Into the blood off of me. 

Me and lie on the streets of law, 
Breaking down the road. 
So bringing me down, 
Well in to the ground. 
No one sees me, and no one talks, 
Cuz we all know it to be mine. 

Me and lie on the streets of law, 
Breaking down the road. 
So bringing me down, 
Well in to the ground. 
No one sees me, and no one talks, 
Cuz we all know it to be mine. 

yeah. 
yeah. 
yeah. 

[whispered] 
yeah, spend 
spend yeah. 
yeah, spend 
yeah, spend 
yeah. 
yeah. 
yeah. 
yeah. 
[whispered] 

Yeah. 

Darkness imprisoning me, 
Feeling, that darkness in me. 

Me and it's you, and I run over you. 
So let me be. 
Swing low, 
Into the blood off of me. "
42,Thee Ol' Boozeroony ,"You gotta hear it, man
Don't do this to me"
43,Thong Song ,"I don't need a seance 
I don't read grey lines 
I signed it away 
way long 
I hate, slow songs 

whoa yeah, 
I don't even care 
whoa yeah, 
I go over there 

my hair is, 
real long 
no brains 
all groin
no shoes 
just thongs, 
I hate, slow songs 

whoa yeah, 
you cry like I care 
whoa yeah, 
buck naked and there... 

hooray, hooray for you 
hooray, hooray for you 
hooray, hooray for you 
hooray, hooray for you 
hooray, hooray for you 
hooray, hooray for you"
44,Thumb ,"you don't seem to understand the deal, 
I don't give two shits on how you feel, 
you're burned by my lighter, 
you've been burned by my lighter, 
and my lighter is held down by my thumb 

you're living in thought so 
you're living in thought so 
you're living in thought so... 

you tried to turn me off 
but you couldn't even turn me down 
as I sat and I told you were living in hell 

you're in desert ground 
and now you've found 
my foreman and you 
and you'll since I got in this well... 

you're living in thought so 
you're in thought so 
you're in thought so..."
45,Whitewater ,"Oh sunshine, 
The loving beauty, 
Pass me by, 
Should I waste my time 
In your valley, 
Beneath your sky? 

Aah 
Aah 
Aah 
Aah, I am home 

You move your own mountain, 
The trees have grown, 
The trees have grown, 
Now it's over, 
Now it's over and I'm coming home 

Aah 
Aah 
Aah 
Aah, I am home"
46,Window Of Souls ,"
Two worlds separate us 
I'm alone and waiting - 
Waiting for you 
Little princess 
Come by my side 
Come around 
Come around to me 
Endless waiting for you 
Time has held me back no more 
End is waiting for you 
No one can keep me from you 
My life long dream 
Come to me for sure 
Vowed eternal soul 
Now envelope me... 
I offer thee all... 
All for you 
Soul stealer, it's time to be 
Spirit away now... "
47,Writhe ,"Everyone seems to be singing for Satan 
Guess I will to. 
What a joke, 
You make me laugh, 
Till I turn blue. 

Any tailor's out to ware, 
What a menhir looking crew. 
I don't think I'll tease my hair, 
I'd rather sit here teasing you. 

Won't you writhe like snakes down on the floor 
Out you go and he done one hundred and more. 

I seem to've lost my cowboy boots 
with the fringe runnin' down the side 
my sewing machine has made me green 
'cuz my jeans didn't turn out tight 

And all these ruins I took for you, 
you keep my limit alive. 
Your smile rolls away for miles, 
and your kiss makes it worth the ride. "
