,Title,Lyrics
0,(Beginning Of What's About To Happen) ,"In the middle of the Highway, 
As you ride down the road, 
Just get that feeling, 
It's all so black and bald. 
And then theres my face, 
When you're drivin the desert sand, 
Well open my hand, 
Well open up the land. 

Yeah. 

Well everyone now bring your car to me. 
From the mother of earth to the depth of the sea. 
Well dont raise any hand for me, 
When ya na na na na need me. 

Yeah. 

In the middle of the Highway, 
As you ride down the road, 
Just get that feeling, 
It's all so black and bald. 
And then theres my face, 
And a-drivin the desert sand. 
Well open my hand, 
Well open up the land. 

Yeah. 

Well everyone now bring your car to me, 
From the mother of earth to the depth of the sea. 
Well dont raise any hands for me, 
no no, 
When ya na na na na need me. 

Yeah."
1,100' ,"Step on it,
I beg you please,
Jus' 100' I'm on my knees,
It's the one you blow,
It's the one you show,
So then you know I'm right


There's been a place built for you,
Sit by the fire tell, me truths,
Don't blind my eyes turn them blue,
And then I'll dry my face on you

Step on,
I beg you please,
Jus' 100' so I freeze,
Drowning in that ice I fly,
It's a great white place,
And the heat's diseased

100'"
2,50 Million Year Trip (Upside Down) ,"I am drinking 
I am rolling (you can't stop me) 
I am hiding 
I am running (you can't stop me) 

But I'll never forget you (anyway) 
But I'll never forget you (anyway) 
But I'll never forget you (anyway) 
But I'll never forget you 

I am drinking 
I am rolling (you can't stop me) 
I am running 
I am rolling (you can't stop me) 

But I'll never forget you anyway 
But I'll never forget you anyway 
But I'll never forget you anyway 
But I'll never forget you 

See our family to realize 
As it's running down today 
I love the city love the day 

No fool for you 
In this I am 
I'm never gonna run about"
3,Allen's Wrench ,"[Verse 1]
Your subdivision has been plastic emotion

[Chorus]
It's all you get
It's all you get
It's all you get
It's all you get
Allen's wrench
It's all we get

[Bridge]
Always there
Man, you better never

[Verse 2]
'Cause I like the tension, magic mother potion

[Chorus]
It's all you get
It's all you get
It's all you get
It's all you get
Allen's wrench
It's all you get
Well, Allen's wrench
It's all you get
Well, Allen's wrench
It's all you get
Well, Allen's wrench
It's all we get

[Outro]
Breathe up, man, Allen's wrench
Break soon, take, Allen's wrench
Breathe up, man, Allen's wrench
Break soon, take, Allen's wrench
Breathe up, man, Allen's wrench
Break soon, take, Allen's wrench"
4,Big Bikes ,"Here she comes a ridin 
Well burning down the street. 
Here she comes a fucking the boy, 
Hear the New York street 

Cuz I want some pussy, 
Yeah yeah yeah yeah. 
From a back bitch 
well on a big bike, 
big bike yeah. 

He is feelin' nasty, 
She is feelin' nice tonight. 
Hey baby, well, I want to cool you down. 
I need something tonight 

Cuz I want some pussy, 
Yeah yeah yeah yeah. 
From a back bitch 
On a big bike, 
Big bike yeah. 

Here she comes a ridin 
Well burning down the street. 
Here she comes a fucking the feet boy, 
Hear the New York street 

Cuz I want some pussy, 
Yeah yeah yeah yeah. 
From a back bitch (mmm) 
On a big bike, 
Big bike.... 
Big bike. 
Whose the? 

Yes you think it wide? 
Yes you, 
Yes you, 
Yes you CK... 
*Yeah*"
5,Black Widow ,"Give me now (x5)
Give me a way
Give me a fucking reason
A reason I should stay

Built for business or for pleasure
Any way you choose
It doesn't matter how or why
'Cause either way, you lose

Give me now (x5)
Give me a way
Give me a fucking reason
A reason I should stay

Built for business or for pleasure
Any way you choose
It doesn't matter how or why
'Cause either way, you lose

Yeah, yeah"
6,Born To Hula ,"Follow trails of you to here 
Every mile takes you my way 
Rolling faster if we can 

Tables turning all the time 
I'm the dog at your feet 
So we are it again 

You're the one 

Fucking have to wait a dime 
Different signals blinking my way 
Coming faster all the while 

You're the one 

Ain't it something, we're born to hula "
7,Catamaran ,"[Verse]
Smooth stones beneath me
Cool air surrounds
Soft and savoury
You can take me to God
You can take me to God

[Chorus]
No, it doesn't take your will
To set your brace on me
I never doubt your possibilities
Please let go of my sleeve

[Verse]
Smooth stones behind me
Cold air surrounds
Soft and savoury
You can take me to God
You can take me to God

[Chorus]
No, it doesn't take your will
To set your brace on me
I never doubt your possibilities
Please let go of my sleeve"
8,Conan Troutman ,"Feed my lungflower seed, 
You are gone and now I'm free (I'm free - yeah), 
Strip me down to nothing, 
Fuck me will free the vulture (make it fly), 

Burning my brain and burning my teeth (in the sun), 
100ř and burning my need (make it fly), 
Live the love that I have for you, 
Taking you life for want you (free) "
9,Day One ,"Don't be sad for what will never be
Be glad you didn't have to see
This time became a part of me
And now this burning memory

The sun will break the night till dawn
And then we'll tell some tales again
And when the time has come and gone
The wind will carry on and on
The wind will carry on and on
The wind will carry on and on"
10,Deadly Kiss ,"Look into my face now
Stare into my eyes
Hellfire in my veins
in my veins
in my veins
in my vein, yeah.

I can see through your eyes,
Its no disguise to me,
I can see through the lies,
No one can make a fool of me.

Drowning in your lonliness,
Want to bring me down with you.
No one buys your innocence,
Gonna' break your walls in two.
Well in two,
Well in two.

No one buys it,
No one wanted to,
With you,
You,
Fuck you.

Dig your grave for two.

Walk my way,
Get out of my way.
Well I wanted you,
I saw right through ya.
Well I'm your man,
You'll understand,
You'll pay the price,
To live in a-paradise.

Look into my face now,
Stare into my eyes.
Hellfire in my veins,
In my veins,
In my veins,
In my vein yeah.

I can see through your eyes,
Well its no disguise to me.
I can see through the lies,
No one can make a fool of me.

I'm drowning in your lonliness,
Want to bring me down with you.
No one buys your innocence,
Gonna break your walls in two.
Well in two,
Well in two.

Well no one buys it,
No one wanted to,
With you,
You,
Fuck you.

Dig your grave for two."
11,Demon Cleaner ,"I've got the demons in me 
I've got to brush them all away 
I feel the demons rage 
I must clean them all away 

Yeah (yeah) 

Inside you see more of me 
Cobwebs in the way 
That magic cleaner will 
Shine his smile on me 

Yeah (yeah) 

I am the Demon Cleaner 
who saves the day 
I get the back one, 
important they'll always stay 
Yeah (yeah) 

If only one thing that you know 
Impostors from the show 
They'll try to trick you into 
Normal treatment 
Oh, don't you listen to them say 
Shush them all away 

I am the Demon Cleaner, 
the madman saver
I am the freedom bleeder, 
standing naked here to say 

I'm the only way
I'm the only way
I'm the only way
I'm the only way"
12,El Rodeo ,"johnny
and if you're trying to ride for free
oh johnny
it'll be the same I do to you

johnny
and if you wanna turn my knees(?)
oh johnny
it'll be the same I do to you

johnny
and if you're trying to ride for free
oh johnny
it'll be the same I do to you

yuh [some kind of grunt]

johnny
and if you wanna turn my knees
oh johnny
it'll be the same I do to you

johnny
and if you're trying to ride for free
oh johnny
it'll be the same I do to you

rodeo... johnny

yuh [some kind of grunt]

if you're trying to ride for free.... rodeo

rodeo
rodeo
rodeo
rodeo
rodeo
rodeo
rodeo
rodeo
rodeo"
13,Fatso Forgotso ,"It's hanging above you and it's over 
It's over your head 
Hovering slowly I hear words 
Too and I totally agree 
It ain't just you and me 

Since then you've been looking at me 
Like I been on your mind 
Everything would have been 
Don't take it like we're taking it home 

It's over your head 
It's over my head "
14,Fatso Forgotso Phase II ,"You lay it down and let it 
Teach you a lesson 
Lay it down but it's up in a second 
I thought it was something I could grip on 
I'm burning out like leaving the light on 

Well it ain't fair, it ain't done 
It ain't up to me "
15,Freedom Run ,"Freedom run [Repeat] 
Free to run [Repeat]... 
Freedom run [Repeat] 

No break through, 
I steal for you. 
I need ya, 
and there's nothing you can do, yeah. 

Walked hundred miles of desert sun, 
to grasp the chance that I'll be gone, 
be one with you, yeah. 

Freedom run [x3] 

Well I'll break through, 
Well I steal for you. 
Well I need ya, 
and there's nothing you can do, yeah. 

No form in past 
I hope you last. 
You're in my grasp 
I loved you ohS yeah yeah... "
16,Gardenia ,"one blow till I take ya down, I'll take ya down 
one smoke and your head spins around and around 
chrome bags, a million drags, a never lags, 
and old transform queen momma you've never seen 

hear a purrin' motor 
and she's a burnin' fuel 
push it over baby 
oh makin' love (un)to you 

power booster, I'm talkin' to god and more 
crank it up and above my head 
smell my shit eatin grin on the skids of my world 
six hundred sixty six miles per hour 

hear a purrin' motor 
and she's a burnin' fuel 
push it over baby 
oh makin' love..... 

hear a purrin' motor 
and she's a burnin' fuel 
oh baby burnin' 
push it over baby 
oh makin' love (un)to you 
makin' love (un)to you 
makin' 

get back, get back a rolling 
get back, get back a rolling 
get back, get back a rolling 
get back, get back the motherfucker 
get back, get back a rolling 
get back, get back the motherfucker 
get back, get back the motherfucker"
17,Gloria Lewis ,"When the feeling comes it always leaves, 
to the top of the hill, 
the hill of thieves. 
Brush that curious out. 
Hurry away. 
You've got the hole in your head to feel the breeze. 

If you're gonna ride, baby, 
ride a/the wild horse. 
I/we can't drink no more, 
but I'll/we'll try. 
You can't find us, baby, 
in the basement. 
And it/I slug your in your fucking hea"
18,Green Machine ,"[Verse 1]
I've got a war inside my head
It's got to set your soul free
I've got a wheel inside my head
A wheel of understanding

[Chorus]
I'm a loadin', loadin' my war machine
I'm contributing to the system
The break down scheme
I'm a shuttin' down
I'm shuttin' down your greed for green
I am here to gun it down, I gotta do

[Verse 2]
I see pretty flowers at my feet
Cool breeze, clean air, hospitality
Pretty please, pretty please, pretty please
Get the hell away from me

[Chorus]
I'm a loadin', loadin' my war machine
I'm contributing to the system
The break down scheme
I'm a shuttin' down
I'm shuttin' down your greed for green
I am here to gun it down, I gotta do

[Verse 1]
I've got a war inside my head
It's got to set your soul free
I've got a wheel inside my head
A wheel of understanding

[Chorus]
I'm a loadin', loadin' my war machine
I'm contributing to the system
The break down scheme
I'm a shuttin' down
I'm shuttin' down your greed for green
I am here to gun it down, I gotta do"
19,Happy Birthday ,"
Happy, happy birthday 
Two years dead today 
You can't keep me running 
You can't keep me from hiding from you 
Don't mess around with me 
I'm down to the wire 
And I'm burning 
I'm burning higher and higher and higher 
I keep on running 
I never seem to get away from you 
I can't escape the memories 
That haunt me every day and night 
Just you leave me alone 
I'm down to the wire 
And I am burning 
Higher and higher and higher "
20,Hurricane ,"I feel nothin', said I don't feel nothin'
And I won't feel nothing at all
I found somethin', said I really found somethin'
And I won't take nothin' at all

Get me up, get me up, now I've suffered
My life has blown me away
I can't breathe, said I can't breathe nothin'
And I won't fuckin' breathe at all

I feel nothin', said I don't feel nothin'
And I won't feel nothing at all
Found somethin', said I really found somethin'
And I won't take nothin' at all

Get me up, get me up, I've suffered
My life has done me away
Can't breathe, said I can't breathe nothin'
And I can't fuckin' breathe at all"
21,I'm Not ,"I'm not, 
Ready to leave this world. 
Bring as big a people, 
Well no one told me about them. 

Sometimes, well it doesnt seem to matter, 
But I'll make mine a good one. 
Up with the clouds of hate. 

Only, 
time, 
will tell, 
Time, will tell. 
Will tell. 

I'm not, 
Ready to leave this world. 
Bring as big a people. 
Well no one told me about them. 

Sometimes, well it doesnt seem to matter, 
But I'll make mine a good one. 
Up with the clouds of hate yeah... 

Well only, 
Time, 
Will tell, 
Well only 
Time, will tell. 
Well only time. 

Well only time will tell. 

Takin' it yourself, 
Well only time will tell. 
Yeah. 

Only. 
Time 
Will tell 
Only, 
Time, tell. 

Well only time will tell. 
Well only time will tell. 

Well I'm not, 
Ready to leave this world. 
Bring as big a people, 
Well no one told me about them. 

Sometimes, well it doesnt seem to matter, 
But I'll make mine a good one. 
Up with the clouds of hate yeah... 

Only. 
Time 
Will tell 
Only, 
Time, will tell. 
Only, time."
22,If Only Everything ,"If it gets you down 
Well then I want it 
If it gets you up, well 
I don't want it 
Lets you down 
So broken hearted 
If it gets you down 
Well then I want it 

If only we're nothing at all 

So blow my mind 
It's just so crazy 
Those long, long days 
Just make it eighty 
So roll the wheel 
And there it goes 
And where it stops 
You never know 
If it gets you down 
Then just don't blame me 

If only we're nothing at all"
23,Into the Void ,"Rocket engines burning fuel so fast 
Up into the night sky they blast 
Through the universe the engines whine 
Could it be the end of man and time 
Back on earth the flame of life burns low 
Everywhere is misery and woe 
Pollution kills the air, land, and sea 
Man prepares to meet his destiny 

Rocket engines burning fuel so fast 
Up into the black sky so vast 
Burning metal through the atmosphere 
Earth remains in worry, hate and fear 
With the hateful battles raging on 
Rockets flying to the glowing sun 
Through the empires of eternal void 
Freedom from the final suicide 

Freedom fighters sent out to the sun 
Escape from brainwashed minds and pollution 
Leave the earth to all its sin and hate 
Find another world where freedom waits 

Past the stars in fields of ancient void 
Through the shields of darkness where they find 
Love upon a land a world unknown 
Where the sons of freedom make their home 
Leave the earth to Satan and his slaves 
Leave them to their future in their grave 
Make a home where love is there to stay 
Peace and happiness in every day "
24,Isolation ,"Did your walls of sin, 
Crumble at your feet? 
Does the blood on your face, 
And your hands taste too sweet? 

And in my mind, 
You were looking fine. 
Well isolation. 
Well and inside, you ain't fine to me 
Well isolation, desolation. 

Don't wait for me, 
Well at the edge of the world. 
Yeah, don't come to me at all. 
The way you look and think of me, 
Well it's much, 
much, 
much, 
much too strong. 

And in my mind 
You were looking fine 
Well isolation. 
Well and inside, you ain't fine to me. 
Well isolation, desolation. 

Don't wait for me, 
Well at the edge of the world. 
Yeah, don't come to me at all yeah. 

The way you look and think of me, 
Well it's much, 
much, 
much, 
much too strong. 

And in my mind, 
You were looking fine. 
Well isolation. 
Well and inside, you ain't fine to me, 
Well isolation, desolation."
25,Isolation Desolation ,"Wait for me
At the edge of the world
Don't come to me if you're not quite sure
Do you feel the emptiness inside your soul
Did it break that heart of coal

Did your walls of sin
Crumble at your feet
Does the blood on your face
And on your hands, taste too sweet

In my mind you ain't lookin fine
So isolation
And inside you ain't fine to me
So isolation desolation

Don't wait for me
At the edge of the world
Don't come to me at all
The way you look
And think of me
Is much much much
Too small"
26,Katzenjammer ,"I want a girl and not a pearl. 
I want a girl who'll take me home. 
A kind is nice and will get me 
where i want to go. yeah. 
Theres been a lover to ignore me, 
To ask me the one who knows. 
If I tell the car, run the other, 
Will it end from there? 
Take a look underneath the hood, 
And I won't be friends. 

Baby in my motor, 
Make my blood boil, 
Be on her. 

Baby in my motor, 
Make my blood boil, 
Be on her. 

Blue Shaddows on the track. 

Run your fingers through my hair, 
Use my Dodger to get me there. 
Line my seats with everybody there. 
Oh my god then baby will last, 
Its got little hands and baby blue eyes, 
Mine who will last when my baby will lie. 

Baby in my motor, 
Make my blood boil, 
Be on her. 

Baby in my motor, 
Make my blood boil, 
Be on her. 

Baby in my motor, 
Make my blood boil, 
Be on her. 

Baby in my motor, 
Make my blood boil, 
Be on her. 

yeah."
27,King ,"Hey, you 
You're on your knees 
You say you love me 
So prove it to me 
Cause I'll never... 
Say it to you 
No I'll never, ever, ever 
Say i love you 
Truth hurts... "
28,Love Has Passed Me By ,"Do I look blind?
Or deaf?
Or dumb to you?

Do you see burning pictures on my face?

It didn't take long
To figure out whats wrong with you
Fuck Off, well I'll put you in your place

Could it be
That love has passed me by?
And could it be
You're just a thorn in my side?
And all I see
Is that your walking away from me?
And all I know
Is that you'll never change me

This hate in me
Well it's burning in my veins
I'm gonna' take it out on you
Well and make you feel my pain yeah
Cold carresses
Well as you walk away
Baby, things arent
Supposed to be that way, no no

Could it be
That love has passed me by?
And could it be
You're just a thorn in my side?
And all I see
Is your walking away from me?
And all I know
That you'll never...

Do I look blind?
Or deaf?
Or dumb to you?

Do you see burning pictures on my face?

It didn't take long
To figure out, whats wrong with you
Fuck Off, well I'll put you in your place yeah"
29,Mondo Generator ,"Ah! Who's gonna take you there/tell you that? 
You're such a good way back...long [x3] 
way from here. 

Yeah, down 

What's the difference? 
What do you do? 
Mondo generator. 
Well, I try to cross the edge. 
Well, who, who can find me there? 

I want to find you there, I'm never coming. 
Who was the tragic fool? What's wrong with my head? 

You try to match it without a hope in hell, you're such a fool. 
I cannot take you there. 
What does [x3] it take? 
Every time I knew you, you try to, I can't hear you there. 

There's something there. 
You try to match it without a hope in hell, you fucking fool. 
What fucking difference does it make? 
There's nothing left but what goes up [x4] 
I gotta do something or what will happen there might fuck. 

When you look back you gotta a long way to go there (there). 
What the fucking hell is going on? 
I tried more and more (more!!!). 
I gotta give. 
Get back, you gotta give. 
Oh [x3]. (Oh) "
30,N.O. ,"I wake up tomorrow today
Just help me find my head
I could be dead

Where to go, what to say
When you're crossin' my line
Oh, give me time, give me time
Oh, just like they said

I live my life alone
Never going home
Just like they said
It's just a song to sing, it's just a song to sing

I wake up tomorrow today
Just help me find my head
I could be dead

Where to go, what to say
When you're crossin' my line
Oh, give me time, give me time
Oh, just like they said

I live my life alone
Never going home
Just like they said
It's just a song to sing, it's just a song to sing

Give me love, give me love
Give me love
Well, just like they said"
31,Odyssey ,"Take one to the mountain
Take one to the sea
Take one to the belly of the beast
And then you'll take one with me

Shut it
Shut it

Freezing in the fires
Well I oughta howl your name
Once you return from the belly of the beast
You're never quite the same

Shut it, shut it on
Shut it, shut it on

Fire on the mountain
And it rages out of control
The fire inside the belly of the beast
Well it burns, then wraps your soul

Shut it, shut it on
Shut it, shut it on"
32,One Inch Man ,"[Verse 1]
One inch man, lonely soul
Two inch man (two inch man), gimme more
Five steps and back, get him back
Three steps enough, get him up

[Chorus]
Always so lonely, lonely, lonely x2

[Verse 2]
One inch man, lonely soul
Two inch man, gimme more

[Chorus]
Always so lonely, lonely, lonely
One inch man, he's so lonely, oh, he's breathing

[Bridge]
Damn my thoughts for you, do you really wanna fuck me?
Love my time for you, do you really wanna hold me?
Had my time for you, do you really wanna hold me?
Love my time for you, do you really wanna?

[Chorus]
Always so lonely, one inch man, he's breathin'
Always so lonely, lonely, lonely
One inch man, he's so lonely, oh!"
33,Phototropic ,"Under light, that I have never seen
Go to the light, reach up to the beam
Under light, under light
Reach up to the sun or you can run

Found the roof, the smallness of it all
Found the roof, you will never fall
You'll never
You'll never
You'll never
You'll never"
34,Size Queen ,"So clean, so blue and it's so deep 
Shallow 
Refreshing bowl and it's so clear 
Shallow 
Best thing I've seen in my whole life 
Shallow 
You must return me to your beach 
Shallow 
So I dive,inches to the ground 
Now allright 
Inches to the ground 
So clean, so blue and it's so deep 
Shallow 
Refreshing bowl and it's so clear 
Shallow 
Best thing I've seen in my whole life 
Shallow 
You must return me to your beach 
Shallow 
So I dive, inches to the ground 
Now allright 
Inches to the ground 
So I dive,inches to the ground 
Yeah "
35,Son of A Bitch ,"God damn Son Of a bitch. 

God damn son of a bitch. 
God damn son of a bitch. 
God damn son of a bitch. 
God damn son of a bitch 

God damn son of a bitch, 
See the young ones play, 
And say what you want to hear. 

You have a-long legs, 
Long Hair, 
Big tits, 
You got a big arse. 
Your butt/pot will never last. 
Never Last... 

God damn son of a bitch. 
God damn son of a bitch. 
God damn son of a bitch. 
God damn son of a bitch 

God damn son of a bitch, 
See the young ones say, well and play, 
What they want to hear, from you. 

You say your not fucking with them, 
You say they are fucking with you, 
Compete with them and you'll never win, 
Never Win... 

God damn son of a bitch. 
God damn son of a bitch. 
God damn son of a bitch. 
God damn son of a bitch 

Well its cold where we come from, 
But not to make me freeze. 
I look around me at what I see, 
The world deeper than before, 
They put a change in me, 
Things are looking pretty blurry. 
I keep a wishing she would wake me, 
And tell me it was just a bad dream, 
But I guess your gonna' be awakened, 
Well your already wakened to reality. 
Yeah..... 

God damn son of a bitch. 
God damn son of a bitch. 
God damn son of a bitch. 
God damn son of a bitch."
36,Space Cadet ,"I'm standing alone on the cliffs of the world. 
No one ever tends to me. 
Sitting alone, covered in rays. 
Some things are so my mind can breath 

Waiting is hard 
Fucking takes so long 
Draped in sun - hands in sand 
Earth acid cleanses me, cleanses me clean 
But the world, it never comes 

It never comes 
It never comes 
It never comes 

I lay on my side in the edge of the room 
She never expects anything from me 
When all the days - the days of the year 
I know I miss that part of me. 

Waiting is hard 
Fucking takes so long 
Draped in sun, hands in sand 
Earth acid cleanses me, cleanses me clean 
But the world it never comes 

It never comes 
It never comes 
It never comes 
It never comes 
It never comes"
37,Spaceship Landing ,"You've been in back of me (yeah)
Feeling sent to me (yeah)
I'm tired of the word
When my back ain't around here

No more you and me (yeah)
No more listening (yeah)
Tired of your word
All your words are so backwards

Being as lost as can be (yeah)
Touch of purity (yeah)
If you're gonna go now
Well I wanna go with you

Uh, oh
Uh, oh

Oh yeah, you're a fucked up man
With a fucked up plan
Oh yeah, you're a fucked up man
With a fucked up plan
Oh yeah, you're a fucked up man
With a fucked up plan
Oh yeah, oh yeah

Did I say too much?
You didn't want me to hear
Did I say too much?
I didn't want me to see here
Did I hate too much?
I'm not sure I should leave here
Did I hate too much?
I'm thinking someone should bleed here

Why the finger? it's all right
Me and you could, it's all right
Straighten me out, it's all right
Guiding light, it's all right

There you go, it's all right
Wait up and turn me in, it's all right
Help you out man, it's all right
Help me in, I just might"
38,Supa Scoopa And Mighty Scoop ,"Don't try to take me away, 
Like I can't live without you, 
Today, makin' love tomorrow, 
So way, swooping you're so fragile, 
Die today, you disgrace the mortal. 

Fight me lately, 
Tried to someone, 
We've been laughing, 
Since you've been gone, 
And I want to know, 
Did you all enjoy the show? 
It's so sad to see you go 

And you know
I'm home!
Alone!
Always on his own!

Hanging low today, 
I replace the highway, 
Love the only way, 
Licking hands the wrong way, 
So I bare to see you go, 
It's so sad to see you go, 
I just thought I'd let you know 

And you know
I'm home!
Alone!
Always on his own!"
39,Tangy Zizzle ,"Yeah, yeah, put it in gear, baby. 
Hell yeah, that's a what I like about you, baby, 
you're always on time."" 

Wherever you go is where I go. 
Whatever you say keeps it running. 
When the wind blows, 
when the sky breaks, 
to the horizon, 
and believe it. 

Where you want me to be. 

In the morning when it's raining, 
I couldn't believe it, 
no complaining. 
Fuck the others, 
fuck the teachers, 
they've never known this, 
is he crazy? "
