,Title,Lyrics
18,Jestem Bogiem ,"[Magik]

Raz, dwa
Raz, dwa

Mam jedną pierdoloną schizofrenię
Zaburzenia emocjonalne, proszę puść to na antenie
Powiem Ci że to fakt, powiesz mi, że to obciach (hah)
Pierdolę Cię, i tak rozejdziesz się po łokciach
Bo ja jestem Bogiem, uświadom to sobie (sobie)
Słyszysz słowa, od których włos jeży się na głowie
O rany, rany, jestem niepokonany
H-I-P H-O-P bez reszty oddany
Przejebany, potencjał niewyczerpany
Chyba w DNA on był mi dany
Czekaj Fokus, Rah, jeszcze oszaleją wszystkie pizdy
Gdy poznają mój urok osobisty
Duszę artysty, to jaki jestem skromny i bystry
Szczery do bólu, że aż przezroczysty i
Wiesz co mnie boli? Że w głowach się pierdoli
Zakłócony pokój ludziom dobrej woli.

Jestem Bogiem!
Uświadom to sobie, sobie
Ty też jesteś Bogiem!
Tylko wyobraź to sobie, sobie

[Rahim]

W pełni poczytalny, za czyny swe odpowiedzialny
Jak ty nieprzemakalny, pędzi tu jak halny
Wyprzedza świat realny, nawiedza w wirtualny
System binarny, materiał łatwopalny
Da przepływ momentalny energii, cios werbalny
Kandydat potencjalny na występ teatralny
Doznaje szoku w 2000 roku, za to spalmy
Pora na elaborat eksperymentalny
W sposób niekonwencjonalny głoszę treści,
słuchaj proszę
Trafiam Cię w punkt centralny,
wiedz, że niepewności spłoszę
Nastroszę się, gniew boski jest nieobliczalny
Unoszę Cię, z góry widok kapitalny
I idealny obraz, jak krajobraz tropikalny
Monstrualny krach! Rah nieprzewidywalny

Jestem Bogiem!
Uświadom to sobie, sobie
Ty też jesteś Bogiem!
Tylko wyobraź to sobie, sobie

[Fokus]

Widzę, widzę, widzę więcej
Wiem więcej, tak to jest mniej więcej
Uczę się sztuki życia, hip hop to mój sensei 
I rzu-cam tym, a to jak kauczuk
Czysta technika, żadnego fałszu
Niuanse, sensacyjne seanse
W bezsensie sens jest jedynym awansem
Balansem w naturze, równowagi korekta
Unoszę się ponadto na specjalnych efektach
Cel - eS eM O Ka na kartki biel
A eN Be eL O Ka E Jot Be E eL
Le-le-lekko jak hel napełniam trwogą
I zapewniam jak wrogom kontakt z podłogą
Twą dozgonną chęć dorównania swym bogom
Ogrom PFK podąża swą drogą
Przysięgam na ogon, uwierzysz w co zechcę
A poczujesz jeszcze od tych lepsze dreszcze

Jestem Bogiem!
Uświadom to sobie, sobie
Ty też jesteś Bogiem!
Tylko wyobraź to sobie, sobie

(O... widzę, że pan się ładnie przedstawił przed nami,  tutaj w tej chwili słuchaczom, przed milionami słuchaczy...)"
19,Jestem Bogiem (Kipper Remix) ,"Jestem bogiem
Uświadom  to sobie, sobie
Ty też jesteś bogiem
Tylko wyobraź to sobie, sobie

[Magik]
Mam jedną pierdoloną schizofrenię
Zaburzenia emocjonalne, proszę puść to na antenie
Powiem ci, że to fakt, powiesz mi, że to obciach
Pierdolę cię, i tak rozejdziesz się po łokciach 
Bo ja jestem bogiem, uświadom to sobie, sobie
Słyszysz słowa, od których włos jeży się na głowie
O rany, rany!
Jestem niepokonany
Ha I Pe - Ha O Pe, bez reszty oddany
Przejebany, potencjał niewyczerpany
Chyba w DNA on był mi dany
Czekaj Fokus, Rah, jeszcze oszaleją wszystkie pizdy
Gdy poznają mój urok osobisty
Duszę artysty, to jaki jestem skromny
I bystry, szczery do bólu, że aż przezroczysty 
I wiesz, co mnie boli?
Że w głowach się pierdoli
Zakłócony pokój ludziom dobrej woli

Jestem bogiem
Uświadom to sobie, sobie
Ty też jesteś bogiem 
Tylko wyobraź to sobie, sobie

[Rahim]
W pełni poczytalny, za czyny swe odpowiedzialny
Jak ty nieprzemakalny, pędzi tu jak halny
Wyprzedza świat realny, nawiedza w wirtualny
System binarny, materiał łatwopalny
Da przepływ momentalny energii, cios werbalny
Kandydat potencjalny na występ teatralny
Doznaje szoku w 2000 roku, za to spalmy
Pora na elaborat eksperymentalny
W sposób niekonwencjonalny głoszę treści,
słuchaj proszę
Trafiam cię w punkt centralny
Wiedz, że niepewności spłoszę
Nastroszę się, gniew boski jest nieobliczalny
Unoszę cię, z góry widok kapitalny
I idealny obraz, jak krajobraz tropikalny
Monstrualny krach, Rah nieprzewidywalny

Jestem bogiem
Uświadom to sobie, sobie
Ty też jesteś bogiem
Tylko wyobraź to sobie, sobie

[Fokus]
Widzę, widzę, widzę więcej
Wiem więcej, tak to jest mniej więcej
Uczę się sztuki życia, hip hop to mój sensei
I rzu-cam tym, a to jak kauczuk
Czysta technika, żadnego fałszu
Niuanse, sensacyjne seanse
W bezsensie sens jest jedynym awansem
Balansem w naturze, równowagi korekta
Unoszę się ponadto na specjalnych efektach
Cel - eS eM O Ka na kartki biel
A eN Be eL O Ka E Jot Be E eL
Le-le-lekko jak hel napełniam trwogą
I zapewniam jak wrogom kontakt z podłogą
Twą dozgonną chęć dorównania swym bogom
Ogrom PFK podąża swą drogą
Przysięgam na ogon, uwierzysz w co zechcę
A poczujesz jeszcze od tych lepsze dreszcze

Jestem bogiem
Uświadom to sobie, sobie
Ty też jesteś bogiem
Tylko wyobraź to sobie, sobie"
20,Le się zmahauem ,"FOKUSMOK:: 
THC ... THC 


MAG:: 
Hmm… 
No… 

FOKUSMOK:: 
THC ... THC 

MAG:: 
Że… 

FOKUSMOK:: 
THC ... THC 

MAG:: 
Hmmm.. 

FOKUSMOK:: 
THC ... THC 

MAG:: 
No… 

FOKUSMOK:: 
THC ... THC 

MAG:: 
Hmmm.. 


MAG:: 
Mach za machem, nie jak hamak macha 
Magik wciąż aha, nie jak wahadło waha, 
Bo mam kota, nie jak Ala
Zrównoważony jednak nie jak szala
Na kolację, obiad, czy śniadanie 
Zdecydowany niezdecydowanie 
Gramy to gramy, nie gramy, mam banie 
Nie takie tanie jest to bakanie 
Gramy, nie gramy, to gramy, mam manię 
Nie takie tanie w końcu te granie 
Na pierwszym planie, nie jak na ekranie 
Magik na poziomie morza zostanie 
Bo nie grasuje pod wpływem grassu 
Od czasu do czasu bitu i basu 
To mi tu spasuj, nie jak pas w kartach 
Myślę, że gra ta jest świeczki warta 
Czasem wybucham, nie jak petarda 
Nie jak Titanic toniemy na laurach 

Ale.. ale.. 

FOKUSMOK:: 
się zmahauem 

MAG:: 
Chyba zapomniauem, 

FOKUSMOK:: 
że 

MAG:: 
Pamiętać, by nie zapalić miauem 

FOKUSMOK:: 
Ale.. 

MAG:: 
się zmahauem 

FOKUSMOK:: 
Chyba zapomniauem, 

MAG:: 
że 

FOKUSMOK:: 
Pamiętać, by nie zapalić chciauem 

MAG:: 
Ale.. 

FOKUSMOK:: 
się zmahauem 

MAG:: 
Chyba zapomniauem, 

FOKUSMOK:: 
że 

MAG:: 
Pamiętać, by nie zapalić miauem 

FOKUSMOK:: 
Się zmahauem... 

MAG:: 
Się zmahauem... 
Się zmahauem... 
Się... 
Aa ha 
No... 
Hmmm.. 


FOKUSMOK:: 
Ale znowu się zakałapućkałem 
Miałem do wyboru i wybrałem 
Że pociągnie mnie THC,
Na tyle, że ja pociągnę je 
Dobrze, czy źle, a kto to wie 
Płuco me domaga się, mówię - nie 
Mogę se całe gadanie wsadzić w D 
Taka jest właśnie cecha THC 

FOKUSMOK:: 
Ale.. 

MAG:: 
się zmahauem .. 

STRAHO:: 
się zmahauem 

FOKUSMOK:: 
Ale.. 

MAG:: 
się zmahauem .. 

STRAHO:: 
się zmahauem 

FOKUSMOK:: 
Ale.. 

MAG:: 
się zmahauem .. 

STRAHO:: 
się zmahauem 

FOKUSMOK:: 
Ale.. 

MAG:: 
się zmahauem .. 

FOKUSMOK:: 
THC ... THC 

MAG:: 
Hmmm...."
21,Lepiej być nie może ,"Lepiej być nie może
Jak będzie się okaże
A że to właśnie jest
Everest moich marzeń  /x4

W przyspieszone tryby życia wchodzę
Ja piechotą nie chodzę
Bo się bujam wózkami po drodze
Całej załodze Pań słodzę
Tylko na pierwszą klasę się godzę
Tonę w sygnetach, złotych kietach
Kotku, wybierz wakacje może Kreta
ślicznie!
Kobieta kocha mnie bezgranicznie
I fizycznie i platonicznie
Banknot szeleści w kapsie jest fantastycznie
Non stop humor notorycznie
Wiecznie za kierownicą Jeep'a
świątecznie, co dnia wszędzie noszę miano VIP-a
I super typa
Razem ze mną ekipa
Kręcimy kolejnego Klipa
Tym razem numer na płytę Mobb Deep'a
Telefon 'pipa' Halo, wynajmuję lożę
Miękkie chcę podłożę
Życie w kolorze
Każdy mi pomoże
O każdej porze mam wszystko
Lepiej być nie może 

Są momenty
Gdy wyobrażam sobie życia lepszego fragmenty
Tworząc wzorzec
Sumując elementy
Mogąc orzec
Lepiej być nie może
O tym rymowane słowa w tym utworze  /x2

Nie potrzeba mi wiele
Wystarczy czarter na Seszele
Przyjaciele, holenderskie ziele
Głębokie fotele
I konsola na czele
Z telewizorem o płaskim kineskopie
Oto w czym topię to co zarobię na hip hopie
Mój talent to ekwiwalent akcji
Ulokowanych w ropie
Każdy bank w Europie wie
Że eS eM O Ka jak Hworang kopie
Sprawdź to chłopie
Stale palę konopie
Wszystko ma priorytety
Ja mam łańcuch złoty
I w dupie sprawy dotyczące wysokości kwoty
Za samochody, jachty, posiadłości, samoloty
Nie myślę o tym kiedy wsiadam do mojej Toyoty
A ze mną wsiada ""!"" ubrana u Diora
Od rana do wieczora do roboty jest kontrola
Mikrofonu i nic więcej
Więc lepiej być nie może
Mam życie kolorowe jak w technikolorze
Co stworzę sprzedaje się w tysiącach egzemplarzy
Czasami nie starcza mi czasu
Na rajdy Jeep'ami po plaży
Z kumplami, bo przesiaduję w studiu
Właśnie tak się to robi na południu
Bywam w jednym dniu na obu stronach globu
Wrogów zazdrość wpędziła do grobu
Nie bez powodu zresztą
Mag i Rah tu też są
Nie ma sposobu by usunąć ich i mnie stąd wiesz to! 

Są momenty
Gdy wyobrażam sobie życia lepszego fragmenty
Tworząc wzorzec
Sumując elementy
Mogąc orzec
Lepiej być nie może
O tym rymowane słowa w tym utworze

Są momenty
Gdy wyobrażam sobie życia lepszego fragmenty
Tworząc wzorzec
Sumując elementy
Mogąc orzec
Lepiej być nie może

Z powodzeniem mogę mieć co podyktuje mi pragnienie
Nie mówiąc już o napaleniu na palenie
Tego czego nie ma w menu
Ja mam na zamówienie
I mam to jak w banku tak jak wav'y mam w Vienie
Zewsząd otacza mnie najbliższe otoczenie
I jak Nosowska mam czyściutkie sumienie
Cztery litery terenówką w terenie wożę
Mam z baldachimem łoże
W nim na rodzinę łożę
Brzuchem do góry
Dzień który był ponury jest non stop kolor
Jak kolorowe mury
No bo ma szafa gra
W niej winyle, garnitury
Na specjalną okazję zaspakajam swą fantazję
Mam świat na wyciągnięcie ręki
Dziś padło na Azję Wschodnią
A konkretnie na Tokio
By nie stracić kontaktu kontaktuję się Nokią
Mam głowę w chmurach, kiedy wyjrzę przez okno
I w sumie me mienie przerasta wyobrażenie
I nie być może lepiej być nie może
Tak jak w tym refrenie 

Lepiej być nie może
Jak będzie się okaże
A że to właśnie jest
Everest moich marzeń  /x4"
22,Magnes (Fokus solo) ,"Od rana na chodzie, 
miasto, szeroka odzież, 
mijana studiami zamotana 
złota polska młodzież... 

Od rana na chodzie, 
tyle drzwi do otwarcia, 
schodów do pokonania, 
rozmów stoczonych jak starcia... 

Od rana na chodzie, 
cały majątek w plecaku, walkmanie, 
drobne akurat na 
hamburgera bez smaku... 

Od rana na chodzie, 
nikt nie jedzie w samochodzie, 
na przedzie, a 
autobusy z Fokusem 
przechodzi co dzień... 

ref. Od rana na chodzie, 
sam powiedz jak jest... (jak jest...) 
Miasto przyciąga mnie jak magnes... (magnes...) 
Mam je w dowodzie, znany adres... (w adres...) 

Od rana na chodzie, 
sam powiedz jak jest... (jak jest...) 
Miasto przyciąga mnie jak magnes... (magnes...) 
Mam je w dowodzie, znany adres... (w adres...) 

2. Od rana na chodzie, 
urzędy otwarte do 13:00 
po nocy nieprzespanej, 
płonący kac jak azbest... 

Od rana na chodzie, 
Auta, kot drapie ci kontrakt, 
To tak jak w przyrodzie zamknięty obieg wygląda... 

Od rana na chodzie, 
Reklamy atakują , 
Ulotki, szyldy, szyby, wystawy, ton promocji czują... 

Od rana na chodzie, 
Aż po godziny szczytu... 
Też tu mieszkam, 
Wiesz to nie jest tak że ja tam a ty tu... 

ref. Od rana na chodzie, 
sam powiedz jak jest... (jak jest...) 
Miasto przyciąga mnie jak magnes... (magnes...) 
Mam je w dowodzie, znany adres... (w adres...) 

Od rana na chodzie, 
sam powiedz jak jest... (jak jest...) 
Miasto przyciąga mnie jak magnes... (magnes...) 
Mam je w dowodzie, znany adres... (w adres...) 

3. Od rana na chodzie, 
Chciane, niechciane spotkania, 
Starzy znajomi, telefon dzwoni ktoś mnie pogania... 

Od rana na chodzie, 
Kup kabel do komputera, label otwieram 
Nie teraz, cyfry i zera, jeszcze raz... 

Od rana na chodzie, 
przy każdej pogodzie biegam, 
komunikacji miejskiej rozkładów alfa-omega... 

Od rana na chodzie, 
rzejścia podziemne, centra handlowe, 
pomniki, ulice, tablice pamiątkowe... 

ref. Od rana na chodzie, 
sam powiedz jak jest... (jak jest...) 
Miasto przyciąga mnie jak magnes... (magnes...) 
Mam je w dowodzie, znany adres... (w adres...) 

Od rana na chodzie, 
sam powiedz jak jest... (jak jest...) 
Miasto przyciąga mnie jak magnes... (magnes...) 
Mam je w dowodzie, znany adres... (w adres...)"
23,Mechaniczna pomarańcza ,"MAG:: 
Żelazo kuje się, póki gorące 
Produkuje hip-hop jak w mennicy pieniądze 
Nieokiełznany, zaprogramowany 
On tu rządzi.. cały bank danych 
Ma do tego pociąg, co ciągnie jak taśmociąg 
Nowej generacji.. nie przesiąknie wilgocią 
Ten sprzęt to unikat, ma jakości certyfikat 
Nie da rady, to syndykat  zakładów - paktofonika 
Wzrasta popyt, ta maszyna to prototyp, zatem 
Ma na to patent, podobnie stereotyp 
Jeszcze dwie, nie jedna w ratach 
 wykańcza po fabrykatach 
ta współpraca czasem się opłaca 
data '78 to jej  rok produkcji 
nie dostaniesz do niej obsługi instrukcji 
konkurencja sabotażem dąży do samodestrukcji 
dojrzyj, dojdziesz do tego drogą dedukcji 
konstruktywnych konstrukcji na wysokich obrotach funkcji 
wpadasz w tryby 
trybiące, napędzające całe agregaty 
stałe aparaty, robota, robotyka, działające automaty 
typ eM A Gie IKa 
zmęczenie materiału nie ma prawa bytu 
gdy czy to urządzenie cię urządzi,
na zamówienie chwyta 
energie z otoczenia?

FOKUSMOK:: 
Energia zdobyta 

MAG:: 
Nie jedna kilowatogodzina 
Nie dżul już zużyty, by osiągnąć wydajności szczyty 
jak Perpetuum* mobile nie zatrzyma się na chwilę 
źródłem inwencji siła odśrodkowa, nie inercji 
tu dokumentacja ma produkt wykańcza 
efektem końcowym mechaniczna pomarańcza 

co to kurwa jest? 
Mechaniczna pomarańcza 
A co to jest? 
Mechaniczna pomarańcza 
Ej, Co to? 
Mechaniczna pomarańcza 
co to kurwa jest? 
Mechaniczna pomarańcza 

STRAHO:: 
Mechaniczna pomarańcza 
Yo.. 
Don Rahuene, Rahuene!
i gagatek, zachwiany macierze klatek 
za cenę netto + podatek 
godny wydatek 
flow płynie jak statek 
wszystko to pokopiowane z matek 
forma, odlew, wlana konsystencja 
tego esencja, potężna turbulencja 
jakaś pretensja, no cóż.. reklamację złóż.. 
kwintesencja mózgu burz już, rusz 
się , ruszyły tryba tuż tuż kolejny produkt, no chyba.. 
I nie gdyba, gdy z tworzywa sztucznego szyba 
Pokrywa nośnik zapisanych wartości 
Olej zator, odpal akcelerator 
techniki paktofoniki identyfikator 
tej idei kreator, odysei programator 
złudnej nadziei likwidator 

MAG:: 
co to kurwa jest? 

STRAHO:: 
Mechaniczna pomarańcza 

MAG:: 
A co to jest? 

STRAHO:: 
Mechaniczna pomarańcza 

MAG:: 
Co to? 

STRAHO:: 
Mechaniczna pomarańcza 

MAG:: 
co to kurwa jest? 

STRAHO:: 
Mechaniczna pomarańcza"
24,Na mocy paktu ,"RAH:: 
Pe A Ka Te O eF O eN I Ka AAAA  /x2

FOKUS: 
Je D-D den, D-D dwa 
Próba MIC’a, OK. 
To ja F.O.K'a, ze squadu PFK 
Do podkładu gadam, lirycznie nie podupadam 
Składam, obojętnie jakie imię temu nadam 
Władam i zakładam, że ci nic do tego 
Od tysiąc dziewięćset dziewięćdziesiątego szóstego 
Dlatego, ja i mikrofon mamy coś wspólnego 
Dlatego słuchasz zajebistego południowego 
H. do C. z K.C.E. nikt tego nie ściszy
W tym wypadku polegaj na mnie jak na Zawiszy 
Dla każdego prawdziwego, który to usłyszy 
Inni mi zwisają jak firanki z karniszy 
W ciszy, jestem blaskiem w ciemności słowami 
Zawsze obok ciebie przemieszczam się walkman’ami 
Zawsze razem z tobą, ja i skład nad problemami
Rozkładamy skrzydła przyjebani realiami 
Postrzegani, jak ostatni Mohikanin 
PFK weterani sparingu z rymami 
Owijani w Ha I Pe Ha O Pe jak w aksamit 
PFK zajebani, jak ściany tagami 
Katalizatorami, THC jak dynamit 
załatwiasz sprawę z chłopakami przed komputerami 
to dla nich: pokój z wami i z wolnostylowcami 
pokój dla tych biegających za końcówkami 
pokój z tancerzami i ich kontuzjami 
pokój z dziewczynami, zajmującymi się tymi sprawami 
pokój z zajebistymi organizatorami, pokój z wami, 
na zawsze pokój z wami 

MAG:
Kooperacja na mocy paktu, mocy płynącej z kontaktu 
aaaaaaaaa
Kooperacja na mocy paktu, mocy płynącej z kontaktu 

RAH:
Trzy znane portrety, trzy rymów komplety
wkomponowane w bity poprzez domowe pecety
same konkrety, lecące epitety 
nie jak komety, wokół planety, 
„ja to ja”, „gdyby”, „priorytety” , pierwsze wałki na materiał 
kasety, w rękach florety 
liryczne szermierki 
rymo-dymo-bito-klety-gierki 
spotkanie pierwsze, od czasów R-ki 
te wiersze, potrzebne do życia jak nerki 
bo ta muzyka jest nieuleczalna 
a każda postać indywidualna 
połączona paktem przy dźwiękach z głośnika 
to razem do kupy zwie się Paktofonika
Rah pod Magika i Fokusa eskortą 
Ku odległym portom 
Nie do zdobycia fortom 
Oddani psychicznym komfortom 
Kiedy to, w tym wielkim odstępie na występie 
Wtedy kilka słów na wstępie 
Przy do MIC’a dostępie 
Na trzeźwo, czy na hempie bez wyjątku 
wszystko w porządku, nigdy nie tracąc rozsądku 
sss spontaniczne akcje od samego początku 
sss specyficzne melorecytacje pełne wątków 
muzyczne penetracje różnych zakątków

FOKUSMOK:: 

P F K ponad podziałami aaaa 

MAG:: 
PFK to mój squad, bezpieczny jak gnat 
Sztywny jak bat 3 2 1 0 
To dopiero start squadu, który głową rozbija mury 
Po czym jest jeszcze w stanie prowadzić za kółkiem fury 
Magik, Fokus, Rah to squad co się leni 
Zieleni że pomyśleć strach, że nawiedzeni jak Fatima
I natchnieni niczym Martin Luter 
Jak to był sen, to ja jestem Freddie Kruger 
To podejście drugie z kropeczką nad i 
To zagranie drugie do ostatniej kropli krwi, 
Którą piiiiję jak wampir, poznaj Draculę.. 
Przy czym jak Al Bundy trzymam się za kule, 
To pingle, gogle, guuuule i w ogóle 
Filip, Psychotata wita cię czule 
i wszystkich tych, co od dawna już czekali 
aż mali PFK dowali jak Mohamed Ali 
iii póki idę, nadziewasz się jak na dzidę 
chłopaka dla niektórych jak Zulus Czaka 
rzeczywistość jest taka, wiesz jak? 
co'snek ee gostek.. te, to chyba proste 
i daje nurka, tutaj, wodna kurka 
a wsparciem mym Salvadora podpórka 
tu ubolewa Ewa, daj dwa jabłka z drzewa 
bo na widok jednego Mag - Adam ziewa 
i jadę do góry wyżej niż na dziewiąte w windzie.. 
a zażalenia proszę kierować gdzie indziej, 
bo od tego jest sromotny kierownik do spraw nieistotnych 
ja zajmuję się Hip-Hop’em zawrotnym 
lepiej się orientuj, kontaktuj, nie konszachtuj, 
PFK jest na mocy paktu tu 
PFK jest na mocy paktu tu 
PFK jest na mocy paktu tu 
PFK jest na mocy paktu tu 
PFK jest na mocy paktu tu"
25,Na mocy paktu (Intro) ,"Kooperacja na mocy paktu 
Mocy płynącej z kontaktu 

Kooperacja na mocy paktu 
Mocy płynącej z kontaktu 

Kooperacja na mocy paktu 
Mocy płynącej z kontaktu 

Kooperacja na mocy paktu 
Mocy płynącej z kontaktu 

Kooperacja na mocy paktu 
Mocy płynącej z kontaktu"
26,Nasz sposób rapowania ,"MAGIK:
Mogę? A możesz mi dać trochę głośniej muzyczkę? 
Trochę głośniej.
No, troszeczkę...
No...
Się zrelaksować...
Teraz dałeś troszeczkę głośniej?
Aha...
Który dzisiaj mamy?
Jest 29... 29.08.2000 Witten.
OKa.

Więc spróbuję teraz coś za freestyle'ować.
Wcale nie chcę się chować.
Będę tutaj stać i reprezentować.
Tak z moim składem Pe eF Ka,właśnie jadę.
To jest...
Na czterech kółkach.
Właśnie tak.
To jest Śląska szkółka, którą reprezentuję.
Ona rośnie , donośnie.
Tu słychać wszystko zajebiście.
Spalam zielone liście.
Bo to oczywiście.
Umiem robić bardzo dobrze.
Wiesz o czym gadam.
Kiedy składam na ryj
nie padam.
To jest zasada nr. 1.
W roku 2000 nie '97.
Wiesz o czym gadam.

Jeszcze później będzie następne wejście,bo mi się nie chce.

Panie i panowie.
Robię tak,tak się głowie.
Właśnie tak.
Teraz tutaj... nie wiem...

Ej proszę cię spróbuj ze mną niee

FOKUS:
Druga kropka dla tego pana!

Składam niesamowite historie opowiadam.
Wiesz o co chodzi.
Nigdy nie upadam na twarzy.
Jak eM A Gie IKa.
Wiesz o co chodzi?
To moja technika.
Właśnie tak.
To Magika.
Pe eF Ka.
Wiesz o co mi chodzi?
Jak i piwa zgrzewka.
Nadajesię do picia.
Czy do spożycia.
W jakim kolwiek stanie.
Wiesz co kochanie?
Sprawdź...
jaką mam baaanie...

MAGIK:
Tak...
To było płyty przeskakiwanie.
To usterki.
Tak jak niewydolne nerki.
Wiesz o czym gadam.
To coś w stylu (erki?).
Nie machaj Majkiem mi,
podpowiada mój kolega.
Teraz ja z flow Mega - Giga.
Tak, bo to ja tutaj śmigam.
Właśnie, na mikrofonie,  klaszczcie w dłonie.
Właśnie tak.
Bo płonie.
PFK skład jak skład płonący z tychów.
Oni go nie znają, ja go znam dobrze.
I bez liku.
Bez kitu.
Zjebałem.

FOKUS:
Wiesz mi to zwisa.
Jak i ta lisa.
Wita lisa.
Wiesz o co chodzi?
Nie wiesz.

MAGIK: 
Hehe...

FOKUS:
Nie trzeba było ciągnąć.

Wiesz jak kadr z kamery.
Na Discovery Channel.
Patrzę na stołu panel.
Konsole te.
Wiesz o co mi chodzi.
Walnął bym jakiejś lasce
minetę za 10 lodów

Pierdolę robię to na darmo z moją liryką ciężarną.

MAGIK:
Hehe..."
27,Nie ma mnie dla nikogo ,"Nie ma mnie dla nikogo...
Nie ma mnie dla nikogo...
Znasz to, nie?

(Rahim)
Bo ogólnie dostępne na bieżąco
Istne życie na gorąco
Załatwiam sprawę pieklącą
Jak zwykle nowe się wtrącą
Mą głowę zmącą
Często z równowagi wytrącą
Z czasem
Wpływa to na mnie męcząco
Niepokojąco
Z natłokiem spraw stresująco
Wiesz, w ciągłym pędzie, biegu,
Szarych ludzi szeregu,
Czasem w błędzie. Szczegół!
Pośród twardych reguł
I na śniegu ślady
Ludzkiej defilady
ściemniane obiady
Zajob do przesady
Praca, laska, dom, wykłady
Kumple i skład ponad składy
Super podkłady, wywiady, kolejne estrady
Całe miriady tych kwestii
Nie dałbym rady bez autosugestii
Załatwić tych z tych leżących w mej gestii
Wtłoczony w szablon monotonii
Jak w Diablo
Wyrwany z agonii
W matni problemowej toni
W nieustannej pogoni za spokojem
Czasem spędzanym we dwoje
Gdy nastroje tworzą sentymentalne przeboje
Kiedy wiem na czym stoję
Swoje
Smutki na partnerki ramieniu koję
Całe roje spraw zostawiam poza pokojem
Poję energię na kolejne boje
Gnoję wewnętrzną paranoję
I w kierat wkraczam
Wpierw się dwoję
Cele wyznaczam
Potem troję
Z drogi nie zbaczam
Poza terytorium działań nie wykraczam
Przytaczam sens mej nieobecności
Z konieczności odcięcia od rzeczywistości
Bo smak wolności szkicuje
Szkielet życia abstrahującego od skłonności
Do zawiłości
Do duchowej starości
Ogłaszam wszem i wobec
Nie ma mnie dla ludzkości

(Mag)
Chcę mieć spokój
W stresowych sytuacji
Natłoku
Jestem jak statek zadokowany
W doku
Od półtora roku
Nikogo na widoku
Tylko dźwięki hip hopu
Na dziewiątym piętrze w bloku
Tak między nami
Sam na sam z płytami
Nikt mi nie da tego
Co to właśnie da mi
Badam grunt pod stopami
Gdzie mi kurwa z butami?
To jak Koontz'a #szepty
Słyszane za uszami
Wciąż sami jak palec
To dobrze nie wróży
Obcy jak ósmy pasażer podróży
Milionami
Na przestrzeni Ziemi rozsiani
Obcują tu obcy wyobcowani
Ludzie
Co to ma być?
Pytam
Co to ma znaczyć?
Tego wrogom nie można wybaczyć
Niestety
Wszystko ma swe priorytety
Vis a vis z drzwiami
Od pokoju do planety
Panie i panowie
Są tacy co stają na głowie
Tak  jakby wszyscy byli w zmowie
Do czasu aż sobie jeden z drugim uzmysłowi
Jacy oni wszyscy są małostkowi
Aż rzygać się chce
Ten kto to wie kurwa
Życie upstrzone jak gołębim gównem
Bulwar
Zrobi tak jak ja
Pójdzie własną drogą
Prócz cienia
Nie ma ze mną nikogo

(Fokus)
W powietrzu czuć Heinekenem
Gdy żegnam się z problemem
Pokój dla tych co w pokoju są
Sam na sam z tym sound systemem
Wiem, że czasem trudno być Supermanem
Gdy wtłaczany pod ciśnieniem
stres jest działań terenem
Znam jak Ty te noce nieprzespane
By nad ranem
Zawikłane kwestie podejść z nowym
Planem jak z taranem
Dokładnie znam to
Mam te same
Myśli skołatane
Znam to, jest mi znane uczucie z tym związane
Co jest grane?
Marzenia niewypowiadane
Zapominane bo nie doczekałem się na zmianę
Przekonanie
Że po którymś ciosie się nie wstanie
Co jest grane?
Czasem głupie pytanie, nie?
Bakanie, popadanie w manię
Życie diametralnie inne niż to na ekranie
Walka o przetrwanie
I kombinowanie
Wprowadza mnie w stan gdzie jest zdecydowanie
Za dużo sytuacji które szybko nużą nużą
Za dużo ruchów które niczemu nie służą
Dużo za dużo akcji które wszystko burzą
Które źle wróżą
Tak jak cisza przed burzą
I łżą jak psy
Pierdoląc trzy po trzy
Ej, ej, ej biegnij
Trzeba było myśleć gdy
Po fakcie łzy zalały ci oczy
I tak przez siedem dni
Gdzie ten sen się śni
Tak więc chcę Cię dniu z poziomu fotela
Z wnętrzy M3
Witam cię, dniu niewdzięczny
Tu po tej drugiej złej stronie tęczy
Witam bez kwiatów naręczy
Bez zastrzeżeń
Dzień, który przede mną piętrzy
Jeszcze większy
Cień nad światem wewnętrznym
Witam, choć z dnia na dzień bardziej niezręczny
Jest tenże gest nikt mnie nie wyręczy
Wiesz jak męczy
Myślenie o stanie rzeczy
Wiesz jak jest, gdy czyjś czyn czyimś słowom przeczy
Wiesz jak to leczyć
Lecz to kaleczy
Race THC
Jak dwa ostrza mieczy
Na razie walczę
I na jaranie warczę
Chcesz też uwierz ja
Dostarczę Ci tarczę
Może nie wystarczę
Ale będę tuż obok
Prócz ciebie nie ma mnie dla nikogo"
