,Title,Lyrics
0,19 ,"19 

dużo zwrotek później... 

Rahim 

Nie ma jak to (co) 
Znaleźć sie tu ponad to 
Aktywny reaktor 
Sen wiele i ten sam a kto 
Jak to 
Kto to 
Nie wiesz? 
No to powiem 
Po to po to 
To niczym proton 
Dziewietnasty i PFK 
Ponownie trzynasty 

Fokus: 
Że co ze jak tam własnie 
drugie dziewietnascie 
Zajebiście nie miejsce 
Zapraszam nim zaśniesz 
Światła miasta zgasną 
ale nie w tej chacie 
Ty i Ona piękna nawijacie 
Piękna jak na chacie 
Do jutra nie zapamięta 
Cie tylko dziewietnasty w tle 
"
1,2Kilo ,"Drin ist draußen, Wörter fallen wie Mikado
PFK Squad Bunkerwelt wie Kollabo
Köpfe stecken unter Decken, Katowice, Ruhrpott
wo sind eure Fans, kommt aus den Ecken

Drin ist draußen, Wörter fallen wie Mikado
PFK Squad Bunkerwelt wie Kollabo
Köpfe stecken unter Decken, Katowice, Ruhrpott
wo sind eure Fans, kommt aus den Ecken


Hallo, Witten, witam i ten stan, gdy nabite mam 
Nie przeszkadza, więc jaram z zachwytem, a nie sam 
Jeden gram czy dwa kilo, chwilo trwaj 
Poznaj skrajności kraj, na kraj jest milion możliwości 
Od gości rap, PFK skład w pełnej gotowości 
I ci, którzy mają wolne 
2000 Witten, deszcze niespokojne 
Ej, play, rekord zostały pobite 
Z tej strony mikrofony stale przepite 
I przepalone wokale, bo lepiej być nie może 
Dopóki nie włożę wieży a na razie tworzę 
O Boże, to że była jak nalepka lepka 
2000-8-27 i najebka 
Halo, Witten, witam i ten stan standardem w dzień za dniem 
Gdzie popadnie palę... 

Tu kukuryku i to słońce podnosi mi powieki, już poranek 
Tu Dortmund-Witten, wita mnie przystanek 
I dupy rozkołysane, dupy skonsternowane 
Na to Kowalski Jan, refleksje te same 
Dobrze mu, w domu lepiej, jedni toczą ślinę, drudzy pianę 
PFK mianem faktem w marzenia owiane 
Tu napotykam rzeczy niespotykane 
Tu rymy ukulane podpierane Koranem 
Z OnAnOn spontaniczne nazywane nieplanowane akcje 
Nie pluskwa a milenijne wakacje 
Dwa tysiące rok, hunderttausend Kilometer 
Mimo to względem hiphopu to tak jak rzut beretem 

Ich schmeiß im Glashaus Scheiben ein vielleicht bringt's mehr Glück
Ich bin total normal, wer zu lange hin hört, wird verrückt
Wie soll ich in Scheiben bleiben, wenn mir alles nicht genügt
Und missversteh mich, denn eindeutig zweideutig red ich
Meine Art ist abartig, bin so dick, man hänselt mich
Mein Reim ist jetzt kein Schwein, ich bin der, der nur mit sich selbst spricht
Denn ich kann mich gut verstehn, ich bin nicht süchtig
Schiffbrüchig, ich kann kein Ufer sehn
Denk nicht drüber nach, da gibt's nichts zu verstehn
Das Leben ist scheiß, komm lass uns scheiße reden
Immer im Kreis bewegen und ich schrei's jetzt in die Runde
Den letzten beißen die Hunde, einige begreifen die Kunde
Die ich verkünde und greifen zu...

Od południa do południa ta droga trwa 
Alles klar, hiphop gra, u mnie jest OK 
Pode mną bardzo mały wóz i jest luz 
To LO nas dwóch, nie do wiary, a jednak uwierz w to stary 
To pewne jest jak że cztery to dwie pary, nie słoneczne okulary 
Ani piaski zielonych tropików, to jest miasto Witten 
Sala pełna basowych głośników, set Junior High 
Płyty zapuszczajajajajaj, bujaj moją głowę 
Owdziany w doświadczenia nowe 
W nowe wchodzę stulecie, 2000 w lecie 
Nim tu przybędziecie, nas już tu nie będzie 
H I P H O P wszędzie, H I P H O P wszędzie(wszędzie) 

Ich zahl für meinen guten Namen, nicht durch Benehmen 
Ich bin zu fett für meinen Körperbau, kann nicht mehr stehn 
Dass ich für jeden Reim aus meiner Rübe zahl, muss ich erwähnen 
Sie setzt mich wieder unter Tränen gestehn 
Alles kommt raus wie ein Schamhaar, mein Leben nicht planbar 
Wir waren zwar hier und da, doch die S-Bahn 
Schweift 'ne ferne Reise in die Bunkerwelt per Schwarzfahren

Drin ist draußen, Wörter fallen wie Mikado
PFK Squad Bunkerwelt wie Kollabo
Köpfe stecken unter Decken, Katowice, Ruhrpott
wo sind eure Fans, kommt aus den Ecken

W domu czy na dworze, słowa sypią się jak bierki 
PFK i Bunkerwelt, kolaboracja, słowne gierki 
Na wakacjach pod jednym dachem pojednani Mikołów i Ruhrpott 
Gdzie ci fani zamienieni w słuch 

Drin ist draußen, Wörter fallen wie Mikado
PFK Squad Bunkerwelt wie Kollabo
Köpfe stecken unter Decken, Katowice, Ruhrpott
wo sind eure Fans, kommt aus den Ecken


W domu czy na dworze, słowa sypią się jak bierki 
PFK i Bunkerwelt, kolaboracja, słowne gierki 
Na wakacjach pod jednym dachem pojednani K-ce i Ruhrpott 
Gdzie ci fani, gdy basy na pace... 

Oto kamikadze przejmuje nad umysłem władzę 
Reset systemu, ale jakoś sobie radzę 
Bo impra na maksa, w ręku ein Liter Faxa 
Wypompowane tak jak powietrze z waksa 
Dejot proszę uruchom westaksa 
Podaj nam bit ostry niczym metaksa 
Cały terror rozpętał error 
Wakacje '00 po przybyciu tu dopiero 
Halo, witam, Witten wita mnie 
Te, dżoja podaj, bo se machnąć chcę 
Strach ma strasznie małe oczka swe 
Życie jak w Madrycie, życie jak we śnie 

Mnie wydać mnie znać podaj jointa i nie pierdol śmierdzielu 
Dupek nie zu Zeit kräftigsten, beschäftigsten 
Wenn ich den Rapper in Schützen (...) 
Und tu so als ob der ganze Dreck weg müsste 
Nach den letzten Schüssen der best(...) (...) 
(...) wüsste 
Sichere Schutzweste und der Rest Flüche 
Die sicher mein (...) Büchse 
Ich (...) Drecksprüche 
Ich muss Texte und die Action wegknicken 
Ich such den letzten Frustfetzen 
Und zerquetsche wie Stechmücken 
Alles läuft schief, ich muss Rap stützen 

Wakacje Niemcy 2000, tu z kumplami rządzę 
Tu rozpierdalam swe pieniądze 
Czuję się jak ryba w Witten szpondze
U Turków posiłki gorące, jadam (...) 
Rymy na wolno i na papierze, gadam szczerze 
Nokaut, nokautuję, spróbuj, poczujesz 
Ja gustuję w zielonych topach hach 
Mach za machem, mikrofon mym narzędziem 
Hip hop mym fachem, studio pod jednym dachem 
Z Bunkerwelt PFK, ta sama idea 
Rozwijać hiphop, Kams w pełni to popiera 
A atmosfera jest stale rozluźniona, alles klar? 
Ja, alles klar 

Ich mach mich satt mit Sätzen
Fans gehn die Winde rauf wie Katzen
Senior Junior kann es kratzen
Es steht der alte Hahn, nur in neuem Gefieder
Selbst wenn ich einmals zwinkel, spreche meine Augen nieder
Schwing den Stift übers Blatt wie Ninjas ihre Schwerter
Wenn die Regeln nicht begrenzen, dann schieß auf den Pförtner
Gedanken rollen, Schranken gehen auf wie Münder
Aber ich sage was ich denke, macht mich das unverwundbar
Wie Königskobras aufrecht und giftig was ich sage
Wie ich sage, trifft dich, trifft dich
Zu siebzig dreißig, also hundert Prozent
Jede meine Rede wird von der Welt gebunkert

Bunkerwelt in Witten... Witten 

Drin ist draußen, Wörter fallen wie Mikado
PFK Squad Bunkerwelt wie Kollabo
Köpfe stecken unter Decken, Katowice, Ruhrpott
wo sind eure Fans, kommt aus den Ecken

W domu czy na dworze, słowa sypią się jak bierki 
PFK i Bunkerwelt, kolaboracja, słowne gierki 
Na wakacjach pod jednym dachem pojednani Mikołów i Ruhrpott 
Gdzie ci fani zamienieni w słuch 

Drin ist draußen, Wörter fallen wie Mikado
PFK Squad Bunkerwelt wie Kollabo
Köpfe stecken unter Decken, Katowice, Ruhrpott
wo sind eure Fans, kommt aus den Ecken

W domu czy na dworze, słowa sypią się jak bierki 
PFK i Bunkerwelt, kolaboracja, słowne gierki 
Na wakacjach pod jednym dachem pojednani K-ce i Ruhrpott 
Gdzie ci fani, gdy basy na pace..."
2,30.09.2000 ,"FOKUS:
Toruń, Katowice
Zatrzymany wesoły bus, na miasta kasty ust testy
Art cafe dwa tysiące dziewiąty trzydziesty
Prawdę mówiąc jedna mała uwierz mi, że nie z tych
wysyłała sygnały niczym protesty Amnesty
Aaaj PFK i płonący blay
Obczaj najlepszy koncert składu, bye
Dbaj o układ gdy patrzy ile znaczy nazwa
Ciepłem w czwarty stan skupienia jak plazma

RAHIM:
Furgon, a w nim cała drużyna
Jak burbon mocna, pauza na dyma
Czasem... i dalej w trasę
Lasem puścić słów masę
Celem północ, jakby z kompasem
Szofer gazu - pokaż nam klasę
As za asem, z komnaty artu
Ósma na blacie godzina startu
Halo Toruń dla nocnych marków
Dla was rymy w podarku"
3,A robi się to tak ,"MAG:: 
No nie jeden się tu głowi 
Jak to się robi? 
Co? A robi się to tak.. na to zawsze gotowi 
No nie jeden się tu głowi 
Jak to się robi? 
Co? A robi się to tak.. na to zawsze gotowi 

Siedzę sobie w klubie, jak prosię w nosie dłubię 
Drapię się po dupie, w takt, rytm nogą tupię 
Wokół tańczą ludzie, ja pogrążony w nudzie 
Ona z kasy mnie oskubie, a ja sobie ją kupię 
To dobry układ, jestem z tego rad, że ten drink jak swat nas swata 
Tego lata, pomysłów ma tysiąc umysł co figle płata 
I chyba mogę przysiąc, może się przysiąść Psychotata ? 
Miło mi, cię (i cię..) przepraszam, czy macie picie (picie) 
Jestem spragniony, jak tak, to znakomicie
Tu.. rymy na wolno, jak i w zeszycie 
Z wami, dziewczyny, ja znajdę się na szczycie 
Wątpliwości nie ulega, piękna jak Susan Vega
Od czasu do czasu wolność swą zastrzega 
Papierosa wyciąga i prosi mnie o ognia 
Tymczasem ja jedną zapałkę mam w spodniach, ale 
Tego dnia ona płonie jak pochodnia 
i ssie ze mnie kasę, jak bezdenna studnia 
może tak dla ochłody, przełamiemy pierwsze lody 
jestem czarujący, bo mam na to metody 
i gdy, sens ukryty, cel dawno zdobyty 
tu cię mam, jak dozwolone wszystkie chwyty 
pyta: która godzina? Zegarek mi stanął 
najpierw dobranoc, a potem będzie rano 
poszedłem zapytać, kiedy wróciłem 
ich nie zastałem, a inne upatrzyłem 
one wyszły jakby tyłem, a mi tyłem wyszły tyły 
chyba tą zwrotkę mi spierdoliły 
ej.. chciałem dalej rymować, no.. hehe 
chyba tą zwrotkę mi spierdoliły 

TYMI:: 
nie jeden się tu głowi 

MAG:: 
Jak to się robi? 

TYMI:: 
No a robi się to tak.. 

MAG:: 
na to zawsze gotowi 

TYMI:: 
nie jeden się tu głowi 

MAG:: 
Jak to się robi? 

TYMI:: 
No a robi się to tak.. 

MAG:: 
na to zawsze gotowi 

TYMI:: 
Sprawdzony lokal, za jego drzwiami komplikacji multum 
3 godziny tutaj, mam swój moment triumfu 
rozmowy w toku, razem z wami wszystkimi 
kasy limit, póki jest, to sączymy 
klimat prawie jak latem, w parku na ławkach 
zamiast browaru – tonik, pięćdziesiątka Seagrams’a 
jakaś lalka jak lampas, subtelny dotyk 
w powietrzu zapach jej perfum, jak narkotyk 
na ręku dziara, lubi być rozpoznawana 
o takich jak ona po mieście rozchodzi się fama 
obcykana, znajomości płaszczyzna
sprawdzony bajer działa jak afrodyzjak 
wzrok na jej cyckach, w łóżku ostra jak brzytwa 
każdy chciałby dzisiaj dotrzymać jej towarzystwa 
po to tu przyszła, będę miał swoją szansę 
dla wszystkich fajnych dziur Tymi kończy toastem 


FOKUSMOK:: 
nie jeden się tu głowi 

TYMI:: 
Jak to się robi? 

FOKUSMOK:: 
No a robi się to tak.. 

TYMI:: 
na to zawsze gotowi 

FOKUSMOK:: 
nie jeden się tu głowi 

TYMI:: 
Jak to się robi? 

FOKUSMOK:: 
No a robi się to tak.. 

TYMI:: 
na to zawsze gotowi 

FOKUSMOK:: 
Znam cię doskonale i szukam cię wzrokiem, ale 
Widzę stale te, co wokale przeliczają na cale.. he 
żmije.. ile jeszcze je muszę znosić? 
Zmusić cię, czy prosić cię, kocie przestań się nosić 
Kici-kici bądźmy nieprzyzwoici
Dziś chwile ulotne umili ci ktoś 
Tylko poproś, a ustawię ostrość 
Zbliżenie na całe, ślińcie się, czy odwrotność 
Dość godności masz jak ja miłości 
Daj sygnał, jeżeli masz na tyle mądrości 
Ale dzisiaj nie kochaj się w mojej złożoności 
Tylko ze mną,ostro, no bo to o to pościg
Czujesz? Atmosfera pulsuje jak głośnik 
Dotyk.. i moje piorunujące zdolności 
Dziewczyno.. porusz mnie, a nic mnie nie zatrzyma 
I nie przestawaj, dawaj, a będzie jak lawina 
Z nóg ścinał finał, znasz ten klimat 
Z opowiadań koleżanek, że poranek je zatrzymał, ale 
Bez obiecanek, wolisz dotyk, więc przystanek 
Fokusmok - dla fanek 


PIH:: 
nie jeden się tu głowi 

FOKUSMOK:: 
Jak to się robi? 

PIH:: 
No a robi się to tak.. 

FOKUSMOK:: 
na to zawsze gotowi 

PIH:: 
nie jeden się tu głowi 

FOKUSMOK:: 
Jak to się robi? 

PIH:: 
No a robi się to tak.. 

FOKUSMOK:: 
na to zawsze gotowi 

PIH:: 
Chcesz wiedzieć, jak to się robi? Lekcja numer jeden: 
Traktuj je jak powietrze, nie odpędzisz ich od siebie 
Nie jesteś frajerem, nie stawiaj drogich alkoholi 
Niech dziurze nie uderzy woda sodowa do głowy 
Pokaż klasę damie, nie gardź przy niej szmatą 
Cipka polityką, ty od teraz dyplomatą 
Będzie warto, nawiń na uszy makaron 
Sypnij 3 komplementy nogi się rozkładają 
Jest piękna, mądra, podąża tropem mody 
Złamane kody, masz lody lody lody, 
Żywe dowody, że te lekcje są bezcenne 
Najlepsi stratedzy jak krew przelewają 
S do P do E do R do M do Ę 
Chcesz tego czy nie? Full kontakt, ostrą grę? 
Seks jak sport, szybką piłkę, mokry kort 
Wiesz jak to się robi, kiedy już zdobyty fort

STRAHO:: 
no nie jeden się tu głowi 

PIH:: 
Jak to się robi? 

STRAHO:: 
a robi się to tak.. 

PIH:: 
na to zawsze gotowi 

STRAHO:: 
no nie jeden się tu głowi 

PIH:: 
Jak to się robi? 

STRAHO:: 
a robi się to tak.. 

PIH:: 
na to zawsze gotowi 

STRAHO:: 
Panowie, lokal otwarty, oto wrota na party 
Na to zawsze gotowi, no to w szeregu zwartym 
Do baru, po bronki w kolejce ludzi paru 
Obrót 3 6 0 dziś trzeba użyć czarów 
Wampa mijam 
ach jakbym ją tak z kija, 
gładziutka szyja i ja haps kły jej wbijam 
zerkam po ryjach, podejrzewam, że niczyja 
atmosfera sprzyja, więc podbijam i nawijam 
nudę zabijam, nie zaziewasz nawet, ponieważ ściemy omijam 
dlatego tego nie lekceważ 
w mordę jeża, piękna, ponętna nie dowierzam 
inteligentna, to we mnie uderza 
na parkiecie kobiecie dirty dancing pokażę 
I jak Pershing tam w parze w podnietę ją wyposażę 
a że zmoknie okropnie, gdy seksownymi ruchami porażę 
wraz z rytmem w parze się na harce odważę 
w kotka, myszkę zagramy 
gdy w ustronne miejsce się udamy 
zmysły postradamy i emocjom oddamy 
chyba, że rady nie damy, 
popadamy, skończy się gra 
co się odwlecze, nigdy nie uciecze, nie.. 
toć i pa ! R + A + H 
1 7 PFK"
4,Aż strach pomyśleć ,"STRAHO: 
strach pomyśleć, że Rah się tak leni 
strach pomyśleć, że Mag się tak leni 
strach pomyśleć, że Fo się tak leni 
strach pomyśleć, że Squad się tak leni 

wszyscy śnią, wszyscy smacznie śpią 
Rah ręka posuwa myszkę z Fo 
Trzy kawy wy-pi-te 
Słuchawy w łeb wbi-te 
I w dodatku cechą tą trafiony w spadku 
Dawno po północy, ja mam to w zadku 
Zatopiony w dźwięków dostatku 
Do sił ostatku, z bety upadku 
Tik-tak, dzwonek, budzik, luzik 
Wstaje, co mi pozostaje? 
Iść za zwyczajem. (Smacznego, brat) 
Dzięki, nawzajem 
Zaraz się najem i na misję się udaję 
W usta faję, Rah, mach w płuco daję 
Noga po nodze na drodze staje 
I pędem do biura, a tam pełna kultura 
Pod ręką komóra, na parkingu fura 
Dyrektywy od Chief’a 
Nura w kangura, po hurtowniach tura, 
W końcu godzina która 
Pozwala na to, by pójść do domu, no to rura 
Tam obowiązki, nie cierpię ich, są jak tortura 
Stała procedura, mamo, nie mam czasu dziś akurat 
Bo w pokoju .... przegrzewa się aparatura 

Tak 
Dla ciebie to robię .. uświadom to sobie 
Na lenia w chorobie.. wiem jak dogodzić tobie.."
5,CD Kinematografii ,"Rahim:
Pamiętasz wyczyny lirycznej mafii?
(Fokus: Na na na na)... kinematografii... 

x2 

Fokus:
Dla każdego prawdziwego respekt mam 
Otwieram usta miasta KC czasem ze składem a czasem sam 
Dbam o wizerunek śląskiej sceny, masz problemy? 
Nie gadamy, rymujemy, reprezentujemy 
Bez żadnej ściemy... komponujemy bity 
Kombinujemy płyty 
Skład P F K – układ niesamowity 
Masz coś do powiedzenia? 
F O K U S M O K zmienia punkt widzenia 
To do widzenia panu... hip-hop’u nie robi się dla szpanu... 
Ktoś musi to dać do zrozumienia 
Trzeba się trzymać planu po wynurzeniu z podziemia 
nie ma, że boli... taka jest cena wynurzenia. 

Rahim:
Pamiętasz wyczyny lirycznej mafii? (Magik: Są nowiny...) ciąg dalszy kinematografii... 
Chłopaki, dziewczyny, zaraz was trafi!... (Magik: Aaa) archiwum kinematografii 

x2 

Magik:
Pojawiam się i znikam, taka rola Magika 
Przy tym trwam, jestem tam gdzie Paktofonika.. 
Na tym punkcie mam bzika, tu nic nie da polemika 
Ten pakt to unikat, nie przerobisz na duplikat 
Przyjmij ten komunikat, do góry jak Ikar 
Z tym się borykam, by nie popełnić byka 
I wcale nie mam zamiaru dać za wygraną 
Budzę się co rano, wiem co już grano 
Wiem o co po co dbano i jak koleje losu 
Mogą poplątać, że połapać się nie sposób 
Lepiej losu nie kusić, lepiej coś wyrzucić, 
Niż to w sobie dusić, nie próbuj się zmusić 
I bierz co ci dane, bądź losu panem 
A rozstrzygnięcie będzie z góry zaplanowane 
To się okaże, to czas pokaże 
Tymczasem po głowie chodzą mi słowa w parze 
Raz, że lubię to robić, a dwa, że 
Kiedy to robię widzę uśmiechnięte twarze, 
A to właśnie jest Everest moich marzeń 
To właśnie jest Everest moich marzeń 
I dalej: piorunem, jak rażony gromem 
Tutaj jest nas trójka, z tym samym syndromem 
I ścisłym gronem... i z mikrofonem 
Magik... i sprawy wagi ważącej tonę. 

Fokus:
Właśnie tak, właśnie tak, tak, tak... właśnie tak... się to robi na południu 

x2 

Rahim:
Pamiętasz wyczyny lirycznej mafii? (Magik: Są nowiny...) ciąg dalszy kinematografii... 
Chłopaki, dziewczyny, zaraz was trafi!... (Magik: Aaa) archiwum kinematografii 

x2

Fokus:
Były różne sprawy, dotknęły mnie aspekty 
Problem był konkretny, do dziś widzę efekty 
I widzę więcej, wiem więcej, tak to jest mniej więcej 
Uczę się sztuki życia, hip-hop to mój sensei ej 
Naciśnij PLAY z tej... strony PFK, sprawdź to 
No bo to dopiero rozgrzewka 
Początek, pieniądze to główny wątek dnia
A ta muzyka to nie wyjątek 
Wyrosłem z przybijania piątek, człowieku 
W perspektywie hip-hop jest dla mnie formą leku 
Na dziurawy budżet to nie kwestia wyboru, 
to kwestia szczerości... ksz ksz ...bez odbioru 
...ksz ksz w kwestii hard-core’u 
F O K jak piorun z katowickiego sektoru 
Na forum wydarzeń, powodem oparzeń 
Pieniądze są w kwestii sugestii moich marzeń 
To leży w gestii, więc łap je za ster 
Reprezentant południowych sfer 
Szybki jak Dodge Viper, konkretny jak As kier.. 
Fokusmok snajper sksz ksz..."
6,CHTHC (Fokus) ,"Wcale nie rozumiem o co chodzi w tym kawale, 
Ale mówię palę 
I nie mówię : ""Palę? 
Ja nie palę"" 
To, to nic nie szkodzi 
A ja myslę o tym stale 
Mam w głowie szum jak na pustym kanale 
Pierdolę 
Nie wiem czego chcę 
Tego się boję, boję 
Taka cecha thc 
Nie wiem na czym stoję 
Zniszczone zwoje 
To jedyne czym płacę 
W głowie mam hace 
To czyste thc 
To nie witamina c 
Tego się nie połyka 
To służy do palenia 
To inna technika 
Hit i styka 
Kolejne styki tracę 
Taka stylistyka 
Dominuje w Ka-ce 

Nie wiem czy chce 
Chyba tych cech 
Cecha thc 
Właśnie taka jest, że 
Że, nie wiem czy chce 
Chyba tych cech 
Cecha thc 
Właśnie jest taka, że 

Nie wiem czego chce 
Czy czy czy ( w tle ""t h c"") 
Czy chce mózgi jak żywopłot 
Lufa jak nożyce 
Przemierzam ulice 
W poszukiwaniu celu 
Chce rzucić kotwice 
Bez karabinolu 
Uuu, a erozja trwa trzy do sześciu tygodni 
I nikt nie chce pomóc 
Wszyscy wygodni 
A pomóc by mogli 
Lecz jak piaski lotni 
Chyba nie chcę palić już dla szerokich spodni 
Pogodni od zawsze 
Tak to wygląda 
A to niebezpieczne tak jak anakonda 
Cecha thc to licencja bonda 
Przemierzam ulice, doszedłem do ronda 

Nie wiem czy chce 
Chyba tych cech 
Cecha thc 
Właśnie jest taka, że 
Że, nie wiem czy chce 
chyba tych cech 
cecha thc 
właśnie taka jest że 

Że mnie lubi dym tak że nie stygnie rurka 
Mało, często częstują koledzy z podwórka 
Bibułka spoczywa na dnie mego biurka 
Akcja palenie 
Reakcja gęsia skórka 
Powtórka z rozrywki 
I cel dnia zdobyty 
Jak szczyty ubity w szkło 
Dzień znakomity 
Dowód niezbity 
To wirus w systemie 
Jak, jak formatowanie 
Pomaga palenie 
Ej, to wydarzenie 
Na ręki skinienie 
A ręką mą rządzi me rozporządzenie 
Sam na arenie czuję się błogo 
Puk, puk nie ma mnie dla nikogo "
7,Chwile ulotne ,"[Fokus]
Nie ufam nikomu
Kocham tylko tych, co na to zasłużyli
Jeszcze nie szeleszczę kasą, tak jak klasą z winyli
Więc nie przepuszczę żadnej chwili, gdyż żyję na kreskę
W każdą chwilkę wbijam szpilkę, jak pinezkę w deskę
Życie jem jak Milkę
Bowiem wiem, że jestem lśnieniem i oka mgnieniem
Że będę wspomnieniem
Za pozwoleniem, sprawdź to
Zanim schowasz dzień pod powiekami
Powiedz, co z twoimi niepozałatwianymi sprawami?
Czasami wręcz zasysam otoczenie moimi receptorami
Zachwycam się chwilami, jak dobrymi produkcjami
Film na siatkówce zdobywa nagrodę Grammy
Za brak porównania z celuloidami
Momentami pomiędzy oddechami
Życie falami tsunami
Zalewa doznaniami i bodźcami
Razem z chłopakami chodzimy po mieście
Kilkanaście centymetrów ponad chodnikami
Taktowani przez Wat tysiąc dwieście
Przygniatani problemami, ciągle na podeście
Z mikrofonami w ciągłym manifeście
Weźcie sprawdźcie to
Bo to widać w każdym geście
Jesteście, więc zauważcie to nareszcie
Odbierzcie dzisiejszy dzień jak podarunek
Cieszcie się i obierzcie na jutro kierunek
Odważcie się, zróbcie ten krok, podnieście wzrok
Na razie, strzałka, mówił Fokusmok

Łapię chwile ulotne jak ulotka
Ulotne chwile łapię jak fotka 
/x2

[Rahim]
Chwile ulotne chwytam, jak sygnał satelita
I ta różnica - nie krążę po orbitach
Lecz twardo stąpam po chodnikach
Chcę żyć aktywnie nim wyciągnę kopyta
Jest pewna dewiza, którą znam: Carpe diem
Uznają ją ludzie, z którymi gram
O tym wiem
Z każdym dniem łapię chwile ulotne jak motyle
Na stałe
Koduję we fragmentach bądź całe
Zapamiętałem już ich bez liku
Wszystkie mam w sobie, żadnej w pamiętniku
Zaś w notatniku bądź w kalendarzyku
Notuję zadania i termin wykonania
Zgroza
Gandzia zostawia ślady jak sanek płoza
Ma pamięć zawodna jak prognoza - to skleroza
Poza tym istnieje sprawnych komórek doza
Chwile przychodzą tam, jak koza do woza
Raz łapię chwile te słodziutkie, choć krótkie
Innym razem te bezpowrotne i ulotne...

Łapię chwile ulotne jak ulotka
Ulotne chwile łapię jak fotka 
/x2

[Magik]
Życie nasze składa się z krótkich momentów
Cudownych chwil, czy przykrych incydentów
Niczego nie przegapię, wszystkie je łapię
Korzystam z talentu, przelewam go na papier
Więc łapię chwile ulotne jak ulotka
Ulotne chwile łapię jak fotka
Dbam, by chwile ulotne jak notka
Nie uleciały jak ulotna plotka
W niepamięć
Każdy gest i każde zdanie
Obrazy przed oczami zawieszone jak na ścianie
Te w ramie
To jedno co na pewno zostanie
Reszta przeminie jak znoszone ubranie
Dwadzieścia lat minęło jak jeden dzień
Nie masz co wspominać? Lepiej swe życie zmień
Póki czas nie czeka na nas
Więc zaśpiewaj jeszcze raz
Mamy po dwadzieścia lat
Przed sobą cały świat, przed sobą cały życia szmat
Więc jestem rad z każdego poranka i wieczoru
Dawno już dokonałem wyboru
I jestem dyspozytorem własnych torów
Spełniam się w muzyce hardcore'u
I wiem, że wspomnienie nigdy nie zginie
Tak jak wspomnienie po pierwszej dziewczynie
Jak czasy podstawówki: zbite butelki, ubite lufki
Starte zelówki w podróży
Polowanie na chwile się nie dłuży, się nie nuży

Łapię chwile ulotne jak ulotka
Ulotne chwile łapię jak fotka 
/x2"
