,Title,Lyrics
28,Nielegale (Fokus) ,"Wyłaczam mikrofon, 
...c do powiedzenia... 
Z podziemia, F.O.K.U.S bez ściemnienia: 
Głos sumienia - a dlaczego tak? 
Inaczej bylo za bajtla - kara za rap? 
shut up, what the fuck man? Otwarcie gry! 
Na majku Figh Club. Poszly psy! 
Gdy trzymam dystans, defensywa oczywista, 
bo harta warta ta gra, a nie smoczyska. 
Zione ogniem! Pluje jadem! 
Pierdolę maskaradę, biegnij za przykładem! 

Sprawdź nielegale, to F do O do K w orginale. 
Na piedestale zbieram medale za dopracowane detale. 
No co? Nie mieści ci się to w pale? 
Stale jak fale doskonale się chwalę. 
Masz jakieś ale? 

Ja dotknę dna, a potem nieba! 
F.O.K. a.k.a. ""Nie Ma Przebacz"" na majku. 
Uwaga zasysa jak próżnia, 
gdy wypuszczam flow, który sie wyróżnia. 
Nie splajtuj, ty i ona jak szum i muszla. 
Miasta duszpasterz: muzyka + hasz. 
Ilu uzależnionych znasz, ilu sprzedasz? 
Pokaż twarz. Da się życ. Nie ma przebacz! 
Ale cud nad Wisłą. Grasz jak Bandicoot Crash, 
stale masz pomysły na wszystko. 
Widowisko. Temperatura na forum wzrasta. 
Zrozum, to namiastka hardkoru. 

Sprawdź nielegale, to F do O do K w orginale. 
Na piedestale zbieram medale za dopracowane detale. 
No co? Nie mieści ci się to w pale? 
Stale jak fale doskonale się chwalę. 
Masz jakieś ale? 

Talarem? Daremny trud. Poznaj głód 
na prawdę wśród kopalni i hut. 
Ja walę rozgłos, bo to przeszkadza 
być mi tym kim jestem, to wada, 
zwykły koleś - liryczna zaglada. 
Nie mam nic do powiedzenia - siadam, 
bo gdy idę rymy 3D jak z AutoCad'a składam. 
Szalona galopada tworzy w głowie teksty, 
to jak wzburzone morze, na falach refleksy. 
Gdy rozkładam skrzydła - zapada cisza... 
Wtedy zamykam oczy, żebym tylko słyszał. 
Peka jak klisza bariera dźwieku. 
Jestem tym tekstem i nie będę sie zniżał, 
bo nie chcę. 

Sprawdź nielegale, to F do O do K w orginale. 
Na piedestale zbieram medale za dopracowane detale. 
No co? Nie mieści ci się to w pale? 
Stale jak fale doskonale się chwalę. 
Masz jakieś ale? he? 

...zasztyletowany spojrzeniami rap gwiazdy. 
Mam jazdy na styk z paranojami, 
gdy własny mój styl ulotny jak pył w kontakcie, 
w kontaktu trakcie, daję Ci na kompakcie. 
Tak akt po akcie filtrujac miasto wzrokiem, 
będąc Fokusmokiem, kręcąc sie z Amokiem i Cronem. 
Inni - ""Nie to nie my"" gdy tonę. 
Dzień w dzień oczy zapierdolone przez żenszen. 
Ciągle jak szerszeń żądlę. 
Przebacz, gdy błądzę. Jebać rady mądre. 
Swoje osiągnę. Ty też swoje wiesz 
opiniami animowany jak Flash. 

Sprawdź nielegale, to F do O do K w orginale. 
Na piedestale zbieram medale za dopracowane detale. 
No co? Nie mieści ci się to w pale? 
Stale jak fale doskonale się chwalę. 
Masz jakieś ale? 

Ja rzeźbię ciszę słowami dla Ciebie. 
Pod powiekami na niebie 
z gwiazdozbiorami FOK pokazuje siebie. 
Będę jak dynamit i pod gruzami pogrzebię to, 
co nie da mi myślami przybiec do Ciebie w potrzebie. 
Nie weźmie mi tego ani spanikowany świat, 
ani ci z drani wychowani na nim, 
zanim nie utracę zmysłów jak Tytanik, 
zanim zanik pomysłów da mi znak, 
ja pomnikami tenże soundtrack wypełnię jak farbami. 
Ja rzeźbię ciszę słowami dla Ciebie. 
Pod powiekami na niebie 
z gwiazdozbiorami FOK pokazuje siebie. 
Będę jak dynamit i pod gruzami pogrzebię to, 
co nie da mi myślami przybiec do Ciebie w potrzebie. 
Nie weźmie mi tego ani spanikowany świat, 
ani ci z drani wychowani na nim, 
zanim nie utracę zmysłów jak Tytanik, 
zanim zanik pomysłów da mi znak, 
ja pomnikami tenże soundtrack wypełnię jak farbami. 
Rzeźbię ciszę słowami, pod..."
29,Nowiny ,"Okej, teraz go zarymuję

Są nowiny 
Skurwysyny... dziewczyny...
Są nowiny 
Z wykopaliska mej skamieliny

Nawet jeśli wszyscy już w ciebie zwątpili
Pokaż że się mylili
Nie czekaj ani chwili
Dłużej
Życie to nie zawsze droga
Na niej róże
Duże PFK, raz na dole, raz na górze
I potrafię słodko-kwaśny
Być jak chilli gdy się wkurzę
To nie do wiary!
To czary-mary!
Słyszę w oddali
To surrealizm, jak Salwador Dali
eM A Gie I Ka
Tak jak Mulder i Scully
Za was jointa spali
Tym co się odwrócili
PFK nie są mili
Jak Milli Vanilli
Czyli
Zapraszam skurwysyny 
Na me narodziny
To nowiny
Z wykopaliska mej skamieliny

Są nowiny
Z wykopaliska mej skamieliny
eM A Gie I Ka
OK skurwysyny
Są nowiny
Z wykopaliska mej skamieliny
(Co za licho)
eM A Gie I Ka jest

Życie to teatrzyk
Nikt się nie ogląda
Każdy patrzy
Jak zdobyć główną rolę
Najlepiej raz, dwa, trzy
I pierdolę
Wolę być otwarty, odkryty 
Na stole karty
Chcieli mnie pogrzebać
Oho! Wolne żarty!
Czy zajmujesz się biznesem
Czy hip hopem
Tu i tu łapią okazję podróżując autostopem
I pochopne opinie
Egzotyczne jak pinie
Spójrzmy prawdzie w oczy
Z tego nikt się nie wywinie
Skurwysynie ej, uważaj, 
Kiedy znajdziesz się na minie 
Będzie bum! Bum!
Czy słyszysz ten tłum?
Gra eM A Gie I Ka
Znów robi szum
I szura
Nie jak huragan, wichura
A wbrew zasadom, wbrew fizyki prawom
Ruszam się żwawo
A więc bijcie brawo

Skurwysyny
Z wykopaliska mej skamieliny
eM A Gie I Ka
OK skurwysyny
Są nowiny
Z wykopaliska mej skamieliny
(Co za licho)
eM A Gie I Ka jest

Są nowiny
Z wykopaliska mej skamieliny
Są nowiny
eM A Gie I Ka
OK skurwysyny
Są nowiny
Z wykopaliska mej skamieliny
(Co za licho)
eM A Gie I Ka jest

Już wyrok wydali
Wyrok wykonali
Żywcem pogrzebali
Mnie to wali
Na fali, skurwysyny
Co? Kpiny? To nowiny!
Czyżby zrzedły wam miny?
Dźwięki maszyny
Z powrotem na szyny
eM A Gie I Ka
Powoli na wyżyny
I przypomnę wam styl
W którym jestem jedyny
Raz, dwa, trzy, no i wy
Skurwysyny
Brak tematów czy podziały ponad porozumieniem
Tak czy tak, miło było
Dla was wszystkich być natchnieniem
Bo za te wszystkie lata
Tu jest rekompensata
Znów jestem skory
Zbijać score'y jak na automatach
A dlaczego 
Znowu ufam memu superego?
Nie pytaj, tego nie wie nikt
Bo nikt nie wie tego
Że mam coś czego nie masz ty
A to coś wspaniałego
I szukaj tego czegoś
W moich tekstach zawartego
To kwestia szczerości nie żaden wybór
Ja, eM A Gie I Ka 
Ekskalibur

I nowiny 
Z wykopaliska mej skamieliny
eM A Gie I Ka 
OK skurwysyny
Są nowiny
Z wykopaliska mej skamieliny
(Co za licho)
eM A Gie I Ka jest

Są nowiny
Z wykopaliska mej skamieliny
eM A Gie I Ka 
OK skurwysyny
Są nowiny
Z wykopaliska mej skamieliny
(Co za licho)
eM A Gie I Ka jest już"
30,Play plus rec ,"FOKUSMOK:: 
H I P – H O P 
wydobywam rymy jak ropę, transportuję je na werbel i stopę, 
zawieszone na L O O P 
N I G D Y S T O P 
H I P – H O P 
wydobywam rymy jak ropę, transportuję je na werbel i stopę, 
zawieszone na L O O P 
N I G D Y S T O P 

H I P – H O P 
H I P – H O P 
"
31,Popatrz ,"-Weź nam zrób jakiś beatbox, coś
-Beatbox?
-No dawaj
-Dobra

Tyle ćpunów w całym mieście
Nie widziałeś tego jeszcze
Popatrz, o popatrz
Tak, tylko mnie nie bij przy tym, dawaj
Szerokimi ulicami
Zapierdalają z blantami
Popatrz, o, o, o popatrz

-No, tak, pokaż coś, dalej

Popatrz, o popatrz
Beat, beat co no mu zapodaje bitem
Beat, co no mu zapodaje bitem
Popatrz, o popatrz
Beat, beat co no mu zapodaje bitem
Patrze na postacie wbite w ziemie
O w ziemie
W ziemie
Czujesz wiesz jak, że on tak napierdala a tu koleś
Wjechał i w ziemie i słucha

-Dalej
-Co?
-Dalej, dalej kontynuuj
-Dobra jeszcze na dwa nagrajmy nie

Popatrz, o popatrz!
Beat Sot, Beat Sot.
Popatrz, o popatrz.
I posłuchaj...
O popatrz!

Beat, beat no co mu zapodaje bitem
Beat, no co mu zapodaje bitem
Popatrz, i sprawdź!

Beat, beat no co mu zapodaje bitem...

-Zajebiście stary daj 5.
-Zajebiście? Może być?
-Więcej nie muszę robić?
-Czyli jechać do domu?
-Do domu, bo zimno.
-Piździ!

Pi-Pi-Pi piździ!
Pi-Pi-Pi piździ!
Pi-Pi-Pi piździ!
Piździ!, piździ!, piździ! piździ! piździ!"
32,Powierzchnie tnące ,"[Kawałek jest stary ale chodzi o co innego.
 -O co?
 -Posłuchaj tego]

Perfekcyjne opanowanie języka pomaga mi robić Cię jak chcę
Pokłon Tobie - wkomponowanemu w podłogę MC
Nareszcie mój sztandar na maszcie
Wreszcie długo oczekiwane wejście Smoka
Stawiam sprawę, jak kawę na ławę, że fenomenalnie miotam
Witam
Rewelacyjnie przeplatam zdań złącza
Niekończąca się opowieść, kiedy Fokus się włącza
Fiku-miku na patyku
Dylu dylu na badylu, cuda wianki na kiju
Byleby dalej do celu
U, podoba mi się tu
Gdy w ręku ostre rzeczy mogę cię pokaleczyć
Z Twego ucha jucha bucha
Za wysoko lecisz, zmysły tracisz 
I o to chodzi stary
Cztery wymiary kultury
Hip-hop, który ze mną w konkury 
Na mój słowotok 

U, podoba mi się tu
Jakem MC 
Manifestuję moje fenomenalne powierzchnie tnące x2

Nauka na pewno długa
bo słów sztukowanie to sztuka
wyrafinowana technika
Co z tego wynika i co ci to da - nie wnikam. 
Hmm... No cóż, taka to moja podróż
To jaka taka metoda na słowa jak woda
Kaskada rymów, którą teraz włada Fokus - Smok
Wyrywam ci kręgosłup
Dziś Hip- Hop podawany na sposób 
MC z RP przez 032 kręcę 
i Ciebie bitem nęcę
Powitaj nową lancy następcę 
B O G U C I C E
Podoba mi się tu
Ej ej, MC, halabarda w ręce mej, nic więcej
Twoja garda marna, moja jest bardzo zwarta 
Zaciskam palce i wyzywam Cię
Do walki na przechwałki
Stoję i oczekuję, kiedy Ty wyskoczysz na pałki

U, podoba mi się tu
Jakem MC
Manifestuję moje fenomenalne powierzchnie tnące. x2

Biała broń werbalna kontra palna
Rymy jak cięcia w skroń 
Do łap łap mikrofon i hip-hop, łeb chroń
Teraz moja dłoń 
Rzuca K10 w RPG ze sceny
Uderza ma pięść
W problemy które tu mamy na Ziemi
I gramy, na trzy-cztery składamy litery
Litery w wyrazy, które we frazy
Te z kolei w obrazy bez skazy
Okazy te wiele razy giną bez wieści
Do formy wkładam treści 
I jeśli się już nie mieści
ustami łomotam, wyrazami miotam
W locie tnę je na części
Stary, Ty mi tutaj, nie tutaj rymem rzucaj
Piorunująca akcja
Melodeklamacja 
Składaj, albo spadaj
Rób coś, a nie gadaj
Nie pierdol trzy po trzy
Kto tu jest najlepszy
Hip-hop nie dzieli nas, a łączy 

U, podoba mi się tu 
Jakem MC 
Manifestuję moje fenomenalne powierzchnie tnące x4"
33,Priorytety ,"Wszystko ma swoje priorytety, niestety.
Wszystko ma swoje wady, zalety.
Hierarchia wartości, obowiązki, przyjemności,
hip hopowa podróż do przyszłości.  x2

W hip hopowej społeczności Fokusmok już gości,
jedna jedyna sprawa godna wytrwałości.
Niewiarygodnie szybki smok w świecie swych wartości,
powstałem z nicości, obrałem drogę ku wolności.

Pierwszy priorytet obrany serca bitem,
chociaż inne perspektywy rozmyte.
To c.d.n. nie sen, wiem, że mam to we krwi jak tlen.

Na pewno, pełna satysfakcja to jedno,
korzyść jest rzeczą tylko pokrewną.
Nie pękam, nie stękam, to innych jest udręka,
nie błagam, nie klękam, mam radość w tych dźwiękach.
Swobodnie słowa plątam na wszystkich moich frontach,
siedzę, kucam, rozrzucam je po kątach.

Przyjemne z pożytecznym to sukces odwieczny,
bez obawy, ja jestem bezpieczny.
Ale w jakim sensie? Oto jest pytanie,
panie i panowie, otwarte losowanie. 
Los tej loterii ciąży na jednej karcie, 
nie mam wyboru, za to ludzi poparcie.
Prawdopodobieństwo jednak większe niż w totka, 
że ta karta to nie blotka.
Mam manię, to ciągłe słów kompletowanie,
tak było, jest i tak zostanie.

Fenomenalne powierzchnie tnące moim priorytetem, 
analizuję barwy, smocze oczy są pryzmatem.
Zatem czy to z kwadratem czy solowym traktem,
czy traktatem niepisanym, połączony z 3xKlan.
Czy może paktem z Mag Magikiem i Rahim-o-logikiem,
jedno jest faktem, jestem rymotechnikiem.

Wszystko ma swoje priorytety, niestety. 
Wszystko ma swoje wady, zalety.
Hierarchia wartości, obowiązki, przyjemności,
hip hopowa podróż do przyszłości.  x2

Jedyne niedogodności z powodu mej miłości
to szkolne zaległości i brak wyrozumiałości.
U gości, którzy nie chcą dzielić ze mną mej radości,
to boli, pierdolę, kręcę pokrętłem głośności.

Bujanie konika Magika, 
to nie filatelistyka czy numizmatyka.
Nie mam też ochoty na zabawy w żołnierzyka,
zegar tak tyka, a czas umyka.

Ciągły trening sprawności do słownych walk 'kumite',
o autorytet, mój najwyższy priorytet.
Czy to dla mnie brawa bite? 
Nie sądzę, nie wierzę.
Zbyt wysoko nie mierzę, bo po co?
kiedy słowa się tak cyklicznie kocą,
przy tym gdy inni się tak straszliwie pocą dniem i nocą.

Spalonymi mostami łączę się z miastami,
z takimi samymi jak ja hip hopowymi głowami.
Tylko jedynie czasami, pomiędzy levelami 
myślami zajmuję się rzekami za plecami.

A więc informuję w czym najlepiej się czuję,
w czym specjalizuję i co mnie raduje.
W świecie rzeczywistym stacjonuję, 
to tu funkcjonuję i wciąż kombinuję.
Szczęścia na bazie czyjejś porażki nie buduję,
stale komponuję, rymuję i się edukuję.

Pierwszy priorytet i znowu z apetytem
jedynej sprawie oddanie całkowite.
To chroni mnie tak jak posła immunitet,
karmię duszyczki co nigdy nie są syte.
To w pytę, że nie tylko dla mnie to pożytek,
a co zdobyte nigdy nie będzie szczytem.

Widzę szczyt, a za szczytem zaszczyt za zaszczytem,
lśnienie mistrzostwa kieruje moim bytem.
Ambicja spotyka się z uznaniem i zachwytem,
Wyrzeczenia są tutaj jedynym zgrzytem.
Priorytetem Ha I Pe Ha O Pe 
eN I Gie De Ygrek eS Te O Pe.
Idę tym tropem, bawię się hip hopem,
zalewam potopem rymów kłopot za kłopotem.

Mrówka i harówka, wspólne ze sobą słówka,
wolna od nich ma główka, życie fajne jak kreskówka.
Mam swój cel, jak pocztówka trafiać do adresata,
W ten sposób podróżuję, lecz nie jak Magellan dookoła świata.
I nie ma bata na jakiekolwiek zmiany, choć bieda przygniata.

Wszystko ma swoje priorytety, niestety.
Wszystko ma swoje wady, zalety.
Hierarchia wartości, obowiązki, przyjemności,
hip hopowa podróż do przyszłości.  x2"
34,Rób co chcesz... ,"-Chcę smoka...
-Co się mówi?
-Przepraszam...
-Nie, mówi się błagam o przebaczenie.
-Błagam Cię o przebaczenie.
-Dlatego nie lubię szmat... Jesteście gotowe zrobić wszystko..
-Nie jestem szmatą..
-Nie?
-Nie...
-Wiesz, czym się różni szmata od kobiety? Tym, że kobieta  się szanuje...

[Magik]
Świat schodzi na psy, razem z nim ty.
Wierzysz mi? Policzone są twoje dni.
Wiesz jak jest, tu chodzi o moją troskę,
bo niezbadane są wyroki boskie.
Więc rób co chcesz, pod uwagę bierz możliwości,
przyczynowo skutkowe zależności.
Trwa pościg za kasą, pozycją, dupami,
gdzie ludzie rozminęli się z wartościami.
Tego nie wiem, ale spróbuj dać im palec,
kto jest kto przekonasz się doskonale.
Hipokryci dla mnie daremnie ukryci,
Ich dewizy, szydercze oczka, uśmiech Mona Lisy.
W głowach schizy wynikiem mej ekspertyzy.
Sprawdź kto kogo teraz ujmuje w ryzy!
Oto nadchodzi Magik, z języczkiem u wagi
robię ci kiełbie we łbie nie gorzej niż dragi.
Pożycza ode mnie kwotę, mówi, że odda potem.
Ze mnie robisz idiotę? Robiąc z siebie idiotę.
No to kwita, oto w nowym świecie cię wita
eM A Gie I Ka i Paktofonika.
Masz jakieś ale, się zmachałeś?
Albo spadłeś z byka, coś strzyka, Cię drapie,
coś cię dotyka.
Lub fatalnie upośledzony emocjonalnie,
mówię ci legalnie, sterowany zdalnie.
Teraz siadaj - ja wykładam, w ciszy słuchaj.
Bynajmniej to nie poezja dla ucha,
ha-ha, uchachany ja, bo sprawa krucha
próżnego kłamczucha, co wyzionął ducha
Już dawno - rób co chcesz, byle nie pójść na dno.
Rób co chcesz, wiesz i nie żałuj, no!

-Nie! To przypadkowy kumpel.
-Przypadkowy kumpel Cię po dupie macał? Spoko...
-Jezus Maria...

[Fokus]
Dwa tysiące loopy, dwa miesiące zupy.
W taki upał każda głupia dupa da ci dupy.
Spójrz, ej, na jej ruchy, ujrzyj jak się męczy.
Weź ulżyj jej, sprawdź, jak jęczy pod tobą.
Takie potem nie płaczą, to dobrze.
Owszem, właśnie dałeś zgwałcić się kobrze.
O Boże, może to, że była taka łatwa -
raz: to nie wina twa, a dwa: to pułapka.
Może głupia dupa ta od trzech tygodni w ciąży lata,
na tatę faceta szuka taka szmata.
Ja tam co chcę mam, nie chcę więcej niż chcę sam,
zgniatam, a nie zjadam owoce jak Adam.
Znam obiekty westchnień przez sugestie
z Cosmo zamienione w bestie, więc ostro!
Zaczytani w CKM-ie, chuj, że ściema na ściemie,
gdzieś tam odpowiedź drzemie, ja wizerunek zmienię
swój. Nie żałuj, pewne siebie ruchy
zapewniają co noc na noc dupę do poduchy.
Więc rób co chcesz, może wieczór ze świecami?
Lecz zadowolona będzie suka skuta kajdankami
dopiero. Hetero ja, a ona bi, więc da mi z koleżankami,
Nie mam wyboru, myśli się jajami wtedy, nie? 
To tera zajebała mi z numerami ważnymi komórkę,
a jej dziurkę ciurkiem wytrychami jej śluzem upaćkani
ślusarze jak ja pojebani, wiesz co? Kurwa ci mówi, że dziś da ci za nic,
Też coś. Wierz w co chcesz, rób co chcesz, dupcz co chcesz,
zresztą, ja mogę gadać, a ty i tak pójdziesz złą ścieżką.

-Wiesz? Bo dzisiaj się tak zastanawiałem nad tobą.
-No i co?
-W sumie, to jak tak pomyślałem sobie nad tobą, to mi się rzygać chce...

[Rahim]
O, o, otóż to, poznajesz ją
I serca K.O. czeka cię, bo
Zadurzony po uszy swe o
Każdej porze to pozytywne flow
Wszystko inne w tło, dziennie planów sto
Słodkich akcji gro, w końcu wkładasz go
Boli? Nie słuchaj, bo pierdoli
Nie jesteś pierwszym, którego szkoli
Tak zadowoli cię-cię niezmiernie
Pieprz to, ocknij się, bo skończysz miernie
Wiesz to, że trzeba podchodzić biernie
Rozczarowany? A przyrzekała żyć wiernie
Na chatę wpada, siada, opowiada
W cieniu zdrada?! Och, to przesada!
Spadaj, mała moja rada
Twe tłumaczenie mi nie odpowiada
Więc słuchaj, a nie gadaj
Dlaczego tak, a nie inaczej? Jak to dlaczego?
Chciałaś tego, wybrałaś, wczuj się w pokrzywdzonego
Dlaczego tak, a nie inaczej? Jak to dlaczego?
Chciałaś tego, wybrałaś, zrozum pokrzywdzonego
Na drogę całus, przez życie pedałuj
Rób co chcesz, myśl, niczego nie żałuj
Rób co chcesz, bierz, niczego nie żałuj
Rób co chcesz, wiesz, niczego nie żałuj

Rób co chcesz, niczego nie żałuj
Chciałaś? Wybrałaś
Ej, w dupę mnie pocałuj, wiesz x4

-I to jest powód żeby cię koleś po dupie macał, tak się spytam, nie? Boli, prawda? Widzisz, tylko, że mnie to już nie obchodzi, że ciebie boli, bo ja cię mam już w dupie. Możesz iść do domu, dziękuję.
Było mi miło z tobą spędzić 2 lata. Mówiłem ci... Do widzenia, dobranoc."
35,Stało Się (Rah) ,"Stało się - dojrzałem na oczy przejrzałem 
ujrzałem rzeczy których wcześniej nie dostrzegałem 
stało się - wydoroślałem, bariery pokonałem 
poznałem to o czym pojęcia nie miałem 

stało się - dojrzałem na oczy przejrzałem 
ujrzałem rzeczy których wcześniej nie dostrzegałem 
stało się - wydoroślałem, bariery pokonałem 
poznałem to o czym pojęcia nie miałem 

1-7-1-1, z prochu powstałem 
światu czyny ujrzałem 
zaraz jako dziecko małe 
w dupę dostałem 
pod matczynym okiem dorastałem 
w wierze, nadziei, miłości się wychowywałem 
na nauce się skupiałem, specjalnych problemów nie miałem 
życie badałem, z nienacka hip-hop usłyszałem 
szoku doznałem, na tym punkcie oszalałem 
z początku słuchałem, następnie 3-X skonstruowałem 
[ah] wszystkie siły dałem by cel osiągnąć który obrałem 
trzy lata czekałem, płytę nagrałem, wydałem 
rezultat nie był takim jakiego oczekiwałem 
po czym coponiektórych uznanie pozyskałem 
wyszedłem, przemyślałem, sprawę sobie zdałem 
ile nocy nie przespałem, ile czasu nad tym pracowałem 
nie było to tym o co się ubiegałem 
stare flow olałem, a przy swoim pozostałem 

stało się - dojrzałem na oczy przejrzałem 
ujrzałem rzeczy których wcześniej nie dostrzegałem 
stało się - wydoroślałem, bariery pokonałem 
poznałem to o czym pojęcia nie miałem 

1-9-9-8, nowy cel obrałem 
z PFK się ugadałem 
nie zwlekałem, z nimi pakt podpisałem 
kooperację zawiązałem 
nareszcie otrzymałem to czego od lat poszukiwałem 
jak wszystkie dzieciaki sprawy sercowe przerabiałem 
związki długodystansowe od dawna preferowałem 
świat okiem romantyka postrzegałem 
doputy, dopuki znowu się rozczarowałem 
zrozumiałem, zbyt wiele cierpiałem 
przy tym gdy tyle się starałem 
na samego siebie się zdałem 
zmądrzałem, wolność wybrałem 
wiele myślałem, ludzi swych obserwowałem 
wytycznym sprostałem, które od nich dostawałem 
strapiony pomagałem, żale ich unicestwiałem 
aż w pewnym momencie pytanie sam sobie zadałem 
ile rzeczy zjebałem, ile spraw w życiu zasrałem 
cholera! dopiero teraz to zło przeanalizowałem 

stało się - dojrzałem na oczy przejrzałem 
ujrzałem rzeczy których wcześniej nie dostrzegałem 
stało się - wydoroślałem, bariery pokonałem 
poznałem to o czym pojęcia nie miałem 

stało się - dojrzałem na oczy przejrzałem 
ujrzałem rzeczy których wcześniej nie dostrzegałem 
stało się - wydoroślałem, bariery pokonałem 
poznałem to o czym pojęcia nie miałem 

Dwa i trzy zera wybiło, w martwym punkcie stałem 
wokół się rozejrzałem, inną szatę przyodziałem 
[aa] błyskawicznie do działań się zmobilizowałem 
chociaż dwa miesiące oceniałem 
przy tym sie nie doceniałem 
zbitek dostałem, na nim ostro pojechałem 
wydedykowałem ile kwestii przemilczałem 
z miejsca się poderwałem, power wykorzystałem 
próbowałem, szukałem, wybrałem, udoskonalałem 
ziarno niezgody zasiałem, w konflikty się wdałem 
[aah!] czasem w plecy zebrałem 
zdenerwowałem się, nie wytrzymałem 
odpowiedziałem, przy tym twarz zachowałem 
potwornie się zmachałem, nawijając co myślałem 
on mym natchnieniem, zrozumiałem 
stało się, stało się, stało się, stało się 
tak dorastałem... 

stało się [ah], stało się [ah], stało się [ah] 
stało się [ah], stało się [ah], stało się [ah] 
stało się [ah], stało się [ah], stało się [ah] 
stało się [ah], stało się [ah], stało się [ah]"
36,Statyści ,"Koleś chce być cool jak Amerykanin 
Może myśli ze panny poleca za nim 
Sznurem
Zanim masz działać jak dureń 
Dobrze się zastanów 
Chyba nie jesteś ze Stanów?
Jak rój Amerykanów 
Na teledyskach Vivy 
Straci zwykła pała a zyska prawdziwy 
Tylko sam na siebie mam różne wpływy 
Przedstawiciel Sosnowiec jestem trochę leniwy 
Ja jestem hip-hopem, a on jest mną
Śmiać mi się chce jak pacjenci się drą 
Zebym wreszcie przestał 
Zamknął gębę
Właśnie, ze nie zamknę
Dalej rymować będę
Wszyscy zdziwieni 
A ja nieważne czy w sieni 
Czy w windzie, 
Czy w szkole, 
Czy w ogóle gdzie indziej 
Rymuję
To dla mnie nie lada gradka 
Zaden knebel moich ust nigdy nie zatka 
Nic nie zdejmie luźnych gaci z mego zadka 
To zajawka z serca i wiarygodna gadka 
Nie kolor okładka 
Siema Bravo foto story 
Chce być prawdziwy 
A nie stwarzać pozory

Statyści 
Śmiać mi się chce z takich koli 
Statyści 
Gdy ich widzę serce mnie boli 
Statyści 
Z takich jak wy chce mi się śmiać
Statyści srać! 
Statyści 
Śmiać mi się chce z takich koli 
Statyści 
Gdy ich widzę serce mnie boli 
Statyści 
Z takich jak wy chce mi się śmiać
Statyści srać! 

Hip-hop-u nie nauczy cię kurs ani fakultet 
Wykuć go jest jak zepsuć metalową kulkę 
Nie chce być gwiazdorem, ani krytykiem 
Ale statysta musi liczyć się z ryzykiem 
Ze ktoś prawdziwy kiedyś do niego zagada 
Biada maskarada statysta dupa blada 
Wtedy to dopiero będzie wstyd 
Wystarczy tylko jeden podchwytliwy chwyt 
Czy Ty wiesz co to jest hip-hop w ogóle?
Eeee... duże spodnie i koszule? 
Weź, weź... robisz z Hip-hopu wieś 
Robisz nam przypał 
Na takich jak wy będę wyzwiskami sypał 
Mówię do Ciebie a ty ""eee-yyy-eee"" 
Z takich jak oni śmiać mi się chce

Statyści 
Śmiać mi się chce z takich koli 
Statyści 
Gdy ich widzę serce mnie boli 
Statyści 
Z takich jak wy chce mi się śmiać
Statyści srać! 
Statyści 
Śmiać mi się chce z takich koli 
Statyści 
Gdy ich widzę serce mnie boli 
Statyści 
Z takich jak wy chce mi się śmiać
Statyści srać! 


Statyści...
Ach, wczoraj widziałem jednego 
Z prawdziwą akcją nie miał nic wspólnego 
Od matki na spodnie 300 złoty styka 
Statysta ze statystą głupotą się ściga 
Problem z tego wynika, przymknę oczy na to 
Tok myślenia - styl bycia premiowany stratą
Rodzinę ma bogata 
I przyszłość w jasnych barwach 
Najlepsza pannę spod solarium zarwał 
Bo czuł się pewnie, dużo sobie wyobraża
Statysta na mieście pozory stwarza 
Niejednokrotnie tak się ubrał, bo modnie 
Każdy musi widzieć że kupił nowe spodnie 
Jaki krój! 
Z niego chyba niezły chuj
Prawdziwi do przodu 
Ty statysto stój!

Będę nagrywał gdy komputer kupię
Tak mówił niejeden, teraz na gierkach ciupie
Mówił o Hip-hop-ie, a teraz ma go w dupie 
Odłożył go do kąta jak podniszczony rupieć 
Bo nie wyszło mu w dwa miechy 
Chciał podbić globus 
Chciał by wszyscy widzieli jaki z niego łobuz 
Jaki z niego madafaka gangsta rapakilas 
Chciał zabłysnąć sławą jak Violetta Villas 
Chwila...
Skąd ten koleś tutaj przylazł?
Niech dają dyla Ci co maja słaby bilans!
Śmiać mi się chce 
Choć nie jestem stary wyga 
Wyścig statyści, statysta ze statystą głupotą się ściga

Srać mi się chce - ale jaja!
Widzę statystę i serce mi się kraja
Srać mi się chce - ale jaja!
Widzę statystę i serce mi się kraja
Serce mnie boli
Chce mi się srać!

Statyści 
Śmiać mi się chce z takich koli 
Statyści 
Gdy ich widzę serce mnie boli 
Statyści 
Chce mi się śmiać z takich jak wy 
Powtarzam ostatni raz 
Statyści prrrr!"
