,Title,Lyrics
8,Czas ,"Stary co mi się ostatnio śniło 
Sniło mi się że poszedłem ze śmieciami 
Stali na dole naspidowani, ani 
Nie patrzyłem na twarze, wiesz jarze 
Nie chcę kanałami chodzić po osiedlu 
Jeden kojarzy, że siedział w pierdlu 
Jezus, kiedy słyszę moje nazwisko 
Ten drugi chce super lighta mojego 
To nogi zgina, za jego oczami człowieka nie ma 
Ślina, adrenalina 
Ale daje i idę z tym kiblem 
Uznaję ich siłę i udaję gnidę przed bydłem 
Myślę, spokojnie, masz przewagę, wróć tam 
Jeden - nie wiedzą, że ja to ja 
Dwa - w zamku klucz złam 
Mój but, klucz jego łokieć, szyba 
Słyszę jak ich wzywa, nie dożyję jutra chyba 
Teraz alternatywa - spierdalać czy gadać? 
Gadać, ""150 % mogę wam dać"", cisza 
[200] 175, [200 i tydzień kurwa, bo zrobię Ci rzeźnie] 
Zajebiście nie? nieźle, skąd ja kurwa wezmę 
I w ogóle co za bezsens, nie spię, po godziny wczesne 
Telefony do rodziny, ""Cześć, halo. 
Jestem Twoim kuzynem, pożycz mi na czesne. 
No tak, bez ściem. Aha, no to dzięki."" 
Nawet za siebie samą nie dała by uciać ręki 
Se, ta p..., nie telefonuje 
te kojarzysz co się dzieje, bo ja nie pojmuję, 
Ej brat, wali mi sie świat, 
Aha, tak. O 8 pod blokiem cały skład 
Osiedlowy wywiad uruchomił wszystkie kontakty 
Około 11 znałem pewne fakty 
Późnym popołudniem wiedziałem juz kto ma draxy a kto broń 
W końcu dotarłem do pewnej Magdy. Znasz ją, nie? 
Mniejsza o to. Mówię jej, mam kłopot 
I że siedzę w gównie po tąd 
I czy wie czyją robotą jest ten kwas? 
Ona mi mówi ""Daj mi czas"" 
Po chwili wraca, mówi pod ten adres raz 
Jej facet wlazł, ale szybko wylazł, 
Wyniósł go na butach jakiś jebany lowelas 
Bilans, jadę jadę, stary jak wjedziesz na autostradę 
to wziął byś i nadem( ??) 
Prawie dwa razy wypadek, w końcu patrz to chyba tu, 
Chata jak ze snu, i dojebane BMW 
Żyć nie umierać! Tylko żyj i co teraz? 
Nie widzialna bariera, z nimi się nie zadziera 
Trzymają łapę na sterach, maczają palce w aferach 
Znikają ludzie, i to znikają do zera 
Więc ja za chuj tam nie pójdę 
Chyba że masz bullterriera szybszego niż giwera 
kumpel już mówił ""popieram"", gdy nagle furtka drgnęła, 
Chciałem krzyczec ""nie strzelaj"" 
Widziałem znicze, no może cholera pobicie 
Kamera w oczach obficie popiera obrazy nacierające 
I życie przewija mi się. I idzie znaczy się 
W powietrzu płynęła, Andżela, córka miliardera 
Uśmiechnęła się i sponiewierała szofera 
Angela, która lubi relaks, Angela 
Która na zakupy wybiera się bez portfela 
Kró, krótko, czas stanał mi i kumplowi, 
Szy, szybko pojechalismy za nią do Obi, 
Co, co taka tam robi? Ta, ta jne spotkanie. 
Je, jeszcze dwie Pa, panie że cisza na planie, nie? 
No i ten jeleń, czy daniel 
Zaraz przez radio - węzęł dostanie wezwanie 
Że taka to a taka BMa jest w gorszym stanie. 
Jestem sam nie? Włącz rozumowanie 
Mam zadanie i czas na wykonanie 
streszczam się, ""chodźmy gdzieś"", chodzi o przetrwanie 
""Chodźmy gdzieś, cos zjeść, gdzie jest taniej ale fajnie 
Ej, błagam Cię, chcesz? Pokażę Ci mieszkanie 
Miałem włamanie, centralnie, wyryli mi ""piątek"" na ścianie 
A ja nie wiem co jest grane"" [To prawda kochanie] 
""Boję się, że coś się stanie mi, albo mojej mamie. 
To nie porwanie, i to nie bajer, 
Chodźmy zanim przyjdzie ten frajer"". Koniec bajek 
Wstała, ubrała ubranie i wyszliśmy 
Pojechalismy w jej koleżanek Nissanie 
Jak na rajdzie Wisły, hamowanie z pełnej pizdy 
Jak na ekspedycjach Jajo 
Wysiada Andżelika, chłopaki gwizdają, 
aje.. po co ja ją tak właściwie tutaj? 
Anioł w skurzanych butach, a jej facet to brutal 
A więc schowaj fiuta nawet jeżeli sie łasi 
Nawet przez chwilę nie myśl o tym, 
że mógłbys ugasić to ciało, pasi czy nie 
Kutasi łbie mało czasu zostało. 
Właściwości THC znaja Ci, co palą 
Ona mówi ""halo tato"" 
A ja słyszę jego ""nie"" z jej Nokii. Komunikator 
I jak wentylator cały świat wiruje 
Ona pyta jak sie czuję 
Mówię co sie czuje - strach 
Strach się czuje tak jak wszystko 
Chujem, strachu się nie opisuje 
I tak patrzę co robi, a ona esa wystukuje 
Po 10 minutach schiza, zbliża się BMWica 
A w niej pies mu morde lizał 
Jej szofer, psi lizak, typek fajny ma dizajn 
Szafa dwa na dwa, dziary i dredy, analiza 
Na siedzeniu pazażera mój kumpel sie rozpierdziela 
Wychodza z jednej strony - tamtych drzwi się nie otwiera 
Już teraz - ""Cześc Angela, Cześć Angela"" 
Teraz finał jak w boleru Ravela 
poczuj klimat w stylu kina akcji jak w Matrix 
zadyma dopiero teraz się zaczyna. 
Smród, po spalinach BMW jak w taxi. 
Proste jak drut. Pojechaliśmy po skurwysyna 
Ja i sexy Angelina i jej wielka zimna świnia 
I jej 9-cio milimetrowa sztuka dyplomacji 
Jeszcze jedno - jeśli nie wiesz o co chodzi 
Chodzi o pieniądze albo dupę, wiedzieć nie zaszkodzi 
Tak więc winda, parter, piętro czwarte 
Z buta zapukał, wszedł, 
Jeb-jeb, złamanie otwarte. 
Rzygałem, do końca życia zapamiętam jedno - 
przestał go kopać kiedy pękło trzecie żebro. 
Płakałem kiedy pisał swoją krwią na podłodze 
numer telefonu do zleceniodawcy. 
W drodze myślałem tylko o tym żeby zasnąć. 
Miasto, nocne życie, mocne przeżycie na własnośc. 
Zaraz zaraz, czagoś nie rozumiem. 
Przecież to jest qrwa mój stary numer w sumie! 
C.D.N. 
"
9,Dejot Rusza Czarne Płyty ,"KAMS:: 
Dejot rusza, skrusza, zmusza do jazdy 
Choć nie posiada Mazdy RX7
To jestem pewien, że was przewiezie
Na okrągło w koncepcji stylu bongo 
Winylowa ciągłość nigdy nigdy dość
Na srebrnym sprzęcie elity Bambus zapuszcza puyty 
I oprócz tego jeszcze coś robi
Co zdobi jego twarz, czy to ha-sz sz sz? 
Nie powiem.. tylko swoją głowę także ozdobię i zapowiem zbiórkę, 
Bo oto mam rurkę, jak kto woli – bibułkę
Proszę sznurkiem.. Zapalimy na spółkę.. 
Dla mnie i dla pani tematy seksualne i klimaty 
Lecz nie spadam do chaty 
I nikt tu nie rządzi i nikt tu nie mąci,
Nie za karę – poszedłby w kącik, rozmyte kolory 
Kończę.. sorry 

MAG:: 
DJ grzej puyty, stuff już nabyty, nabity.. wokół kobiety i typy z ekipy 
Zapowiada się wieczór znakomity, jestem za tym? A ty? 

KAMS:: 
Niewyżyty 

MAG:: 
Spoko.. OK. spoko dla oka lokal 
W towarzystwie bracha 

KAMS:: 
Raha i Foka 

MAG:: 
Co tam masz, pokaż? 

KAMS:: 
Powala jak knock-out 

MAG:: 
To ja na razie out, bo długa i szeroka zawisła nade mną chmura 

KAMS:: 
Ej Magik! 

MAG:: 
Co? Aha. Teraz twoja tura 
W tle bit Premiera gra, a nie Stachura 
Zabawa trwa 

KAMS:: 
na 102 

MAG:: 
a nie na hura. 
tu nikt nie szumi, bo tu nikt nie szura 
tu pełna kultura i nie ważne jest która 

KAMS:: 
O kurczę, chyba rozbiła się rura 

MAG:: 
No trudno, mam drugą, więc nie będzie nudno 
Pewno trafiłeś w samo sedno 
w worku dno, a mnie wszystko jedno 
tu wszyscy bawią się póki polegną.. 

KAMS, MAG, STRAHO:: 
Dejot rusza czarne puyty 
Na srebrnym sprzęcie elity 
Zielony skręt jest zbity 
I każdy kolor rozmyty 

STRAHO:: 
Wszystko jasne, KPW 
Elita jest tu, nareszcie powraca, więc ciesz się 
Ktoś prosi mnie na stronę
Choć jeszcze nie skończone są kwestie
Którymi zaśmiecam przedmieście
I wrzeszczę wciąż na równi z deszczem 
Tych wyliczanek, rymowanych układanek 
Z panem Sebastianem i panem Radkiem 
Zrobimy wpadkę na prywatkę, na zieloną chatkę 
Pif-paf w płuco traf, unikaj gaf, dobrze sprawdź stuff 
mm.. i baw się bez obaw do bólu, przecież tu jest jak w ulu 
stary, postuluj o wydanie asortymentu 
karmę obecnych tu klientów 
kolumny muszą grać, Dejot, nie wyłączaj sprzętu 
niech siła wzmacniacza przytłacza słuchacza 
niech szmata się rozkracza dla dobrego ściemniacza 
cze.. zabawa na 102, hip-hop gra, na na na
tak jak Rahim, czyli ja, wszyscy cieszą się ha ha 
dookoła opary, browary, towary, spisz na miary stary
Przyjedź, z ucieszonym ryjkiem wyjedź stąd"
10,Dla Pewnego Swego ,"MAG: 
Rzeknij coś na ten temat 

STRAHO: 
Gdy czegoś bardzo mocno chcę, 
Wtedy problemu nie ma, znasz ten schemat 
Olej każdy dylemat, jest zbędny, 
Posiadasz cel, nie wiesz którędy iść, ja ci powiem, tędy 
Nie spadaj jak liść na ziemię 
Pnij się do góry, spełniaj swe marzenia 
Tak już jest jest z pokolenia na pokolenie 
Żeby mieć, trzeba mocno tego chcieć 
To logiczne jak sieć, widzisz cel – wyciąg rękę i leć za nim 
Samo gadanie na nic, dla pewnego swego nie ma granic 

MAG:
Nie wystarczy momencik, czy odrobina dobrych chęci 
Chcieć to móc, więc mogę, bo to mnie nęci 
Miejcie w pamięci, wszyscy razem wzięci oponenci 
Mogą dziś nosem kręcić i życie spędzić na niczym 
Do każdego kogo to dotyczy – zrób następny ruch zamiast wciąż się byczyć 
To wyczyn, na który chyba cię stać, 
Nie masz nic do stracenia, więc nie musisz się bać, 
Nic tylko trwać i stawiać .... kolejne kroki 
H I P- H O P sprawa nie cierpiąca zwłoki, 
To łączy ludzi... jak walkie-talkie 
Jak góry, stoki, jak świat długi i szeroki 
Jest 

FOKUS: 
Kiedy chcę, potrafię się zmobilizować do działania 
To kwestia obierania celów i ich osiągania 
Starania nie wystarczą do wykonania zadania 
Zawsze jest od zajebania załatwiania i biegania 
Jestem tu od nadawania sprawom toku, 
Od wykonywania i wydawania na nie wyroku 
Odkładania ich ad acta
Będziesz w szoku 
Nie spodziewałeś się tego nawet po samochodzie roku 
Człowieku 
Przecież wiesz, że jesteś w stanie załatwić wszystko, 
tak jak załatwiasz bakanie.. 
podejmij wyzwanie i postaw na kombinowanie 
przestaw się na działanie 
zostaw gadanie na ostatnim planie 
weź się za realizowanie swoich marzeń 
chcieć – oznacza wpływać na przebieg wydarzeń 
to takie naturalne – bać się mocnych wrażeń 
lecz wiadomo – nikt nie wyjdzie z tego gówna bez obrażeń 

MAG:
Jeśli mam na coś ochotę, resztę odkładam na potem 
To staje się priorytetem, a milczenie, które złotem 
Przestaje być kłopotem, bowiem wiem, że galopem 
Można znaleźć się między kowadłem a młotem 
Bo każdy, nawet najmniejszy orzech do zgryzienia 
Aby okazał się pestką, jest kwestią do przemyślenia 
A więc pomóż sobie, rusz głową, zamiast stawać na głowie 
To recepta, bądź czynny, aktywny jak wulkan Etna 
Na życie mam metodę, co daję wolność i swobodę, 
Jeśli wiem czego chcę, brnę nie idąc na ugodę 

STRAHO: 
Dla pewnego swego i chcącego nic trudnego... 
Dla pewnego swego i chcącego nic trudnego... 
Dla pewnego swego i chcącego nic trudnego... 
Dla pewnego swego i chcącego nic trudnego... 


nic trudnego 
nic trudnego 

Dla pewnego swego i chcącego nic trudnego... 
Dla pewnego swego i chcącego nic trudnego..."
11,Esperanto (Fokus) ," 
esperanto 

Patrz na mnie 
to nie ja pannie 
w wannie 
po twoim drinku 
wycierałem starannie 
twarz 
bo aż 
porzygała się 
dasz jej dropsa 
dupniesz 
na resztę srasz, nie 
strasz mnie synku, 
bo morda nie szklanka 
wiesz, nazywa się Anka 
to moja kolezanka 
chcesz wiedzieć? 
twoja fanka to była [była była] 
tym zawiniła nie? 
te e e te czykyczyky bombom 
szczęście w nieszczęściu ze wiesz co to kondom 
może powiesz tez tym swoim głąbom 
skoro je robia tak na okrągło jak rondo 
żal dla ciebie niczym za spuszczoną bombą 
ściemniłeś kiedyś laskę mądrą na gadkę 
a nie na klatkę 
to fantom bo głupie dupy będą dawały dupy palantom 
ja mam to i nie ma to tamto 
esperanto esperanto 

on ja swa dlonią objąl i dawal jej cieplo lecz byla pochodnią to straszne jednakże zauważ, że zdarzenie 
każde ma skutki poważne wiec stal sie tym kim nie chciał wrecz udowadniał ze nie zniewiesciał ał 
w koncu skumał i zaakceptował juz nie musiał przed nią chowac sie za słowa 
definitywnie jestem kim jestem znam rantoespe 
swą powagą wyluzowany jak chester 
pieprze ze pieprze to lepsze niz przestep ty ty i ty a ty na deser sesesese ssij jak TSR gdy 
eFOKaUeSeM koneser niesie w sobie klase niczym neseser 
oszalala za tym 
uhm po to jestem tu kotku otwarty 
uhm niegrzeczna dziewczynka 
uhm z twoich nog cieknie mi slinka 
masz dlug madame 
sprowadzam na ziemie 
ziemi trzesienie 
gdzie sila drzemie 
chyba nie w BeeMie 
nie ufaj samcom 
a emocjom w oczach 
esperanto"
12,Gdyby ,"Od początku muszę tego słuchać?
Ta, musisz.
Dobra, niech tak będzie...
Muszę tego słuchać.
Ja tego muszę słuchać!

Gdybam, gdyby to nie było na niby
Gdybam , gdyby to nie było na niby
Gdyby, gdyby to nie było na niby 

[Magik]
Gdyby świat cały
Obrósł w niebieskie migdały
Gdyby Magik był doskonały
Gdyby podziały gdzieś się podziały
Gdyby ryby głos też miały
Kaktusy na dłoniach by wyrastały
Gdyby po Ziemi stąpały ideały
Biały byłby czarny
A czarny biały
Indywidualnie na życzenie upały
Wciąż smakowały te same specjały
Minerały każdej skały
Szlachetne jak kryształy
A wszystkie kabały
To tylko kawały
Gdyby czyn był godny chwały




[Fokus]
Gdyby Fokus nie był tak zarozumiały
Gdyby wrony nie krakały
Gdyby kozy nie skakały
Gdyby tak psy nie gryzły
Koty nie drapały
A komary nie wkurwiały
Gdyby dyskojeby tak się nie rzucały
Gdyby równiejsze z równymi równać chciały
Gdyby nowe hip- hopowe kluby powstawały
Gdyby foki w klubach tych dupami wywijały
A ekipy rymowały
A się nie napierdalały
Gdyby składy tak jak mówią reprezentowały
Gdyby z pióra słowa dosłowne spływały
Gdyby w Gie O Pe zwykłe deszcze padały
Gdyby szyby i kominy mnie nie otaczały
A kraina Niby-Niby
Gdyby kromki spadały odwrotnie
Gdyby przerzutnie pociągały mnie okropnie
Gdyby rymy się składały wielokrotnie
Gdyby hip- hopowe głowy dostawały stopnie
A stopnie wystawiane by nie były pochopnie
Gdyby u mnie na oknie stały
Kwiaty paproci i niebieskie migdały
Gdyby ich cechy się uzupełniały




[Rahim]
Gdyby cudowne sny się sprawdzały
Gdyby Rahim zbierał pochwały
Gdyby problemy zmieniały się w banały
Gdyby z wszystkich treści morały wypływały
Gdyby partnerki partnerów swych kochały
Gdyby oczy nie płakały
A usta się wciąż śmiały
Gdyby powracały piękne chwile
I trwały
Gdyby lepsze czasy nastały
Gdyby kawki nie padały
Gdyby pały nie ścigały
Gdyby składy hip- hop grały
Przy tym nie dawały chały
Gdyby gazy nie wybuchały
A pożary nie wyniszczały
Gdyby wody nie zalewały
Kataklizmy nie istniały
Gdyby bratnie dusze się wspierały
I sobie ufały
Gdyby rymy tylko na wolno powstawały
Gdyby farby nie zaciekały
I na murze nie matowiały
Gdyby wielkie nominały
Każdą kieszeń oblężały
Na plakatach by widniały
Pfk inicjały
No a konfesjonały
By innowierców pochłaniały
Gdyby wszelkie bariery pozanikały
Gdyby żadne serduszka nie pękały
Gdyby kary winnych spotykały
Gdyby każdy był wyrozumiały"
13,Intro ,"Chcieliśmy dzisiaj wam przedstawić muzykę 


[Fokus]
Jak to ?
Co to za muzyka?
Jak to ? 
Jaka to klika ?
Jak to ?
Czyja liryka.. ? 
Jak to ?
To gówno nie ma odpowiednika ...
Jak to ? To to Paktofonika [x2]"
14,Ja to ja ,"[Rahim]
(No to zaśpiewajmy coś wesołego) x2 
Przeważnie, (przeważnie) zachowuję się poważnie
Przeważnie, (przeważnie) nikogo nie drażnię
Przeważnie, (przeważnie) słucham rad uważnie 
Przeważnie, (przeważnie) nie czuję się odważnie
Przeważnie, widać to po mnie wyraźnie 
Otoczenie nie działa na mnie zakaźnie 
Poprzez wyobraźnię kreuję własne ja 
Adekwatne do imienia 
eR plus A plus Ha 
Robię co trza
Rymuję gdy muzyka gra 
Jestem członkiem Pfk 
A nie klubu AA 
Pomysłów we mnie mnóstwo 
Niczym w worku bez dna 
Bądź co bądź być sobą to domena ma 
Pokazy mody i żurnale nie obchodzą mnie wcale 
Fason swój dobieram sam jak staruszka korale 
Mam typ osobisty niczym dowód 
I osobisty powód 
By czuć się wygodnie, swobodnie 
Polski rodowód w aktach 
Opieram się tylko i wyłącznie na faktach 

[Fokus]
Pragnę być nietypowy, niepowtarzalny 
Jednorazowy i oryginalny 

[Rahim]
Jeśli kopiuję to tylko w punktach ksero 
Gdy ktoś powiela kogoś 
Uważam go za zero 
Mówię prawdę szczerą 
Bo nie lubię gdy ktoś kłamie 
Służę pomocą, nie na każde zawołanie 
Mam własne zdanie i szereg racji 
Niezmienny niezależnie od miejsca, czasu i akcji

[Gutek]
Od A do Zet, od Zet do A 
Ja to ja to jasne jak dwa razy dwa 
Lata lecą, a ja to wciąż ja i ja

[Magik]
O nie! Nie zależy mi na tym by być kanonizowanym 
Ja to ja, więc jako ja chcę być znany 
Prawdziwym jak prawdziwek, nie jak sweter z anilany 
Jedną zasadą wciąż motywowany 
Bądź własną osobą 
Bądź co bądź sobą 
Niech twa osoba będzie ozdobą 
Nie jednorazowo, lecz całodobowo 
Trafiam białym w czarne jak kulą bilardową 
Oblicz pole podstawy jaką jest oryginał 
Lub działania poletko, jeśli jesteś marionetką 
To wroga sugestia, pożera cię jak bestia 
Mów do serca bitu, bo tam jest amnestia 
Od A do Zet, od Zet do A 
Ja to ja to jasne jak dwa razy dwa 
Proste jak drut, nigdy nie gram z nut 
A rymów mam w brud, które trwonię 
Gdy tylko stanę przy mikrofonie 
Od mikrofonu strony nie stronię, o nie! 

[Gutek]
Od A do Zet, od Zet do A 
Ja to ja to jasne jak dwa razy dwa 
Lata lecą a ja to wciąż ja 
Od A do Zet, od Zet do A 
Ja to ja to jasne jak dwa razy dwa 
Paktofonikę Gutek już zna

[Fokus]
 Technika Fokusonika wynika 
Z ego wielkiego jak galaktyka 
Nie brakuje mi żadnego składnika 
Do mojego ja, skala mnie nie dotyka 
Pozwolisz, że posłużę się przykładem 
Jest pewien Smok, który nie jest gadem 
Podąża śladem serca, a nie za stadem 
Jego skronie ozdabia tkany wolnością diadem 
Jego słowa są szczęścia wodospadem 
Tą oto wodą razem ze składem 
Zalewa jak ulewa lub zasypuje gradem 
Chcesz czy nie jesteś dla niego obiadem 
Robię to co kocham, to nikomu nie szkodzi 
Robię to no bo to lubię i wiem że wiesz o co mi chodzi 
Robię to no bo chcę to robić a wiem że to mi wychodzi 
Chcę i robię, cała reszta mnie nie obchodzi 

[Gutek]
Od A do Zet, od Zet do A 
Ja to ja to jasne jak dwa razy dwa 
Lata lecą a ja to wciąż ja 
Unikam odgrywania kiedy reggae prezentuje 
W jednym więc celu bądź co bądź operuje 
A skutek, wierz - 'Peace', pozytywny flow
podpisano Gutek 
Od A do Zet, od Zet do A 
Ja to ja to jasne jak dwa razy dwa 
Lata lecą a ja to wciąż ja 
Od A do Zet, od Zet do A 
Ja to ja to jasne jak dwa razy dwa 
Paktofonikę Gutek już zna"
15,Ja To Ja 2(Dokuadnie tak) ,"FOKUSMOK::
Idę o zakład, dokładnie tak, (aha),
To ja to ja 2, dokładnie tak
Nie jak inaczej raczej eej, dokładnie tak
Jak? Dokładnie tak... Jak? Dokładnie jak MAG
Idę o zakład, dokładnie tak, (aha),
To ja to ja 2, dokładnie tak
Nie jak inaczej raczej eej, dokładnie tak
Jak? Dokładnie tak... Jak? Dokładnie...

Patrz, patrz na to, bo to...o to,to co nocą rapem
Poeta za tematem, a ten rap poematem
„Ja to ja 2” dramatem, dokładnie tak
(Patrz, patrz) już od trzech lat emblematem fonii pakt trzech
Mag niech jak grzech pod boską opieką będzie
Jak z mafią włoską, nie zaczynaj, bo będzie spięcie
Rzucam zaklęcie, będę kim będę zawsze i wszędzie
Każde ujęcie, jak po skręcie nie błądzi w błędzie
Wysoki sądzie, eej jaki kurwa sąd? Sam jestem
STRAHO::
(Sprawdź, sprawdź)
FOKUSMOK::
Idź prosto wtedy, gdy rymy manifestem
Ja kontra system, zawodowo i ponad miastem
Pomysły bystre i wstręt przed natrętnym padactwem
Robię swoje jak Acne nocne akcje na kompie
Wiem, że mam rację i jestem pewien, że on wie
Co nie, Mag? Blisko jak EMAG mnie codziennie
Skupiam się jak ognisko na tym, co siedzi we mnie
Widząc schematy wszędzie
Znasz to, nie? Dokładnie tak, niezmiennie ja
Od lat świat, squad, Paktofonika, kojarzysz to tak jak smak toffika
Od razu zoom, liryka, która mordę zatyka
Boom!
He... N I G D Y W T L E
Dla mnie H I P – H O P... nie ?
Intymnie, śledzi się, jak rachunki do skrzynki, co nie? Te?

Idę o zakład, dokładnie tak, (aha),
To ja to ja 2, dokładnie tak
Nie jak inaczej raczej eej, dokładnie tak
Jak? Dokładnie tak... Jak? Dokładnie jak MAG
Idę o zakład, dokładnie tak, (aha),
To ja to ja 2, dokładnie tak
Nie jak inaczej raczej eej, dokładnie tak
Jak? Dokładnie tak... Jak?

STRAHO::
Patrz, patrz
Dokładnie tak, Straho tera naciera
Sprawdź jak MAG wpływ wywiera
Nieraz, drzwi otwieram, tam pustka dech zapiera
I cholera... mi na płacz się zbiera
Los sam wybiera, bezkompromisowo, jak hera straszna afera
Sprawdź... pękła bariera
To jebana kariera rapera, rana w sercu konesera, nowa era
„Ja to ja 2” tragizm zawiera
Pełen magii, dzień za dniem silniejszy niczym dragi
Patrz, patrz, to nie koniec sagi
Dokładnie tak, w smutku zatopiony jak wrak
Sił brak, mobilizacja, powrót na track,
Bo to kocham, mimo iż wewnątrz szlocham
To radocha z bycia sobą i na prochach
Niezmienny T Z N. ja to ja
Odmienny C D N. R A H
Senny wyraz twarzy, muza ta
Kamienny, pakt zawarła, wciąż gra
Paktofonika trafia celnie w przeciwnika
Paktofonika usta szczelnie pozamyka
Paktofonika N I G D Y na dnie
Paktofonika D O bre no te"
16,Jak to ,"Chcieliśmy dzisiaj... 
Przestawić wam... 
Muzykę... 
Muzykę... 
Muzykę...
Muzykę... 
Muzykę...

1. Fokus: 
Jak to, co to za muzyka 
Jak to, jaka to klika 
Jak to, czyja liryka 
Jak to, to gówno nie ma odpowiednika 
Jak to, to to Paktofonika 
Jak to, co to za muzyka 
Jak to, jaka to klika 
Jak to, czyja liryka 
Jak to, to gówno nie ma odpowiednika 
Jak to, to to Paktofonika"
17,Jestem ,"Freestyle, nie?
O tym mówiłeś?
Czy jaką zwrotkę?
Tutaj do tego?
MAGIK:
Do domu daleko, do rymów mi jest blisko.
Nie podoba ci się no to to proszę idź stąd.
Teraz ja przyszłość swą widzę mglistą.
Nie, tak jaśnistą, umm zajebistą. 
Wiesz o czym gadam.
Jestem tu z rymów listą, nie Schindlera**. 
Tak tera, ja nie frajera masz przed sobą.
Jestem jedną osobą.
Mówią o mnie, że jestem eM A Gie IKa i ja, testuję mikrofon testem.
Właśnie tak gada zajebiście.
Aaa...
Pizda...
Klatka...
Kurwa...
Hehe...

FOKUS:
Co za gadka*.
Właśnie tak.
bla,bla,bla...
Dobra, teksty, ej!
Ja nie mogę freestyle'ować, ale może mi się chcieć.
Żeby chcieć muszę wydawać, żeby wydawać muszę mieć.
Więc nie mogę siedzieć,  muszę wszystko wiedzieć.
Co, jak i gdzie dzieje się w KaCe.
Gdzie malowanie*[?]. 
W barwach zostanie. 

FOKUS:
Do kawy na ławie zapodawana śmietana,
Od-d-d-dana cześć gość upada na kolana,
Treść wydobywana na sześć, 
Wieść się niesie, kolesie gadają do rana,
To jak znieść H-I-P-H-O-P i Z-G-O-P,
Niepohamowana fala zawiści,
Stary, chuj ci w dupę, a niech Cię sczyści,
Indywidualiści ze śląska to specjaliści,
Specjalizacja wąska, nawiązka do korzyści,
Tyle ile gałązka ma liści KaCe ma MC,
siedzą w tym jak zęby w szczęce i są zajebiści.
I są zajebiści, tylko nie potrafią freestyle'ować, ale spoko.

MAGIK:
To nie był freestyle, to był tekst.
Hehe...
Każdy ma to wiedzieć.
To była liryka napisana, a nie freestyle.
Hehe...
Ja też mogę coś zarapować.
A co ja mam zarapować za tekst,kurwa,  żeby nie był gorszym..
To ja za rapuję...
Nie...

Bełkotam, mam kota.
Bełkotam, wiesz o czym gadam.
Tak łaskotam Cię po uchu.
Łaskotam Cię po małżowinie.
Właśnie tak.
To, um, nigdy nie minie.
Właśnie tak.
W tej rodzinie.
Pe eF Ka...
To mój brat, jeden, drugi brat.
To mój skład.
Wiesz o czym gadam.
Tak.
Jestem bez wad.
Wcale.
Każdy ma wady, ja mam ich doskonale.
 zajebiście wiele.
Moi przyjaciele o tym wiedzą.
Lecz je tolerują.
Nie jestem szują.
Staram się jak mogę.
Żeby nikomu nic...
Wiesz o czym gadam.
To nie wic.
Patrzy na mnie.
Patrzy moja dusza.
Spoglądam do lustra.
Faktycznie tak poruszam.
Swoje kwestie, które we mnie drzemią.
Trzeba rozwikłać je, na daremno.
Jest mowa i nowa zajawka młodzieżowa.
To Ha I Pe-Ha O Pe, tak.
Chociaż techniawka ją wypycha.
Ale ja mam to gdzieś, ponieważ u licha, do licha.
Wiele...

[Nara, nara, pełna para]"
